publisher,genres,developers,description,title,url,review_link,price,ign_score,platforms,release_date,related_games,community_score_phrase,community_score,rating_content,rating_category,ign_score_phrase
Sony Computer Entertainment,Adventure,SIE Japan Studio,"A TV crew from America arrive to research and film an exposé on the urban myth of Hanuda, the Vanished Village, where human sacrifices are said to have taken place.

Hanuda is a dark, eerie world, frozen in the 1970s and surrounded by a red sea. An ancient curse has been set upon the town and you, as the visitors, must save the remaining inhabitants including the beautiful Miyako. In order to survive you must defend yourself from the vicious Shibito, or living dead, and other terrifying monsters.

Siren: Blood Curse is split into 12 episodes, each with an opening and ending sequence, and each comprised of parallel scenarios for multiple characters.",Siren: Blood Curse -- Episodes 1-4,http://www.ign.com/games/siren-blood-curse-retail-edition/ps3-14255212,http://ps3.ign.com/articles/895/895975p1.html,,7.0,PS3,"July 24, 2008","http://www.ign.com/games/life-is-strange-episode-4/ps3-20031274,http://www.ign.com/games/the-walking-dead-the-game/ps3-100887,http://www.ign.com/games/life-is-strange-episode-5/ps3-20031280,http://www.ign.com/games/grand-theft-auto-online/ps3-20006859,http://www.ign.com/games/metal-gear-online-mgs5/ps3-20028682,http://www.ign.com/games/the-elder-scrolls-v-skyrim-dragonborn/ps3-146419",Good,7.6,"Blood, Intense Violence, Strong Language",M for Mature,Good
Takara,Fighting,SNK [1978-2001],"A downloadable version of the 1992 NeoGeo game, provided through Nintendo's Virtual Console service.

Fatal Fury 2 is the second installment in the renowned fighting-game series. In addition to Terry, Andy and Joe, who appeared in the original game, another five distinctive fighters gather from around the world to compete for the championship title. Also newly added are stage-specific hazards and the ability to perform desperation attacks when a character's strength is low. These particularly deadly techniques create the chance for a come-from-behind victory achieved with a single strike.

Moreover, the innovative two-line battle, which proved popular in the previous version, also has been radically enhanced. Pressing the weak-attack and strong-attack buttons simultaneously enables players to move their fighters to another line themselves, or to launch an attack that pushes opponents back to another line. This game mechanic, unique to this title in the series, allows the player to take advantage of the depth of the screen and create even more exciting bouts. Can you prove yourself the king of fighters again?",Fatal Fury 2,http://www.ign.com/games/fatal-fury-2/wii-14260441,http://wii.ign.com/articles/894/894157p1.html,9 USD,7.5,Wii Xbox One Gen X68000 Arcade NG SNES TG16,"June 20, 2008","http://www.ign.com/games/super-smash-bros-brawl/wii-748545,http://www.ign.com/games/project-m/wii-132552,http://www.ign.com/games/pokemon-rumble/wii-14356297,http://www.ign.com/games/the-legend-of-zelda-ocarina-of-time/wii-865246,http://www.ign.com/games/the-last-story/wii-59789,http://www.ign.com/games/the-legend-of-zelda-skyward-sword/wii-872155",Good,7.9,"Animated Blood, Violence",T for Teen,Good
Capcom,Action,Capcom Production Studio 1,"Long ago the Dark Knight Sparda rebelled against the dark emperor and waged a one-man war to save humanity. Thousands of years later, a religious organization worships this renowned savior and has taken it upon themselves to rid the world of all evil. Residing in Fortuna, this organization is known as the ""Order of the Sword,"" and is made up of an elite group of ""Holy Knights."" One day a young knight named Nero witnesses Sparda's legendary son Dante slaughter his fellow warriors. Has the renowned devil hunter turned his back on mankind? What does this encounter mean for these two individuals?

In Devil May Cry 4, players control the formidable Nero who comes to grips with his newly found power as his beliefs and allegiance are tested.  Continuing the legacy of fast paced action synonymous with the series, Devil May Cry 4 pushes the envelope of excellence even further with the inclusion of a new combat system that incorporates Nero's ""Devil Bringer."" This new feature has players delivering overwhelming damage to enemies with non-stop combos, while gaining new power for Nero's right arm.",Devil May Cry 4,http://www.ign.com/games/devil-may-cry-4/pc-894665,http://pc.ign.com/articles/893/893228p1.html,39.99 USD,8.0,PC Xbox 360 PS3,"July 8, 2008","http://www.ign.com/games/grand-theft-auto-online/pc-20019837,http://www.ign.com/games/metal-gear-solid-5/pc-20023125,http://www.ign.com/games/resident-evil-7/pc-20054862,http://www.ign.com/games/grand-theft-auto-online/pc-20019837,http://www.ign.com/games/mass-effect-andromeda/pc-20034220,http://www.ign.com/games/the-witcher-3-wild-hunt-blood-and-wine/pc-20035505",Great,8.3,"Blood, Language, Sexual Themes, Violence",M for Mature,Great
Sunsoft,Action,Sunsoft,"The Joker is on the loose and the only person who can stop him is, of course, Batman. You will take the role of the caped crusader as you try to save Gotham from the Jokers evil plans. You will have to run and jump through a series of levels while taking out the Joker's henchmen along the way.",Batman,http://www.ign.com/games/batman/gen-6204,http://retro.ign.com/articles/893/893186p1.html,,6.0,Gen C64 ZX CPC Amiga GB PC TG16,"Oct 1, 1990","http://www.ign.com/games/streets-of-rage-1/gen-6624,http://www.ign.com/games/streets-of-rage-3/gen-6626,http://www.ign.com/games/desert-strike-return-to-the-gulf/gen-6419,http://www.ign.com/games/sonic-the-hedgehog-2/gen-1344,http://www.ign.com/games/shining-force-ii/gen-6302,http://www.ign.com/games/sonic-knuckles/gen-1334",Good,7.4,,,Okay
Capcom,Sports,Camelot Software Planning,"We Love Golf transforms the Wii Remote into a virtual set of golf clubs, creating the most immersive golfing experience available off the greens. The game presents a realistic golfing experience with a fresh new spin incorporating the Wii Remote's unique motion-sensing functionality. Players will use the controller to choose clubs, line up shots, swing and even add a touch fade or draw with a flick of the wrist. Just as on a real course, gauging wind conditions, correct club selection and careful reading of the greens are all essential for victory. A variety of game modes, multiple characters, and unlockable content will provide endless hours of putting heaven.

We Love Golf! is also the first online capable golf game for Wii and includes a full array of online features, like ""World Play Mode,"" where gamers can play random players online and collect medals for their wins. There's also ""Friend Play,"" where players may can challange a friend from their Wii friend list. Players can even use their personalized Miis.",We Love Golf!,http://www.ign.com/games/we-love-golf-142346/wii-959941,http://wii.ign.com/articles/893/893176p1.html,49.99 USD,7.4,Wii,"July 15, 2008","http://www.ign.com/games/wii-sports/wii-826987,http://www.ign.com/games/wii-sports-resort/wii-14266992,http://www.ign.com/games/fifa-2013/wii-115690,http://www.ign.com/games/the-legend-of-zelda-ocarina-of-time/wii-865246,http://www.ign.com/games/the-last-story/wii-59789,http://www.ign.com/games/the-legend-of-zelda-skyward-sword/wii-872155",Great,8.1,Mild Suggestive Themes,E10+ for Everyone 10 and older,Good
Atlus,Action,Ninja Studio,"Izuna and her gang are back -- and just in time for a wedding! Lured by the promise of free food (Why else would Izuna attend?), the festive event becomes a puzzling mystery when Izuna's sidekick Shino suddenly disappears, off in search of her long-lost sister. And making matters worse, the foreign gods have also arrived on Japanese soil, and they aren't very happy with the meddlesome, unemployed ninja. With disgruntled deities on the warpath, a sidekick to track down, and a missing sister out in the wild, it could all shape up to be one of Izuna's more exciting adventures. Sounds like a lot of work for a girl out of a job!",Izuna 2: The Unemployed Ninja Returns,http://www.ign.com/games/izuna-2-the-unemployed-ninja-returns/nds-965744,http://ds.ign.com/articles/892/892332p1.html,29.99 USD,6.0,NDS,"July 22, 2008","http://www.ign.com/games/the-legend-of-zelda-phantom-hourglass/nds-694756,http://www.ign.com/games/the-legend-of-zelda-spirit-tracks/nds-14333936,http://www.ign.com/games/kingdom-hearts-3582-days/nds-964462,http://www.ign.com/games/pokemon-conquest/nds-125156,http://www.ign.com/games/kingdom-hearts-3582-days/nds-964462,http://www.ign.com/games/kingdom-hearts-coded/nds-14354710,http://www.ign.com/games/pokemon-black-version-2/nds-129224,http://www.ign.com/games/pokemon-conquest/nds-125156,http://www.ign.com/games/pokemon-white-version-2/nds-129228",Good,7.9,"Mild Fantasy Violence, Mild Language, Suggestive Themes",T for Teen,Okay
Microsoft,Music,Little Boy Games,"Take on DJ Scruffy and his Beatniks in the ""All City Break Steady Tournament"". The debut title from independent developer Little Boy Games, Go! Go! Break Steady combines music breakdancing and puzzle gameplay for crazy block-rocking play beats.  Break it down in all 30 rounds of the Break Steady Tournament. Play solo, cooperate with friends, or challenge the world with your rhythm and smarts!",Go! Go! Break Steady,http://www.ign.com/games/go-go-break-steady/xbox-360-14236425,http://xboxlive.ign.com/articles/892/892883p1.html,10 USD,7.3,Xbox 360,"July 23, 2008","http://www.ign.com/games/dance-central-3/xbox-360-135601,http://www.ign.com/games/guitar-hero-live/xbox-360-20035853,http://www.ign.com/games/rock-band-blitz/xbox-360-131273,http://www.ign.com/games/grand-theft-auto-online/xbox-360-20006860,http://www.ign.com/games/metal-gear-online-mgs5/xbox-360-20028684,http://www.ign.com/games/halo-4/xbox-360-110563",Okay,6.3,,E for Everyone,Good
Game Factory,Adventure,Neko Entertainment,"An adventure/RPG based on the 3D animated action-adventure television series, Code Lyoko is about a group of students who uncover a parallel universe called Lyoko inside a super-computer that is threatened by a virus that could destroy the universe. Four ordinary students -- Jeremy, Odd, Ulrich and Yumi -- must help a virtual humanoid creature named ""Aelita"" to stop rogue computer XANA's latest attack on their real world. Code Lyoko combines high-tech gadgetry and adrenaline-packed missions in an innovative blend of adventure, combat, platform and space shooting gameplay.",Code Lyoko: Quest for Infinity,http://www.ign.com/games/code-lyoko-quest-for-infinity/psp-952313,http://psp.ign.com/articles/892/892837p1.html,29.99 USD,4.8,PSP Wii PS2,"July 15, 2008","http://www.ign.com/games/silent-hill-origins/psp-826999,http://www.ign.com/games/the-3rd-birthday/psp-14271452,http://www.ign.com/games/monster-hunter-freedom-unite/psp-964982,http://www.ign.com/games/final-fantasy-vii/psp-14340290,http://www.ign.com/games/final-fantasy-viii/psp-33571,http://www.ign.com/games/resident-evil-3-nemesis/psp-18950",Good,7.9,Mild Fantasy Violence,E10+ for Everyone 10 and older,Bad
Konami,Puzzle,Voltex,"Prepare for a true crossword challenge as you test your skills in Coffeetime Crosswords. Try for the high score as you progress through more than 150 crosswords developed by Penny Press. Play together with a friend in co-op mode and help each other solve the crosswords. Gather your wits, prepare yourself to be entertained, and challenge your crossword prowess.",Coffeetime Crosswords,http://www.ign.com/games/coffeetime-crosswords/xbox-360-14265760,http://xboxlive.ign.com/articles/892/892770p1.html,,3.5,Xbox 360,"July 16, 2008","http://www.ign.com/games/valiant-hearts-the-great-war/xbox-360-20005426,http://www.ign.com/games/quantum-conundrum/xbox-360-116552,http://www.ign.com/games/vessel/xbox-360-116771,http://www.ign.com/games/krissx/xbox-360-14265704,http://www.ign.com/games/grand-theft-auto-online/xbox-360-20006860,http://www.ign.com/games/metal-gear-online-mgs5/xbox-360-20028684,http://www.ign.com/games/halo-4/xbox-360-110563",Okay,6.7,Alcohol and Tobacco Reference,E for Everyone,Awful
Glu Mobile,Action,Glu Mobile,"In Space Monkey, space has been consumed by Earth's garbage and it's up to one courageous monkey to clean up the entire cosmos. By spinning Space Monkey throughout the galaxy, gamers must help Space Monkey grab junk, deflect hazards and take down the biggest, baddest space enemies of them all.",Space Monkey,http://www.ign.com/games/space-monkey/iphone-14265688,http://wireless.ign.com/articles/892/892456p1.html,9.99 USD,7.5,iPhone Cell,"July 10, 2008","http://www.ign.com/games/lego-batman-3-beyond-gotham/iphone-20031090,http://www.ign.com/games/disney-infinity-3/iphone-20036726,http://www.ign.com/games/the-lego-movie-videogame/iphone-20030673,http://www.ign.com/games/fallout-shelter/iphone-20038711,http://www.ign.com/games/lego-batman-3-beyond-gotham/iphone-20031090,http://www.ign.com/games/the-walking-dead-the-game/iphone-150119",Good,7.5,,,Good
THQ,Action,Asobo Studio,"Race, fly and shoot as you take futuristic robots WALL-E and EVE through a fast-paced adventure. From the desolate waste-lands of Earth to the Axiom space cruiser, throw cubes and blast robots and obstacles while you relive some of the movie's most thrilling moments and explore worlds filled with non-stop action and adventure, along with head-to-head multiplayer challenges. Dodge dangerous enemies, carry out intense missions and navigate your way through a futuristic galaxy!",WALL-E,http://www.ign.com/games/wall-e/pc-14212886,http://pc.ign.com/articles/886/886527p1.html,19.99 USD,7.5,PC Wii PS3 PS2 Cell NDS PS3 PSP Mac Xbox 360,"June 24, 2008","http://www.ign.com/games/grand-theft-auto-online/pc-20019837,http://www.ign.com/games/metal-gear-solid-5/pc-20023125,http://www.ign.com/games/resident-evil-7/pc-20054862,http://www.ign.com/games/resident-evil-7/pc-20054862,http://www.ign.com/games/rise-of-the-tomb-raider/pc-20020150,http://www.ign.com/games/assassins-creed-black-flag/pc-159976,http://www.ign.com/games/grand-theft-auto-online/pc-20019837,http://www.ign.com/games/mass-effect-andromeda/pc-20034220,http://www.ign.com/games/the-witcher-3-wild-hunt-blood-and-wine/pc-20035505",Good,7.4,Mild Cartoon Violence,E for Everyone,Good
Activision,Music,Budcat Creations,"Guitar Hero: Aerosmith puts players in the shoes of Perry (guitar), Whitford (guitar) and Hamilton (bass)as they rock out alongside frontman Tyler and drummer Kramer. Gamers experience Aerosmith's legendary career, from their first gig to becoming rock royalty.

As players progress through the game, they can rock out to scores of Aerosmith's greatest hits, as well as songs from celebrated artists that the band has either performed with or has been inspired by in some way. Venues from historical moments during the band's illustrious career offer the experience of ""sweet emotion"" and further capture the essence of the band's rise to fame.",Guitar Hero: Aerosmith,http://www.ign.com/games/guitar-hero-aerosmith/ps2-14235708,http://ps2.ign.com/articles/886/886166p1.html,49.99 USD,7.0,PS2 Wii Mac PS3 Xbox 360 PC,"June 29, 2008","http://www.ign.com/games/amplitude/ps2-17285,http://www.ign.com/games/guitar-hero-ii/ps2-823033,http://www.ign.com/games/guitar-hero-iii-legends-of-rock/ps2-899095,http://www.ign.com/games/shin-megami-tensei-persona-4/ps2-14241813,http://www.ign.com/games/god-of-war-ii/ps2-811719,http://www.ign.com/games/god-of-war-ii/ps2-888576",Good,7.6,"Lyrics, Mild Suggestive Themes",T for Teen,Good
Midway  Games,"First-Person, Shooter",Epic Games,"The Necris invasion has begun, and your clan was one of the first to be slaughtered.  Head to the front lines and join this Epic battle to defend humanity while taking your revenge. Unreal Tournament 3 marks the return of the premiere tournament-style first-person shooter.  Unreal Tournament 3 unleashes the full power of Unreal Engine 3, taking graphics, gameplay, and challenge to a whole new level. Players engage in intense and hyper-real battles with other human players online or against incredibly realistic Unreal artificial intelligence. Over two dozen weapons and vehicles have been upgraded and enhanced for maximum killing potential. Take on all comers in a variety of game modes including Deathmatch, Team Deathmatch, Capture the Flag, an all-new Warfare mode and more.",Unreal Tournament III,http://www.ign.com/games/unreal-tournament-iii/xbox-360-746631,http://xbox360.ign.com/articles/886/886187p1.html,59.99 USD,8.5,Xbox 360 PC PS3,"July 7, 2008","http://www.ign.com/games/halo-4/xbox-360-110563,http://www.ign.com/games/gears-of-war-judgment/xbox-360-135402,http://www.ign.com/games/borderlands-2-the-horrible-hunger-of-the-ravenous-wattle-gobbler/xbox-360-20007855,http://www.ign.com/games/grand-theft-auto-online/xbox-360-20006860,http://www.ign.com/games/metal-gear-online-mgs5/xbox-360-20028684,http://www.ign.com/games/halo-4/xbox-360-110563",Great,8.1,"Blood and Gore, Intense Violence, Strong Language",M for Mature,Great
Gamecock,Action,"Crackpot Entertainment, Creat Studios","Insecticide is a hard-boiled, fast-shooting detective game set in a festering future city where bugs have evolved as the planet's dominant race. A murder at the powerful Nectarola soft drink company leads police from the Insecticide Squad on a bug hunt through the city's seedy underbelly, and into a mystery of epic proportions.

Join Detective Chrys Liszt and partner Roachy Caruthers on the case as they become entangled in a web of crime. It's an action-adventure in the truest sense of the word, immersing players in cinematic combat levels, as well as a story-based detective investigation. Players can interrogate suspects, interview witnesses and play good cop/bad cop to get the info needed to solve the case and win the game.",Insecticide Episode 1,http://www.ign.com/games/insecticide/pc-884630,http://pc.ign.com/articles/886/886126p1.html,14.99 USD,7.5,PC NDS,"June 27, 2008","http://www.ign.com/games/grand-theft-auto-online/pc-20019837,http://www.ign.com/games/metal-gear-solid-5/pc-20023125,http://www.ign.com/games/resident-evil-7/pc-20054862,http://www.ign.com/games/resident-evil-7/pc-20054862,http://www.ign.com/games/rise-of-the-tomb-raider/pc-20020150,http://www.ign.com/games/assassins-creed-black-flag/pc-159976,http://www.ign.com/games/grand-theft-auto-online/pc-20019837,http://www.ign.com/games/mass-effect-andromeda/pc-20034220,http://www.ign.com/games/the-witcher-3-wild-hunt-blood-and-wine/pc-20035505",Great,8.6,"Cartoon Violence, Crude Humor, Use of Tobacco",E10+ for Everyone 10 and older,Good
UFO Interactive,Shooter,Cyber Planet Interactive,"The hopes of the free peoples of New Earth rests in your hands! Developed in secret, it is up to you to unleash humanities last hope against the Chaos Empire. Pilot this top-secret attack fighter through swarms of enemy fighters, countless obstacles and destroy the war machine Crimson Star once and for all!",Underwater Attack,http://www.ign.com/games/underwater-attack/nds-14273015,http://ds.ign.com/articles/898/898016p1.html,19.99 USD,4.5,NDS,"July 15, 2008","http://www.ign.com/games/transformers-war-for-cybertron-autobots/nds-56054,http://www.ign.com/games/call-of-duty-modern-warfare-3-defiance/nds-114915,http://www.ign.com/games/call-of-duty-black-ops/nds-73946,http://www.ign.com/games/pokemon-black-version-2/nds-129224,http://www.ign.com/games/pokemon-conquest/nds-125156,http://www.ign.com/games/pokemon-white-version-2/nds-129228",Mediocre,5.5,Mild Fantasy Violence,E for Everyone,Bad
Capcom,Platformer,GRIN,"Classic side-scrolling gameplay is reporting back for duty with Bionic Commando Rearmed, a remake of the classic NES game. 20 years after the 8-bit classic was released, Bionic Commando Rearmed recreates the world of the original with a complete ""2.5D"" visual revamp. Bionic Commando Rearmed preserves the original's mix of swinging and shooting in an intense 2D side-scroller, all to the tune of a brand-new soundtrack based on the classic 8-bit music from the NES masterpiece.

But Rearmed is far more than just a remake - it features all-new modes such as the 2-player co-op play and also a special combat multiplayer mode, smarter enemy AI, new bionic arm abilities, new weapons, bigger bosses and online rankings. Faithfully sticking to the original story, Bionic Commando Rearmed tells the story of Nathan ""R.A.D."" Spencer's first mission, sent in to retrieve captured agent Super Joe from the hands of the Imperials. Fans of the original story can expect to see all the characters from the NES version, as well as the memorable moments that made the title so popular with fans.",Bionic Commando Rearmed,http://www.ign.com/games/bionic-commando-rearmed/xbox-360-14228706,http://xboxlive.ign.com/articles/897/897976p1.html,10 USD,9.4,Xbox 360 PC PS3,"August 13, 2008","http://www.ign.com/games/limbo/xbox-360-63756,http://www.ign.com/games/rayman-legends/xbox-360-159979,http://www.ign.com/games/fez/xbox-360-19159,http://www.ign.com/games/grand-theft-auto-online/xbox-360-20006860,http://www.ign.com/games/metal-gear-online-mgs5/xbox-360-20028684,http://www.ign.com/games/halo-4/xbox-360-110563",Great,8.4,"Blood and Gore, Language, Violence",M for Mature,Amazing
Third Wire,Flight,Third Wire,,Wings Over Israel,http://www.ign.com/games/wings-over-israel/pc-14270584,http://pc.ign.com/articles/897/897933p1.html,,8.0,PC,"February 18, 2008","http://www.ign.com/games/squadron-42/pc-20046151,http://www.ign.com/games/star-citizen/pc-144978,http://www.ign.com/games/microsoft-flight/pc-83711,http://www.ign.com/games/mechwarrior-online/pc-18954,http://www.ign.com/games/stardew-valley/pc-20001247,http://www.ign.com/games/omerta-city-of-gangsters-134706/pc-129676,http://www.ign.com/games/grand-theft-auto-online/pc-20019837,http://www.ign.com/games/mass-effect-andromeda/pc-20034220,http://www.ign.com/games/the-witcher-3-wild-hunt-blood-and-wine/pc-20035505",Amazing,9.0,,,Great
SouthPeak Games,Action,"Lexis Numerique, VectorCell","As the young but determined hero Mister Slime, players set off on an exhilarating adventure, trying to protect Slime Village from its evil enemies, the Axons.  Using the touch screen and stylus, players must navigate the levels by dragging and stretching Mister Slime's arms to grab hold of small anchor points scattered throughout the game.  Mister Slime features inventive uses of characteristics specific to Nintendo DS, including sound and shape recognition. As an example, players are able to blow on Mister Slime to make him fly in the air or to help him breathe under water.

Mister Slime features both single and multiplayer game modes with a huge variety of level design. All together, Mister Slime will keep gamers busy for hours trying to stretch and manipulate their way through the wonderful world of slime.",Mister Slime,http://www.ign.com/games/mister-slime/nds-14232863,http://ds.ign.com/articles/898/898011p1.html,29.99 USD,5.0,NDS,"July 23, 2008","http://www.ign.com/games/the-legend-of-zelda-phantom-hourglass/nds-694756,http://www.ign.com/games/the-legend-of-zelda-spirit-tracks/nds-14333936,http://www.ign.com/games/kingdom-hearts-3582-days/nds-964462,http://www.ign.com/games/pokemon-black-version-2/nds-129224,http://www.ign.com/games/pokemon-conquest/nds-125156,http://www.ign.com/games/pokemon-white-version-2/nds-129228",Great,8.0,,E for Everyone,Mediocre
Hudson Soft,Shooter,Hudson Soft,"Previously only available in Japan, this is a downloadable version of the classic 1992 Turbo Grafx-16/PC Engine game.

Star Parodier is the hilarious spoof of the classic Hudson shooter Star Soldier. In this parody, there are three playable ships for players to choose from: the ingratiating Paroceaser, the hot-headed Bomberman, and the ever-so-introverted PC-Engine. Players control one of these unique and original ships and set off to blast their way through eight stages on the planet Paroson! The comical characters take the color and flavor of the Soldier series to the next level and are guaranteed to leave players mesmerized. In addition to the normal game mode, there are also the familiar 2-minute and 5-minute attack modes, making Star Parodier the complete package that is sure to have players coming back for more.",Star Parodier,http://www.ign.com/games/star-parodier/wii-14256134,http://wii.ign.com/articles/897/897800p1.html,9 USD,8.0,Wii TG16,"August 11, 2008","http://www.ign.com/games/call-of-duty-modern-warfare-3/wii-114747,http://www.ign.com/games/goldeneye-007/wii-867280,http://www.ign.com/games/resident-evil-umbrella-chronicles/wii-827187,http://www.ign.com/games/the-legend-of-zelda-ocarina-of-time/wii-865246,http://www.ign.com/games/the-last-story/wii-59789,http://www.ign.com/games/the-legend-of-zelda-skyward-sword/wii-872155",Great,8.0,"Mild Cartoon Violence, Suggestive Themes",T for Teen,Great
