publisher,genres,developers,description,title,url,review_link,price,ign_score,platforms,release_date,related_games,community_score_phrase,community_score,rating_content,rating_category,ign_score_phrase
Nintendo,Puzzle,Mitchell Corporation,"The classic puzzle game Magnetica is now available on WiiWare, putting its own unique ""twist"" on the puzzle-game experience. You're surrounded by marbles, marching slowly but surely down a track. Use a launcher (piloted by a Mii of your choice) to shoot marbles with matching colors and wipe them out before they reach the end of the track. Control couldn't be simpler, as all you need to do is twist the Wii Remote controller to aim and press the A button to shoot.",Magnetica Twist,http://www.ign.com/games/magnetica-twist/wii-14209905,http://wii.ign.com/articles/885/885279p1.html,10 USD,7.0,Wii,"June 30, 2008","http://www.ign.com/games/boom-blox/wii-892269,http://www.ign.com/games/angry-birds/wii-82426,http://www.ign.com/games/world-of-goo/wii-14230233,http://www.ign.com/games/the-legend-of-zelda-ocarina-of-time/wii-865246,http://www.ign.com/games/the-last-story/wii-59789,http://www.ign.com/games/the-legend-of-zelda-skyward-sword/wii-872155",Okay,6.7,Comic Mischief,E for Everyone,Good
Activision,Music,Neversoft Entertainment,"Guitar Hero: Aerosmith puts players in the shoes of Perry (guitar), Whitford (guitar) and Hamilton (bass)as they rock out alongside frontman Tyler and drummer Kramer. Gamers experience Aerosmith's legendary career, from their first gig to becoming rock royalty.

As players progress through the game, they can rock out to scores of Aerosmith's greatest hits, as well as songs from celebrated artists that the band has either performed with or has been inspired by in some way. Venues from historical moments during the band's illustrious career offer the experience of ""sweet emotion"" and further capture the essence of the band's rise to fame.

This version of Guitar Hero: Aerosmith packs in a Guitar Hero controller for gamers to rock out right out of the box.",Guitar Hero: Aerosmith,http://www.ign.com/games/guitar-hero-aerosmith/xbox-360-14246450,http://xbox360.ign.com/articles/934/934669p1.html,99.99 USD,7.6,Xbox 360,"June 29, 2008","http://www.ign.com/games/dance-central-3/xbox-360-135601,http://www.ign.com/games/guitar-hero-live/xbox-360-20035853,http://www.ign.com/games/rock-band-blitz/xbox-360-131273,http://www.ign.com/games/grand-theft-auto-online/xbox-360-20006860,http://www.ign.com/games/metal-gear-online-mgs5/xbox-360-20028684,http://www.ign.com/games/halo-4/xbox-360-110563",Great,8.1,"Lyrics, Mild Suggestive Themes",T for Teen,Good
Activision,Music,Neversoft Entertainment,"Guitar Hero: Aerosmith puts players in the shoes of Perry (guitar), Whitford (guitar) and Hamilton (bass)as they rock out alongside frontman Tyler and drummer Kramer. Gamers experience Aerosmith's legendary career, from their first gig to becoming rock royalty.

As players progress through the game, they can rock out to scores of Aerosmith's greatest hits, as well as songs from celebrated artists that the band has either performed with or has been inspired by in some way. Venues from historical moments during the band's illustrious career offer the experience of ""sweet emotion"" and further capture the essence of the band's rise to fame.",Guitar Hero: Aerosmith,http://www.ign.com/games/guitar-hero-aerosmith/ps3-14229604,http://ps3.ign.com/articles/885/885185p1.html,59.99 USD,7.6,PS3 Wii PS2 Xbox 360 Mac PC,"June 29, 2008","http://www.ign.com/games/amplitude-hd/ps3-20017510,http://www.ign.com/games/guitar-hero-live/ps3-20035854,http://www.ign.com/games/rock-band-blitz/ps3-131270,http://www.ign.com/games/grand-theft-auto-online/ps3-20006859,http://www.ign.com/games/metal-gear-online-mgs5/ps3-20028682,http://www.ign.com/games/the-elder-scrolls-v-skyrim-dragonborn/ps3-146419",Good,7.2,"Lyrics, Mild Suggestive Themes",T for Teen,Good
Gameloft,Simulation,Gameloft,Players assume the role of a wagon leader and must make strategic decisions to ensure the safety of their party along the treacherous Oregon Trail route.,The Oregon Trail,http://www.ign.com/games/the-oregon-trail/cell-14252193,http://wireless.ign.com/articles/884/884402p1.html,,8.0,Cell DSi Mac PC 3DS Apple-II Wii WinPhone Android iPhone,"June 10, 2008","http://www.ign.com/games/the-sims-3-ambitions/cell-64052,http://www.ign.com/games/the-sims-3-world-adventures/cell-23330,http://www.ign.com/games/townsmen-2004/cell-705542,http://www.ign.com/games/baldurs-gate/cell-688224,http://www.ign.com/games/puzzle-quest-challenge-of-the-warlords/cell-950646,http://www.ign.com/games/just-cause-2/cell-14280725",Good,7.1,,,Great
Aspyr,"Real-Time, Strategy","Hellbent Games, Gas Powered Games","For a millennium war has raged between the United Earth Federation, the Cybran Nation and the Aeon Illuminate. Unwavering, dramatically opposing systems of belief have locked the three forces of humanity into a bitter, merciless conflict that has come to be known as the Infinite War. Now, after centuries of struggle, a war that has torn the galaxy asunder has finally reached a turning point. A leader has risen above all others, and only this Supreme Commander holds the key to ending the Infinite War once and for all.

The groundbreaking game puts players in command of one of three factions -- the United Earth Federation, the Cybran Nation or the Aeon Illuminate – that they must lead to victory and end the thousand-year Infinite War. Featuring a newly designed, intuitive console control scheme, Supreme Commander offers gameplay on an unprecedented scale. A revolutionary Strategic Zoom control allows for immediate viewing and command of entire armies as gamers battle through one of the three vast campaigns or against online enemies. Xbox 360-exclusive units, new online game modes and updated maps will bolster Xbox Live play as gamers wage war against opponents around the globe.",Supreme Commander,http://www.ign.com/games/supreme-commander/xbox-360-14218001,http://xbox360.ign.com/articles/883/883974p1.html,59.99 USD,4.5,Xbox 360 PC,"June 23, 2008","http://www.ign.com/games/xcom-enemy-unknown/xbox-360-126074,http://www.ign.com/games/prison-architect/xbox-360-20048296,http://www.ign.com/games/halo-wars/xbox-360-857436,http://www.ign.com/games/grand-theft-auto-online/xbox-360-20006860,http://www.ign.com/games/metal-gear-online-mgs5/xbox-360-20028684,http://www.ign.com/games/halo-4/xbox-360-110563",Okay,6.8,"Comic Mischief, Fantasy Violence, Mild Language",E10+ for Everyone 10 and older,Bad
Greenwave,Hunting,Liquid Dragon Studios,"Battle 40-foot waves, storms, ice and a nearly 100-percent crew member injury rate in the dangerous hunt for undersea riches on the Bering Sea with the videogame based on the hit Discovery Channel series. The game lets gamers captain their own boat in the frenzied search for an undersea jackpot. Players select one of five real crab boats, including the Northwestern, Cornelia Marie and Sea Star -- all featured on the series, or create and customize their own boat. Gamers then recruit and lead their own crew from a roster of twenty real crab fishermen. Selecting the wrong boat or recruiting the wrong crew member can mean the difference between landing a Bering Sea jackpot or disaster. Lead your fatigued, hungry and hardworking crew in the strategic search for King Crab and Opilio Crab, while battling to secure your catch and livelihood before other captains and crews get to the crab first.",Deadliest Catch: Alaskan Storm,http://www.ign.com/games/deadliest-catch-14238002/xbox-360-14238000,http://xbox360.ign.com/articles/884/884468p1.html,59.99 USD,6.4,Xbox 360 PC Cell,"June 16, 2008","http://www.ign.com/games/cabelas-big-game-hunter-2012/xbox-360-112309,http://www.ign.com/games/rapala-tournament-fishing/xbox-360-855520,http://www.ign.com/games/cabelas-survival-shadows-of-katmai/xbox-360-114338,http://www.ign.com/games/grand-theft-auto-online/xbox-360-20006860,http://www.ign.com/games/metal-gear-online-mgs5/xbox-360-20028684,http://www.ign.com/games/halo-4/xbox-360-110563",Good,7.5,,T for Teen,Okay
Electronic Arts,Puzzle,,"The mobile version puts innovative Boom Blox gameplay on phones everywhere -- delivering engaging, fun, and groundbreaking action. For the first time in a mobile game, players will be able to create custom levels and share them with their friends directly from the phone, enjoying a rich, interactive community experience.",Boom Blox,http://www.ign.com/games/boom-blox/cell-14233670,http://wireless.ign.com/articles/884/884425p1.html,,7.0,Cell Wii,"May 6, 2008","http://www.ign.com/games/puzzle-quest-challenge-of-the-warlords/cell-950646,http://www.ign.com/games/3d-tower-bloxx-deluxe/cell-14232300,http://www.ign.com/games/xxx-puzzle/cell-761657,http://www.ign.com/games/tank-racer/cell-757425,http://www.ign.com/games/bubble-town-2/cell-41687,http://www.ign.com/games/frogger-puzzle/cell-781414,http://www.ign.com/games/baldurs-gate/cell-688224,http://www.ign.com/games/puzzle-quest-challenge-of-the-warlords/cell-950646,http://www.ign.com/games/just-cause-2/cell-14280725",Good,7.8,,,Good
Ubisoft,Music,,"Imagine Rock Star allows players to create a rock band and select who plays the drums, guitar, bass and piano. Each instrument has its own unique control using the Nintendo DS stylus. Players have the ability to customize the look of each band mate in order to become the most stylish rockers. Players can wirelessly jam with up to four of their friends, perform in concerts and earn money as the band works its way up the charts to the No. 1 spot to land its dream recording contract.",Imagine: Rock Star,http://www.ign.com/games/imagine-rock-star/nds-14242277,http://ds.ign.com/articles/884/884364p1.html,29.99 USD,3.2,NDS,"June 17, 2008","http://www.ign.com/games/elite-beat-agents/nds-826978,http://www.ign.com/games/band-hero/nds-22093,http://www.ign.com/games/korg-ds-10-plus/nds-18083,http://www.ign.com/games/pokemon-black-version-2/nds-129224,http://www.ign.com/games/pokemon-conquest/nds-125156,http://www.ign.com/games/pokemon-white-version-2/nds-129228",Painful,2.9,No Descriptors,E for Everyone,Awful
Capcom,RPG,Capcom Production Studio 2,"Geo Stelar and crew return to battle a whole host of UMA's (unidentified animated beings) and a new rival character appears named ""Rogue."" Amidst this new conflict, a mysterious organization emerges with plans to revive the ancient civilization of ""Mu"" by utilizing the force of an ancient heritage ""OOPArt."" It's up to Geo and his virus-busting buddy, Omega-Xis, to thwart this latest threat.",Mega Man Star Force 2: Zerker X Saurian,http://www.ign.com/games/mega-man-star-force-2-zerker-x-saurian/nds-960467,http://ds.ign.com/articles/886/886185p1.html,29.99 USD,5.0,NDS,"June 24, 2008","http://www.ign.com/games/pokemon-black-version-2/nds-129224,http://www.ign.com/games/pokemon-white-version-2/nds-129228,http://www.ign.com/games/pokemon-white-version/nds-69347,http://www.ign.com/games/pokemon-black-version-2/nds-129224,http://www.ign.com/games/pokemon-conquest/nds-125156,http://www.ign.com/games/pokemon-white-version-2/nds-129228",Great,8.4,Mild Cartoon Violence,E for Everyone,Mediocre
Conspiracy Entertainment,Racing,Neko Entertainment,"The holy cauldron of Cocoto has dissapeared! The imps are in danger of loosing all their powers! Their only chance to recover them is to beat all their opponents in a series of fierce kart races to win the prize: the mysterious cauldron!

Choose your pilot among 12 lively characters from the Cocoto universe. Collect crazy bonuses and race through 5 magical and perilous worlds! Test your driving skills in various modes: Championship, Time Challenge or Multiplayer (up to 4 players) and unlock hidden bonuses.",Cocoto Kart Racer,http://www.ign.com/games/cocoto-kart-racer/wii-14245407,http://wii.ign.com/articles/886/886153p1.html,19.99 USD,6.4,Wii GCN NDS PS2 GBA PC,"June 24, 2008","http://www.ign.com/games/mario-kart-wii/wii-949580,http://www.ign.com/games/need-for-speed-undercover/wii-14234991,http://www.ign.com/games/need-for-speed-nitro/wii-14319197,http://www.ign.com/games/mario-kart-wii/wii-949580,http://www.ign.com/games/boom-blox/wii-892269,http://www.ign.com/games/nba-jam/wii-56365,http://www.ign.com/games/the-legend-of-zelda-ocarina-of-time/wii-865246,http://www.ign.com/games/the-last-story/wii-59789,http://www.ign.com/games/the-legend-of-zelda-skyward-sword/wii-872155",Okay,6.6,No Descriptors,E for Everyone,Okay
THQ,Action,Savage Entertainment,"Race, fly and shoot as you take futuristic robots WALL-E and EVE through a fast-paced adventure. From the desolate waste-lands of Earth to the Axiom space cruiser, throw cubes and blast robots and obstacles while you relive some of the movie's most thrilling moments and explore worlds filled with non-stop action and adventure, along with head-to-head multiplayer challenges. Dodge dangerous enemies, carry out intense missions and navigate your way through a futuristic galaxy!",WALL-E,http://www.ign.com/games/wall-e/psp-14226081,http://psp.ign.com/articles/886/886214p1.html,29.99 USD,7.3,PSP Wii PS3 PS2 Cell NDS PS3 PC Mac Xbox 360,"June 24, 2008","http://www.ign.com/games/resident-evil-3-nemesis/psp-18950,http://www.ign.com/games/metal-gear-solid-peace-walker/psp-71143,http://www.ign.com/games/metal-gear-solid-peace-walker/psp-965242,http://www.ign.com/games/resident-evil-3-nemesis/psp-18950,http://www.ign.com/games/god-of-war-ghost-of-sparta/psp-735806,http://www.ign.com/games/lego-indiana-jones-the-original-adventures/psp-953318,http://www.ign.com/games/final-fantasy-vii/psp-14340290,http://www.ign.com/games/final-fantasy-viii/psp-33571,http://www.ign.com/games/resident-evil-3-nemesis/psp-18950",Okay,6.9,Mild Cartoon Violence,E for Everyone,Good
Activision,Music,Neversoft Entertainment,"Guitar Hero: Aerosmith puts players in the shoes of Perry (guitar), Whitford (guitar) and Hamilton (bass)as they rock out alongside frontman Tyler and drummer Kramer. Gamers experience Aerosmith's legendary career, from their first gig to becoming rock royalty.

As players progress through the game, they can rock out to scores of Aerosmith's greatest hits, as well as songs from celebrated artists that the band has either performed with or has been inspired by in some way. Venues from historical moments during the band's illustrious career offer the experience of ""sweet emotion"" and further capture the essence of the band's rise to fame.

This Limited Edition Bundle of Guitar Hero: Aerosmith packs in two -- count 'em two -- Guitar Hero controllers, one black and one red, for gamers to rock out in multiplayer right out of the box.",Guitar Hero: Aerosmith,http://www.ign.com/games/guitar-hero-aerosmith/ps2-14250800,http://ps2.ign.com/articles/944/944814p1.html,109.99 USD,7.0,PS2,"June 29, 2008","http://www.ign.com/games/amplitude/ps2-17285,http://www.ign.com/games/guitar-hero-ii/ps2-823033,http://www.ign.com/games/guitar-hero-iii-legends-of-rock/ps2-899095,http://www.ign.com/games/shin-megami-tensei-persona-4/ps2-14241813,http://www.ign.com/games/god-of-war-ii/ps2-811719,http://www.ign.com/games/god-of-war-ii/ps2-888576",Good,7.5,"Lyrics, Mild Suggestive Themes",T for Teen,Good
Activision,Music,Neversoft Entertainment,"Guitar Hero: Aerosmith puts players in the shoes of Perry (guitar), Whitford (guitar) and Hamilton (bass)as they rock out alongside frontman Tyler and drummer Kramer. Gamers experience Aerosmith's legendary career, from their first gig to becoming rock royalty.

As players progress through the game, they can rock out to scores of Aerosmith's greatest hits, as well as songs from celebrated artists that the band has either performed with or has been inspired by in some way. Venues from historical moments during the band's illustrious career offer the experience of ""sweet emotion"" and further capture the essence of the band's rise to fame.

This version of Guitar Hero: Aerosmith packs in a Guitar Hero controller for gamers to rock out right out of the box.",Guitar Hero: Aerosmith,http://www.ign.com/games/guitar-hero-aerosmith/ps3-14246452,http://ps3.ign.com/articles/934/934671p1.html,99.99 USD,7.6,PS3,"June 29, 2008","http://www.ign.com/games/amplitude-hd/ps3-20017510,http://www.ign.com/games/guitar-hero-live/ps3-20035854,http://www.ign.com/games/rock-band-blitz/ps3-131270,http://www.ign.com/games/grand-theft-auto-online/ps3-20006859,http://www.ign.com/games/metal-gear-online-mgs5/ps3-20028682,http://www.ign.com/games/the-elder-scrolls-v-skyrim-dragonborn/ps3-146419",Good,7.3,"Lyrics, Mild Suggestive Themes",T for Teen,Good
Activision,Music,Neversoft Entertainment,"Guitar Hero: Aerosmith puts players in the shoes of Perry (guitar), Whitford (guitar) and Hamilton (bass)as they rock out alongside frontman Tyler and drummer Kramer. Gamers experience Aerosmith's legendary career, from their first gig to becoming rock royalty.

As players progress through the game, they can rock out to scores of Aerosmith's greatest hits, as well as songs from celebrated artists that the band has either performed with or has been inspired by in some way. Venues from historical moments during the band's illustrious career offer the experience of ""sweet emotion"" and further capture the essence of the band's rise to fame.",Guitar Hero: Aerosmith,http://www.ign.com/games/guitar-hero-aerosmith/xbox-360-14229605,http://xbox360.ign.com/articles/885/885170p1.html,59.99 USD,7.6,Xbox 360 PS2 Wii Mac PS3 PC,"June 29, 2008","http://www.ign.com/games/dance-central-3/xbox-360-135601,http://www.ign.com/games/guitar-hero-live/xbox-360-20035853,http://www.ign.com/games/rock-band-blitz/xbox-360-131273,http://www.ign.com/games/grand-theft-auto-online/xbox-360-20006860,http://www.ign.com/games/metal-gear-online-mgs5/xbox-360-20028684,http://www.ign.com/games/halo-4/xbox-360-110563",Good,7.2,"Lyrics, Mild Suggestive Themes",T for Teen,Good
Paradox  Interactive,Strategy,BattleGoat Studios,"Developed by the Canadian studio Battlegoat studios, Supreme Ruler 2020 is a strategic and tactical geo-political game where direct control of the military and the policies of a nation becomes the key to survival.",Supreme Ruler 2020,http://www.ign.com/games/supreme-ruler-2020/pc-957868,http://pc.ign.com/articles/884/884728p1.html,39.99 USD,7.8,PC,"June 17, 2008","http://www.ign.com/games/halo-wars-2/pc-20041132,http://www.ign.com/games/starcraft-remastered/pc-20066763,http://www.ign.com/games/rome-total-war-2/pc-136961,http://www.ign.com/games/grand-theft-auto-online/pc-20019837,http://www.ign.com/games/mass-effect-andromeda/pc-20034220,http://www.ign.com/games/the-witcher-3-wild-hunt-blood-and-wine/pc-20035505",Good,7.7,Mild Violence,E10+ for Everyone 10 and older,Good
Bandai Namco Games,Fighting,Project Soul,"The highest rated console fighting game ever is back again for a new generation!  Sharpen your blades and relive old grudges against classic adversaries in high definition.  Prove your mettle against the world with a variety of leaderboards spanning every character and mode.  Match your wits and fighting instincts in Arcade, Training and Survival modes, or challenge a friend in local-play Versus mode.",Soulcalibur,http://www.ign.com/games/soulcalibur/xbox-360-14247598,http://xboxlive.ign.com/articles/885/885060p1.html,10 USD,8.1,Xbox 360 DC Arcade iPhone,"July 2, 2008","http://www.ign.com/games/dragon-ball-xenoverse/xbox-360-20018803,http://www.ign.com/games/dead-or-alive-5/xbox-360-866449,http://www.ign.com/games/tekken-tag-tournament-2/xbox-360-124581,http://www.ign.com/games/grand-theft-auto-online/xbox-360-20006860,http://www.ign.com/games/metal-gear-online-mgs5/xbox-360-20028684,http://www.ign.com/games/halo-4/xbox-360-110563",Great,8.4,"Animated Violence, Suggestive Themes",T for Teen,Great
Konami,Action,Krome Studios,"Hellboy provide players with fresh adventures featuring the unmistakable fusion of action, atmosphere and humor of the comic book and movie franchise. Hellboy uncovers a Nazi plot for world domination and must rush to defeat the crazed Hermann Von Klempt before he can exert his evil will upon a hapless world.  As a visceral brawler, the game lets players unleash Hellboy's superhuman abilities as they smash their way through hordes of enemies with contextual use of the environment for added destructive power and strategy.",Hellboy: The Science of Evil,http://www.ign.com/games/hellboy-the-science-of-evil/xbox-360-827013,http://xbox360.ign.com/articles/885/885085p1.html,59.99 USD,3.5,Xbox 360 PS3 PSP,"June 24, 2008","http://www.ign.com/games/grand-theft-auto-online/xbox-360-20006860,http://www.ign.com/games/metal-gear-online-mgs5/xbox-360-20028684,http://www.ign.com/games/metal-gear-solid-5/xbox-360-149842,http://www.ign.com/games/grand-theft-auto-online/xbox-360-20006860,http://www.ign.com/games/metal-gear-online-mgs5/xbox-360-20028684,http://www.ign.com/games/halo-4/xbox-360-110563",Mediocre,5.3,"Blood and Gore, Mild Language, Violence",T for Teen,Awful
Electronic Arts,"Real-Time, Strategy",EA Los Angeles,"An expansion pack to C&C3, Kane's Wrath returns to the Tiberium universe with Kane at the center of an epic new single player campaign. The expansion allows players to experience a new story that spans 20 years – from the rebirth of the Brotherhood of Nod after the Second Tiberium War through the dramatic events of the Third Tiberium War and beyond. The story is told through a new set of high-definition live action video sequences starring a celebrity cast.

Command & Conquer 3: Kane's Wrath also features a new strategic layer to gameplay that allows players to establish bases, build customized armies, and attack their enemies on a global scale – and then dive into the frenzied tactical combat where their skills as a commander will make the difference in battle. The game introduces six new sub-factions and a wealth of new units, structures, and powers to the armies of the Global Defense Initiative, the Brotherhood of Nod, and the enigmatic alien Scrin.",Command & Conquer 3: Kane's Wrath,http://www.ign.com/games/command-and-conquer-3-kanes-wrath/xbox-360-957212,http://xbox360.ign.com/articles/884/884885p1.html,39.99 USD,7.7,Xbox 360 PC,"June 23, 2008","http://www.ign.com/games/xcom-enemy-unknown/xbox-360-126074,http://www.ign.com/games/prison-architect/xbox-360-20048296,http://www.ign.com/games/halo-wars/xbox-360-857436,http://www.ign.com/games/grand-theft-auto-online/xbox-360-20006860,http://www.ign.com/games/metal-gear-online-mgs5/xbox-360-20028684,http://www.ign.com/games/halo-4/xbox-360-110563",Great,8.1,Violence,T for Teen,Good
"Funcom, Eidos Interactive","Persistent Online, Action",Funcom,"In a world filled with cruel gods, mythical creatures, lost civilizations and a struggling human race, the mighty barbarian has finally seized the throne as king of Aquilonia. But Conan's rule is on the brink of chaos, spiraling towards the doom of ancient evils. In this twisted fantasy world, dark magic and brutal combat lurks around every corner, and each man and woman must carve their own unique destiny under Conan's reign. In the true vision of Robert E. Howard's dark universe it's now time for you to become a messenger of death.

In addition to the game itself the box comes with an impressive art book, the original soundtrack, a bonus DVD, a faux leather map of Hyboria and additional gamekeys which can be given to MMO friends. The Collectors Edition also comes with priceless in-game items, making it a must-have item for any serious MMO gamer.",Age of Conan: Hyborian Adventures,http://www.ign.com/games/age-of-conan-hyborian-adventures/pc-958600,http://pc.ign.com/articles/886/886983p1.html,89.95 USD,7.8,PC,"May 20, 2008","http://www.ign.com/games/grand-theft-auto-online/pc-20019837,http://www.ign.com/games/metal-gear-solid-5/pc-20023125,http://www.ign.com/games/resident-evil-7/pc-20054862,http://www.ign.com/games/borderlands-2-the-horrible-hunger-of-the-ravenous-wattle-gobbler/pc-20007853,http://www.ign.com/games/dark-souls-3/pc-20038753,http://www.ign.com/games/nier-automata/pc-20057489,http://www.ign.com/games/grand-theft-auto-online/pc-20019837,http://www.ign.com/games/mass-effect-andromeda/pc-20034220,http://www.ign.com/games/the-witcher-3-wild-hunt-blood-and-wine/pc-20035505",Great,8.0,"Blood and Gore, Intense Violence, Language, Nudity, Sexual Themes",M for Mature,Good
Valcon Games,Racing,Milestone,"An authentic motorbike racing experience, SBK Superbike World Championship features official tracks and all 14 teams and 22 riders of the SBK circuit. Experience the thrill and danger of high speed motorbike racing along side 21 opponents. Players have control over the level of simulation, starting off with multiple riding aids, then as you grow comfortable, you can crank up the reality and excitement! Race amazing bikes at high speed in variable weather conditions.",Hannspree Ten Kate Honda SBK Superbike World Championship,http://www.ign.com/games/hannspree-ten-kate-honda-sbk-superbike-world-championship/psp-14228239,http://psp.ign.com/articles/884/884864p1.html,19.99 USD,6.0,PSP Xbox 360 PS2 Xbox 360 PS3 PC,"March 18, 2008","http://www.ign.com/games/twisted-metal-head-on/psp-682965,http://www.ign.com/games/need-for-speed-most-wanted-5-1-0/psp-740903,http://www.ign.com/games/wipeout-pure/psp-682962,http://www.ign.com/games/final-fantasy-vii/psp-14340290,http://www.ign.com/games/final-fantasy-viii/psp-33571,http://www.ign.com/games/resident-evil-3-nemesis/psp-18950",Okay,6.7,Mild Suggestive Themes,E10+ for Everyone 10 and older,Okay
