community_score,community_score_phrase,description,developers,genres,ign_score,ign_score_phrase,platforms,price,publisher,rating_category,rating_content,related_games,release_date,review_link,title,url
7.8,Good,"Torture chambers, naughty midnight missions in the dark and all the brutal slaughtering you can handle await in this sandbox-style samurai period action game. Admiral Perry has just opened Japan's borders to the British, allowing for a long-overdue globalization process to begin. Unfortunately, one of the open ports happens to be a modest Japanese burg called Amihama, where a resistance group known as the ""Disciples of Prajna"" have taken up arms against the arriving foreigners and all who support them.

As a lone samurai who's just arrived amidst the chaos, it's up to you whether you want to join forces with the Prajna resistance, fight alongside the foreigners in the name of progress or take your stance somewhere between the two by supporting the local government's attempts to quell the violence (through any means possible).",Acquire,Action,5.5,Mediocre,PS3 PC,39.99 USD,Xseed Games,M for Mature,,"http://www.ign.com/games/grand-theft-auto-online/ps3-20006859,http://www.ign.com/games/metal-gear-online-mgs5/ps3-20028682,http://www.ign.com/games/metal-gear-solid-5/ps3-149839,http://www.ign.com/games/assassins-creed-black-flag/ps3-161486,http://www.ign.com/games/grand-theft-auto-v/ps3-20594,http://www.ign.com/games/assassins-creed-iv-black-flag-freedom-cry/ps3-20009405,http://www.ign.com/games/grand-theft-auto-online/ps3-20006859,http://www.ign.com/games/metal-gear-online-mgs5/ps3-20028682,http://www.ign.com/games/the-elder-scrolls-v-skyrim-dragonborn/ps3-146419","August 21, 2012",http://www.ign.com/articles/2012/09/03/way-of-the-samurai-4-review,Way of the Samurai 4,http://www.ign.com/games/way-of-the-samurai-4/ps3-23516
6.9,Okay,"Capcom's classic fighting game returns in this HD reincarnation of the crazy title from Japan. The HD version offers improvements on the original with HD graphic upgrades (with a toggle to switch back to the original presentation) and online multiplayer.

Based on the popular comic book series, JoJo's Bizarre Adventure HD is an arcade fighter that lets you duke it out with your favorite characters from the comics. JoJo must travel to Egypt to find a cure for his sick mother. Each fighting character has his or her own Stand, a guardian spirit that aids in the battle. Unlike mortal humans though, Stands can reanimate quickly after defeat, so use this to your advantage as you try to defeat the evil Dio and his minions.",Capcom,Fighting,7.0,Good,Xbox 360 Arcade DC PS PS3 DC,20 USD,Capcom,T for Teen,"Violence, Suggestive Themes, Partial Nudity","http://www.ign.com/games/dragon-ball-xenoverse/xbox-360-20018803,http://www.ign.com/games/dead-or-alive-5/xbox-360-866449,http://www.ign.com/games/tekken-tag-tournament-2/xbox-360-124581,http://www.ign.com/games/grand-theft-auto-online/xbox-360-20006860,http://www.ign.com/games/metal-gear-online-mgs5/xbox-360-20028684,http://www.ign.com/games/halo-4/xbox-360-110563","August 22, 2012",http://www.ign.com/articles/2012/09/03/jojos-bizarre-adventure-hd-review,JoJo's Bizarre Adventure HD,http://www.ign.com/games/jojos-bizarre-adventure/xbox-360-137717
7.7,Good,"Capcom's classic fighting game returns in this HD reincarnation of the crazy title from Japan. The HD version offers improvements on the original with HD graphic upgrades (with a toggle to switch back to the original presentation) and online multiplayer.

Based on the popular comic book series, JoJo's Bizarre Adventure HD is an arcade fighter that lets you duke it out with your favorite characters from the comics. JoJo must travel to Egypt to find a cure for his sick mother. Each fighting character has his or her own Stand, a guardian spirit that aids in the battle. Unlike mortal humans though, Stands can reanimate quickly after defeat, so use this to your advantage as you try to defeat the evil Dio and his minions.",Capcom,Fighting,7.0,Good,PS3 Arcade DC PS DC Xbox 360,19.99 USD,Capcom,T for Teen,"Violence, Suggestive Themes, Partial Nudity","http://www.ign.com/games/dragon-ball-xenoverse/ps3-20018802,http://www.ign.com/games/tekken-tag-tournament-2/ps3-124584,http://www.ign.com/games/persona-4-arena/ps3-116910,http://www.ign.com/games/grand-theft-auto-online/ps3-20006859,http://www.ign.com/games/metal-gear-online-mgs5/ps3-20028682,http://www.ign.com/games/the-elder-scrolls-v-skyrim-dragonborn/ps3-146419","August 22, 2012",http://www.ign.com/articles/2012/09/03/jojos-bizarre-adventure-hd-review,JoJo's Bizarre Adventure HD,http://www.ign.com/games/jojos-bizarre-adventure/ps3-137896
8.3,Great,"Mass Effect 3: Leviathan is a downloadable content episode for Mass Effect 3.

Something lurks in the dark corners of space, something powerful enough to kill a Reaper. Shepard must discover the most closely guarded secret in the galaxy before the Reapers silence it forever.

Mass Effect 3: Leviathan expands upon the events of Mass Effect 3, with gripping and emotional storytelling, compelling new characters, and powerful weapons and upgrades. Unravel the dark history about the Reapers as you race across the galaxy to discover the Leviathan.",BioWare,RPG,7.5,Good,Xbox 360 PS3 PC,,Electronic Arts,M for Mature,,"http://www.ign.com/games/the-elder-scrolls-v-skyrim-dragonborn/xbox-360-146422,http://www.ign.com/games/mass-effect-3/xbox-360-14235014,http://www.ign.com/games/mass-effect-3/xbox-360-110694,http://www.ign.com/games/grand-theft-auto-online/xbox-360-20006860,http://www.ign.com/games/metal-gear-online-mgs5/xbox-360-20028684,http://www.ign.com/games/halo-4/xbox-360-110563","August 28, 2012",http://www.ign.com/articles/2012/08/31/mass-effect-3-leviathan-dlc-review-2,Mass Effect 3: Leviathan,http://www.ign.com/games/mass-effect-3-leviathan/xbox-360-138918
8.3,Great,"When a sinister conspiracy targets Commander Shepard, you and your team must uncover the truth, through battles and intrigue that range from the glamour of the Citadel's Wards to the top-secret Council Archives. Uncover the truth and fight alongside your squad – as well as the cast from the original Mass Effect and Mass Effect 2.",BioWare,RPG,7.5,Good,PS3 Xbox 360 PC,,Electronic Arts,M for Mature,,"http://www.ign.com/games/the-elder-scrolls-v-skyrim-dragonborn/ps3-146419,http://www.ign.com/games/mass-effect-3/ps3-14235017,http://www.ign.com/games/mass-effect-3/ps3-110697,http://www.ign.com/games/grand-theft-auto-online/ps3-20006859,http://www.ign.com/games/metal-gear-online-mgs5/ps3-20028682,http://www.ign.com/games/the-elder-scrolls-v-skyrim-dragonborn/ps3-146419","March 5, 2013",http://www.ign.com/articles/2012/08/31/mass-effect-3-leviathan-dlc-review-2,Mass Effect 3: Leviathan,http://www.ign.com/games/mass-effect-3-leviathan/ps3-138915
8.1,Great,"Mass Effect 3: Leviathan is a downloadable content episode for Mass Effect 3.

Something lurks in the dark corners of space, something powerful enough to kill a Reaper. Shepard must discover the most closely guarded secret in the galaxy before the Reapers silence it forever.

Mass Effect 3: Leviathan expands upon the events of Mass Effect 3, with gripping and emotional storytelling, compelling new characters, and powerful weapons and upgrades. Unravel the dark history about the Reapers as you race across the galaxy to discover the Leviathan.",BioWare,RPG,7.5,Good,PC Xbox 360 PS3,,Electronic Arts,M for Mature,,"http://www.ign.com/games/mass-effect-andromeda/pc-20034220,http://www.ign.com/games/the-witcher-3-wild-hunt-blood-and-wine/pc-20035505,http://www.ign.com/games/the-witcher-3/pc-134497,http://www.ign.com/games/grand-theft-auto-online/pc-20019837,http://www.ign.com/games/mass-effect-andromeda/pc-20034220,http://www.ign.com/games/the-witcher-3-wild-hunt-blood-and-wine/pc-20035505","August 28, 2012",http://www.ign.com/articles/2012/08/31/mass-effect-3-leviathan-dlc-review-2,Mass Effect 3: Leviathan,http://www.ign.com/games/mass-effect-3-leviathan/pc-138919
8.9,Great,"A spiritual successor to Demons Souls, the action RPG Dark Souls is set in a rich, dark fantasy universe. Intense action within the dungeons, encounters with terrifying enemies and innovative online features combine for a unique gaming experience. Dark Souls' world breaks down barriers with a fluid design encourages exploration and promotes an adaptation experience. At a time when the players come face to face with terrifying enemies and find new areas, the infallible system and reward challenge takes possession of everything to offer a sense of achievement without equal.

Enhanced with additional content for its PC debut, the Prepare to Die Edition of Dark Souls includes an enhanced PVP mode allowing players to more closely assemble battles against one another online in an all-out fight to the death that fans have demanded! In addition, the development team at FromSoftware has revealed an untold chapter in the world of Lordran created specifically to help further expand upon the lore of the game. 'Artorias of the Abyss' will include all-new areas to explore, enemies to encounter, and bosses to take down one by one as players are treated to an unseen side of Lordan where players must stop the spread of darkness at all costs by facing and defeating the Dark Knight Artorias. Players can also experience an online match-making feature that creates one vs.one, two vs. two and four-player battle royale scenarios, allowing gamers to showcase their skills against other Dark Souls players around the world.",FromSoftware,Action,9.0,Amazing,PC,,Bandai Namco Games,M for Mature,"Blood and Gore, Partial Nudity, Violence","http://www.ign.com/games/grand-theft-auto-online/pc-20019837,http://www.ign.com/games/metal-gear-solid-5/pc-20023125,http://www.ign.com/games/resident-evil-7/pc-20054862,http://www.ign.com/games/borderlands-2-the-horrible-hunger-of-the-ravenous-wattle-gobbler/pc-20007853,http://www.ign.com/games/dark-souls-3/pc-20038753,http://www.ign.com/games/nier-automata/pc-20057489,http://www.ign.com/games/grand-theft-auto-online/pc-20019837,http://www.ign.com/games/mass-effect-andromeda/pc-20034220,http://www.ign.com/games/the-witcher-3-wild-hunt-blood-and-wine/pc-20035505","August 24, 2012",http://www.ign.com/articles/2012/08/31/dark-souls-prepare-to-die-edition-review,Dark Souls (Prepare to Die Edition),http://www.ign.com/games/dark-souls-prepare-to-die-edition/pc-131930
7.4,Good,"Your music is under attack ... You must liberate it! In Symphony, you fight through levels uniquely generated by your own song collection, discover items and vanquish bosses to defeat the evil within!

Every song has a unique emotion, sound and rhythm, and the gameplay of Symphony aims to capture that as fully as possible via gameplay variety. When your music gets intense or calmer, so does the gameplay. Enemies appear and shoot on the beat of the music. Some weapons are music-driven. Each song has its personality and it directly translates into gameplay.

In Symphony, each song in your collection not only becomes a unique level, but also provides you with an item you can equip and challenges you with score targets to reach. As you progress through the game, you unlock new difficulty levels, new items and abilities! This means you have many reasons to play your favorite song over and over.",Empty Clip Studios,Shooter,7.0,Good,PC,,Empty Clip Studios,RP for Rating Pending,,"http://www.ign.com/games/ghost-recon-wildlands/pc-20038799,http://www.ign.com/games/tom-clancys-the-division/pc-20004178,http://www.ign.com/games/borderlands-2-the-horrible-hunger-of-the-ravenous-wattle-gobbler/pc-20007853,http://www.ign.com/games/grand-theft-auto-online/pc-20019837,http://www.ign.com/games/mass-effect-andromeda/pc-20034220,http://www.ign.com/games/the-witcher-3-wild-hunt-blood-and-wine/pc-20035505","August 6, 2012",http://www.ign.com/articles/2012/08/30/symphony-review,Symphony,http://www.ign.com/games/symphony/pc-136470
9.2,Amazing,"In this original action role-playing game set in a lush, imaginative world, players must create and fight for civilization's last refuge as a mysterious narrator marks their every move. The goal of Bastion is to construct a safe haven in the wake of the Calamity, a cataclysmic event that shattered the world into a series of floating islands. As players journey into the wild unknown in search of survivors and supplies, they will confront strange beasts, forge an array of customizable weapons, and gain new powers from specially-brewed spirits. The entire play experience of Bastion is dynamically narrated, gradually revealing a rich backstory as the narrator reacts to the player's actions in real time.",Supergiant Games,Action,9.0,Amazing,iPad Xbox 360 Xbox One PC Vita PS4,15 USD,Supergiant Games,E10+ for Everyone 10 and older,"Animated Blood, Fantasy Violence, Use of Alcohol and Tobacco","http://www.ign.com/games/grand-theft-auto-chinatown-wars/ipad-76976,http://www.ign.com/games/skylanders-superchargers/ipad-20037905,http://www.ign.com/games/disney-infinity-toy-box/ipad-20003925,http://www.ign.com/games/infinity-blade-dungeons/ipad-129751,http://www.ign.com/games/final-fantasy-tactics-the-war-of-the-lions-hd/ipad-114742,http://www.ign.com/games/the-bards-tale-2004/ipad-123264,http://www.ign.com/games/the-witness/ipad-23514,http://www.ign.com/games/the-walking-dead-the-game/ipad-100886,http://www.ign.com/games/hearthstone-heroes-of-warcraft/ipad-163238","August 30, 2012",http://www.ign.com/articles/2012/08/30/bastion-ipad-review,Bastion,http://www.ign.com/games/bastion/ipad-140874
