publisher,genres,developers,description,title,url,review_link,price,ign_score,platforms,release_date,related_games,community_score_phrase,community_score,rating_content,rating_category,ign_score_phrase
JoWooD Entertainment AG,Action,Reflexive Entertainment,"Zax is an action adventure that unfolds over one hundred maps in twenty-two missions. You are Zax and must battle alien cave dwellers, jungle creatures, and a variety of robots created by the evil Om. You will have guns from a light pistol to an impaction cannon and autonomous nuclear disruptor to kill the aliens.",Zax: The Alien Hunter,http://www.ign.com/games/zax-the-alien-hunter/pc-17008,http://pc.ign.com/articles/167/167008p1.html,,7.7,PC,"Oct 10, 2001","http://www.ign.com/games/grand-theft-auto-online/pc-20019837,http://www.ign.com/games/metal-gear-solid-5/pc-20023125,http://www.ign.com/games/resident-evil-7/pc-20054862,http://www.ign.com/games/grand-theft-auto-online/pc-20019837,http://www.ign.com/games/mass-effect-andromeda/pc-20034220,http://www.ign.com/games/the-witcher-3-wild-hunt-blood-and-wine/pc-20035505",Great,8.0,"Realistic Violence, Blood and Gore",T for Teen,Good
Konami,Simulation,,"Clearly, the folks who built the original park were guilty of a few oversights. Think you can do any better? Try your hand at plotting out all of the details of the creation and management of a dinosaur park in JURASSIC PARK III: Park Builder. A strategy-simulation title of the highest caliber, the game leaves you in charge of 100 dinosaur species you have the task of placing them and maintaining their health. Of course, there's also the matter of the restaurants, shops, rides, and other attractions. If the park you create is too boring, poorly maintained, or excessively expensive, no one will show up, so you'd better use some seriously discerning judgment. In addition to managing the park, you'll have to pick up DNA strands from throughout the park to create new dinosaurs to keep the people coming back. Does it sound like too much to handle? Just wait until one of your prehistoric pals escapes on opening day",Jurassic Park III: Park Builder,http://www.ign.com/games/jurassic-park-iii/gba-16443,http://gameboy.ign.com/articles/166/166443p1.html,22.99 USD,7.0,GBA PC Mac PC PC Arcade GBA Mac,September 2001,"http://www.ign.com/games/i-am-an-air-traffic-controller/gba-16034,http://www.ign.com/games/the-urbz-sims-in-the-city/gba-677548,http://www.ign.com/games/the-sims-bustin-out/gba-566910,http://www.ign.com/games/metroid-fusion/gba-16227,http://www.ign.com/games/pokemon-emerald-version/gba-692344,http://www.ign.com/games/pokemon-ruby-version/gba-17508",Good,7.1,Suitable for Persons Ages Six and Older,E for Everyone,Good
3DO,Sports,Mobius Entertainment,"3DO squeezes its popular

baseball series into a portable form. This GBA title features several different play modes. You can start off with batting practice or ply in the Home Run Derby. You can play Exhibition matches of variable innings, or take any team on a 16, 81, or full 162 game season.

also the 2001 team and player rosters, with licensed stadiums. Nine different pitches are available, as is an automatic fielding option.",High Heat Major League Baseball 2002,http://www.ign.com/games/high-heat-major-league-baseball-2002/gba-16311,http://gameboy.ign.com/articles/166/166311p1.html,7.99 USD,4.5,GBA GBC PS PC PS2,September 2001,"http://www.ign.com/games/mario-golf-advance-tour/gba-550432,http://www.ign.com/games/tony-hawks-pro-skater-2/gba-16246,http://www.ign.com/games/shaun-palmers-pro-snowboarder/gba-16410,http://www.ign.com/games/metroid-fusion/gba-16227,http://www.ign.com/games/pokemon-emerald-version/gba-692344,http://www.ign.com/games/pokemon-ruby-version/gba-17508",Mediocre,5.9,No Descriptors,E for Everyone,Bad
Activision,Action,Vicarious Visions,"The nefarious Mysterio has a mind-warping hold on the City of New York, and it's up to Spidey to stop him before he takes over the entire city! Control the web-slinging superhero through level after level of fast-paced action and deadly obstacles, trying to halt Mysterio's bevy of perilous illusions. Needless to say, your adversary will come at you with all sorts of henchmen, gadgetry, and original weapons, so don't be afraid to use those webs when the going gets tough. You'll have four unique spider suits to choose from, and all of the action takes place in beautifully rendered 2D. The characters, however, appear in 3D, giving the game a texture and feel all its own. The story is lifted straight from the pages of the popular Marvel Comic, so you can be sure there will be plenty of plot twists to keep avid fans and die-hard gamers glued to the gameplay. All that, and you can even save your progress with the use of a password.",Spider-Man: Mysterio's Menace,http://www.ign.com/games/spider-man-mysterios-menace/gba-16369,http://gameboy.ign.com/articles/166/166369p1.html,14.99 USD,8.5,GBA digiBLAST,September 2001,"http://www.ign.com/games/metroid-fusion/gba-16227,http://www.ign.com/games/the-legend-of-zelda-the-minish-cap/gba-499614,http://www.ign.com/games/dragon-ball-z-the-legacy-of-goku/gba-17519,http://www.ign.com/games/metroid-fusion/gba-16227,http://www.ign.com/games/pokemon-emerald-version/gba-692344,http://www.ign.com/games/pokemon-ruby-version/gba-17508",Good,7.7,Mild Animated Violence,E for Everyone,Great
Tecmo,Battle,Tecmo,"The first U.S. title to feature Sony Electronics' Picture Paradise technology,

allows players to take existing images from Sony's digital cameras and camcorders and import them into the game via a USB cable. This feature will give users the ability to personalize their virtual pet with accessories created by outside of the software. Bonus feature aside,

is played by letting gamers create their own creatures by using the unique numbered signatures found in CDs, DVDs, and various other game discs. Later, they can enter these monsters into tournaments where they battle on another for prizes and fame. Players can even breed to existing monsters together for brand new results.",Monster Rancher 3,http://www.ign.com/games/monster-rancher-3/ps2-15584,http://ps2.ign.com/articles/165/165584p1.html,29.99 USD,7.9,PS2,"September 25, 2001","http://www.ign.com/games/monster-rancher-4/ps2-552543,http://www.ign.com/games/magic-pengel-the-quest-for-color/ps2-16752,http://www.ign.com/games/bakugan-battle-brawlers/ps2-14324685,http://www.ign.com/games/shin-megami-tensei-persona-4/ps2-14241813,http://www.ign.com/games/god-of-war-ii/ps2-811719,http://www.ign.com/games/god-of-war-ii/ps2-888576",Good,7.9,Realistic Violence,E for Everyone,Good
Namco,Platformer,Namco,"The little critter named Klonoa has seen his share of adventure on other platforms, but this Game Boy Advance version will really put his skills to the test. Play as the title character, as you journey through a troubled world. It seems that an evil emperor has forbidden his kingdom's citizens to dream, so they've enlisted you to help them regain their rights. This will mean defeating four mighty beasts en route to a showdown with the emperor himself, so get ready for some tough puzzles and intense action. Help Klonoa conquer 40 of the wildest levels you've ever seen. It's gonna take all of the jumping, Wind-bulleting, hover-boarding and puzzle-solving skills you've got.",Klonoa: Empire of Dreams,http://www.ign.com/games/klonoa-empire-of-dreams/gba-16198,http://gameboy.ign.com/articles/166/166198p1.html,11.99 USD,9.0,GBA Wii U,September 2001,"http://www.ign.com/games/super-mario-bros-3/gba-497892,http://www.ign.com/games/super-mario-world/gba-16931,http://www.ign.com/games/super-mario-world-2-yoshis-island/gba-482090,http://www.ign.com/games/metroid-fusion/gba-16227,http://www.ign.com/games/pokemon-emerald-version/gba-692344,http://www.ign.com/games/pokemon-ruby-version/gba-17508",Great,8.4,No Descriptors,E for Everyone,Amazing
Take-Two Interactive,Puzzle,GameVision,"In the year 3025, the peaceful planets of The Associated Nexus of Galaxies (TANG) is threatened by hordes of invaders bent on pillaging the natural resource of Energy Crystals.  Their attack is quick and precise; the planets are almost completely overrun by these savage aliens.  The TANG, now backed into a corner, initiate their last line of defense.  They call upon four super dimensional cyborg heroes.  Called Tangibles for their ability to conjure up solid blocks out of thin air, these brave soldiers will use their cunning, quick reflexes and Power Bolts to retrieve the Energy Crystals and push back the advancing armada.",Tang Tang,http://www.ign.com/games/tang-tang/gba-16686,http://gameboy.ign.com/articles/166/166686p1.html,28.99 USD,5.0,GBA,September 2001,"http://www.ign.com/games/barbie-superpack/gba-490732,http://www.ign.com/games/tweety-and-the-magic-gems/gba-15444,http://www.ign.com/games/super-monkey-ball-jr/gba-480095,http://www.ign.com/games/metroid-fusion/gba-16227,http://www.ign.com/games/pokemon-emerald-version/gba-692344,http://www.ign.com/games/pokemon-ruby-version/gba-17508",Bad,4.9,Suitable for Persons Ages Six and Older,E for Everyone,Mediocre
Nintendo,"Turn-Based, Strategy",Intelligent Systems,"Just because this battle fits in the palm of your hand doesn't mean the stakes are small. On the contrary, this all-or-nothing fight will have you accessing guns, grenades, launchers, and weaponry of all sorts. Players assume command of an army that's out to reclaim a world that's been broken up by warring factions. The battle map is essentially a grid, and moving units is like moving chess pieces on a board -- each of the units can move a specific amount of spaces within this grid, and can only attack at a certain distance from specific enemies. Advance Wars features more than 115 maps, a map editor, head-to-head play via link cable, and an easy-to-understand tutorial mode for beginners.",Advance Wars,http://www.ign.com/games/advance-wars/gba-15424,http://gameboy.ign.com/articles/165/165424p1.html,14.99 USD,9.9,GBA Wii U,"September 10, 2001","http://www.ign.com/games/final-fantasy-tactics-advance/gba-480116,http://www.ign.com/games/fire-emblem/gba-499430,http://www.ign.com/games/advance-wars-2-black-hole-rising/gba-497900,http://www.ign.com/games/metroid-fusion/gba-16227,http://www.ign.com/games/pokemon-emerald-version/gba-692344,http://www.ign.com/games/pokemon-ruby-version/gba-17508",Great,8.9,Mild Violence,E for Everyone,Amazing
Shrapnel Games,Strategy,OneGames,"A 3D wargaming experience that will leave you wanting more! The list of unique features is long (see the product page link below) in this real-time-strategy game set in the near future. 

You get tanks, supply vehicles, scouts, artillery, even an impressive walker that kicks butt! Don't miss this one, the buzz is it will take hybrid wargaming to a new level...",Remote Assault,http://www.ign.com/games/remote-assault/pc-16738,http://pc.ign.com/articles/166/166738p1.html,,5.3,PC,"Jul 31, 2001","http://www.ign.com/games/halo-wars-2/pc-20041132,http://www.ign.com/games/starcraft-remastered/pc-20066763,http://www.ign.com/games/rome-total-war-2/pc-136961,http://www.ign.com/games/grand-theft-auto-online/pc-20019837,http://www.ign.com/games/mass-effect-andromeda/pc-20034220,http://www.ign.com/games/the-witcher-3-wild-hunt-blood-and-wine/pc-20035505",,,,,Mediocre
Acclaim Entertainment,Sports,Acclaim Studios Austin,"It's time for another fix of football action on the PlayStation 2, and NFL Quarterback Club 2002 is at your door. Packed to the rims with all 31 NFL teams, over 1500 NFL players and beautifully rendered stadiums, football has never looked so good. Back once again is the Quarterback Challenge which lets you compete in for events to prove your skills - speed and mobility, accuracy, long distance throw and and read & recognition. NFL Quarterback is hitting the PlayStation 2, so get ready for the snap. Hike!",NFL QB Club 2002,http://www.ign.com/games/nfl-qb-club-2002/ps2-15827,http://ps2.ign.com/articles/165/165827p1.html,5.99 USD,5.8,PS2 GCN,"September 6, 2001","http://www.ign.com/games/madden-nfl-2001/ps2-14286,http://www.ign.com/games/tony-hawks-underground/ps2-545800,http://www.ign.com/games/tony-hawks-pro-skater-4/ps2-482065,http://www.ign.com/games/shin-megami-tensei-persona-4/ps2-14241813,http://www.ign.com/games/god-of-war-ii/ps2-811719,http://www.ign.com/games/god-of-war-ii/ps2-888576",Mediocre,5.7,No Descriptors,E for Everyone,Mediocre
Tecmo,Simulation,Tecmo,"There's more to thoroughbred racing than horses running fast.  There's also how well the horse handles inclines, whether it prefers to run mid-pack early in the race or to take the lead right away, its age, how well it performs on different track surfaces, and its general temperament. And let's not forget the time before and between races -- even horses need good managers.

gives players the opportunity to deal with all the ins and outs of horse racing, making it as much of sim as it is a racing game. In Season mode, you play dual roles. As a stable owner, you will choose which horses run which races, decide when to retire horses, make breeding selections, and even name the foals. As jockey, you direct your horse during the races, but its performance will ultimately depend on its temperament and how well you've handled your other duties. There is also a two-player splitscreen Versus mode.",Gallop Racer 2001,http://www.ign.com/games/gallop-racer-2001/ps2-16661,http://ps2.ign.com/articles/166/166661p1.html,24.99 USD,7.9,PS2,"August 21, 2001","http://www.ign.com/games/the-sims-1/ps2-17231,http://www.ign.com/games/the-sims-bustin-out/ps2-566345,http://www.ign.com/games/playboy-the-mansion/ps2-497001,http://www.ign.com/games/shin-megami-tensei-persona-4/ps2-14241813,http://www.ign.com/games/god-of-war-ii/ps2-811719,http://www.ign.com/games/god-of-war-ii/ps2-888576",Great,8.1,Gambling,E for Everyone,Good
Ubisoft,Action,Ubisoft,"Based on the writings of Anne McCaffrey, DRAGONRIDERS: Chronicles of Pern was actually developed in conjunction with the author. Whether or not you're a dedicated fan of McCaffrey's fantastical writing, you'll be swept up in the magic of this magical tale. The Weyr people have recently lost a leader, and now a horrible disease is sweeping the countryside. Killing off all of the lesser Dragonriders, the illness is sparing few in its widespread contagion. Play as D'Kor, an expert Dragonrider of the Bronze Smanth, as you try to put an end to the hideous disease by getting to its roots. Set in a lush, vast, 3D world, this installment of the popular series offers improved graphics, incredible sound, and a more thorough gaming experience overall. Packed with puzzles, individual quests, and rough battle scenes, the game is a perfect blend of several gaming elements. Weyr needs you, so get riding!",Dragon Riders -- Chronicles of Pern,http://www.ign.com/games/dragon-riders-chronicles-of-pern/dc-14362,http://dreamcast.ign.com/articles/164/164362p1.html,47.99 USD,3.6,DC PC,"August 9, 2001","http://www.ign.com/games/shenmue/dc-14499,http://www.ign.com/games/shenmue-ii/dc-15624,http://www.ign.com/games/spider-man-2000/dc-15779,http://www.ign.com/games/baldurs-gate/dc-12490,http://www.ign.com/games/nba-2k1/dc-14602,http://www.ign.com/games/marvel-vs-capcom-clash-of-super-heroes/dc-9967",Mediocre,5.3,Violence,T for Teen,Awful
Acclaim Entertainment,"Extreme, Sports",Z-Axis,"Dave Mirra Freestyle BMX 2 is the sequel to the smash hit Dave Mirra Freestyle BMX. Play as Dave Mirra or as any of the 14 pro riders such as Ryan Nyquist, Mike Laird and Collin Mackay. Ride 8 massive levels and test your skill and risk your skull pulling off over 1,500 tricks. Let your imagination run wild with the Create-A-Rider and Park Editor features as you create the riding experience you always wanted.",Dave Mirra Freestyle BMX 2,http://www.ign.com/games/dave-mirra-freestyle-bmx-2/ps2-16294,http://ps2.ign.com/articles/166/166294p1.html,5.99 USD,8.0,PS2 Xbox GBA GCN,"September 6, 2001","http://www.ign.com/games/madden-nfl-2001/ps2-14286,http://www.ign.com/games/tony-hawks-underground/ps2-545800,http://www.ign.com/games/tony-hawks-pro-skater-4/ps2-482065,http://www.ign.com/games/shin-megami-tensei-persona-4/ps2-14241813,http://www.ign.com/games/god-of-war-ii/ps2-811719,http://www.ign.com/games/god-of-war-ii/ps2-888576",Good,7.9,Mild Lyrics,E for Everyone,Great
Crave Entertainment,Action,David A. Palmer Productions,"The scum of the universe continue to slip through the cracks in the system and arrive on earth. As a Men in Black agent, it?s your job to stop them. Armed with advanced weapons including the noisy cricket, freezer gun, and grenade launcher, you will battle an array of aliens across New York, and even in space.",Men In Black: The Series,http://www.ign.com/games/men-in-black-the-series/gba-16446,http://gameboy.ign.com/articles/166/166446p1.html,,2.0,GBA GBC,September 2001,"http://www.ign.com/games/metroid-fusion/gba-16227,http://www.ign.com/games/the-legend-of-zelda-the-minish-cap/gba-499614,http://www.ign.com/games/dragon-ball-z-the-legacy-of-goku/gba-17519,http://www.ign.com/games/metroid-fusion/gba-16227,http://www.ign.com/games/pokemon-emerald-version/gba-692344,http://www.ign.com/games/pokemon-ruby-version/gba-17508",Painful,2.2,Violence,E for Everyone,Painful
Konami,Action,,"The X Games could be considered the Olympics for Generation X, and now one of the premier events skateboarding has made its way to the Game Boy Advance with ESPN X GAMES SKATEBOARDING. Choose from eight pro skaters Bob Burnquist, Carlos DeAndrade, Chad Fernandez, Kerry Getz, Rick McCrank, Colin McKay, Chris Senn, and Lincoln Ueda and 64 licensed decks as you get ready to shred on the streets, sidewalks, handrails, and more. There will be three cities to skate in San Francisco, New York, and Los Angeles each with location-specific elements and landmarks. The game consists of nine levels, broken into three categories: X Games competition, street skating, and fantasy. The 12 big-name bands including Linkin Park, Voodoo Glow Skulls, and New Found Glory will provide the adrenaline-pumping tunes to keep the action fast and furious. Get ready to ollie, grind, and kickflip your way to victory with ESPN X GAMES SKATEBOARDING.",ESPN X Games Skateboarding,http://www.ign.com/games/espn-x-games-skateboarding/gba-16790,http://gameboy.ign.com/articles/166/166790p1.html,19.99 USD,5.5,GBA Cell PS2,September 2001,"http://www.ign.com/games/metroid-fusion/gba-16227,http://www.ign.com/games/the-legend-of-zelda-the-minish-cap/gba-499614,http://www.ign.com/games/dragon-ball-z-the-legacy-of-goku/gba-17519,http://www.ign.com/games/metroid-fusion/gba-16227,http://www.ign.com/games/pokemon-emerald-version/gba-692344,http://www.ign.com/games/pokemon-ruby-version/gba-17508",Bad,4.6,Suitable for Persons Ages Six and Older,E for Everyone,Mediocre
Sony Computer Entertainment,"Third-Person, Adventure",SIE Japan Studio,"In Sony Computer Entertainment's exclusive adventure

, a young boy with horns is born in every generation to be traditionally sacrificed in order to cleanse the local community of evil spirits. This generation's boy (and title character), however, tries to change his fate completely by fleeing from his would-be executioners and joining up with a captured princess to escape a gigantic castle. During his quest for survival

will have to make his way through vast environments overrun by challenging puzzles (including brainteasers and mazes) as he battles against an army of evil apparitions while leading his princess through the secluded fortress.",ICO,http://www.ign.com/games/ico/ps2-14833,http://ps2.ign.com/articles/164/164833p1.html,14.99 USD,9.4,PS2 PS3,"September 25, 2001","http://www.ign.com/games/shadow-of-the-colossus/ps2-490849,http://www.ign.com/games/silent-hill-2/ps2-14904,http://www.ign.com/games/okami/ps2-678618,http://www.ign.com/games/shin-megami-tensei-persona-4/ps2-14241813,http://www.ign.com/games/god-of-war-ii/ps2-811719,http://www.ign.com/games/god-of-war-ii/ps2-888576",Amazing,9.1,Violence,T for Teen,Amazing
Midway  Games,Sports,Black Box,"With Midway's NHL Hitz 2002 you'll feel the sting of a 120mph slapshot between the eyes; your bones will rattle, your teeth will clatter, and the serenade of the manic-fans will send chills down your spine. The lightning game-speed, stunning next-generation graphics and unique Midway-style action will have you frenzied ... or perhaps it will be the 265 lb. defenseman who just planted you face first into the cold-hard ice.",NHL Hitz 20-02,http://www.ign.com/games/nhl-hitz-20-02/ps2-16459,http://ps2.ign.com/articles/166/166459p1.html,4.99 USD,7.6,PS2 GCN Xbox,"September 25, 2001","http://www.ign.com/games/madden-nfl-2001/ps2-14286,http://www.ign.com/games/tony-hawks-underground/ps2-545800,http://www.ign.com/games/tony-hawks-pro-skater-4/ps2-482065,http://www.ign.com/games/amplitude/ps2-17285,http://www.ign.com/games/mortal-kombat-shaolin-monks/ps2-709115,http://www.ign.com/games/atari-racing-collection/ps2-483265,http://www.ign.com/games/shin-megami-tensei-persona-4/ps2-14241813,http://www.ign.com/games/god-of-war-ii/ps2-811719,http://www.ign.com/games/god-of-war-ii/ps2-888576",Great,8.3,Violence,E for Everyone,Good
Ubisoft,"Third-Person, Action",Ubisoft Montreal,"Batman Vengeance, developed by Ubi Soft Montreal, is a 3D action-adventure based on the animated television series. The game pits players as the Dark Knight himself on a quest to stop a mysterious crime wave in Gotham City. Batman has full freedom of movement to go anywhere within wide-open, sprawling 3D environments -- some that stretch up and up and up. The caped crusader can walk, run, sneak against walls, climb, glide through the air with his cape and engage in hand-to-hand combat. The game features 19 stages, 40 minutes of rendered cinematics, and plenty of Bat gadgets, like batarangs, batgrapples, flash bombs, remote charges, batcuffs, nets, the batlauncher, batscope and more.",Batman Vengeance,http://www.ign.com/games/batman-vengeance/ps2-16274,http://ps2.ign.com/articles/166/166274p1.html,12.99 USD,8.0,PS2 GCN GBA Xbox PC,"October 17, 2001","http://www.ign.com/games/god-of-war-ii/ps2-811719,http://www.ign.com/games/kingdom-hearts/ps2-16467,http://www.ign.com/games/grand-theft-auto-san-andreas/ps2-611957,http://www.ign.com/games/shin-megami-tensei-persona-4/ps2-14241813,http://www.ign.com/games/god-of-war-ii/ps2-811719,http://www.ign.com/games/god-of-war-ii/ps2-888576",Good,7.6,"Mild Animated Violence, Mild Realistic Violence",T for Teen,Great
Capcom,Puzzle,Paragon 5,"If you're ready for explosive, mind-twisting puzzle-action mayhem then grab a copy of TROUBALLS from Capcom. In this massively addictive game developed exclusively for the Game Boy Color, it's up to you to gain as many points as you can while the clock ticks down. Here's how it works: different colored balls are attached to moving gears; you rotate the gears in an attempt to get four balls of the same color aligned (in a 2x2 square grid at the bottom of the screen), which blows them to smithereens. This clears the stage and advances you to the next level. There's no time to rest though, as each successive round of sphere-blasting fun is more difficult than the last. You'll listen to five original songs in the challenging, pop-and-bop gameplay that confronts you on more than 100 fast-moving levels. If you couldn't get enough of TETRIS or BUST-A-MOVE, then you'll love TROUBALLS to pieces.",Trouballs,http://www.ign.com/games/trouballs-167949/gbc-15976,http://gameboy.ign.com/articles/165/165976p1.html,3.99 USD,7.0,GBC,"October 5, 2001","http://www.ign.com/games/tonka-construction-site/gbc-662099,http://www.ign.com/games/pokemon-puzzle-challenge/gbc-13800,http://www.ign.com/games/shanghai-pocket/gbc-10787,http://www.ign.com/games/pokemon-silver-version/gbc-16709,http://www.ign.com/games/pokemon-gold-version/gbc-12865,http://www.ign.com/games/pokemon-crystal-version/gbc-15402",Okay,6.4,No Descriptors,E for Everyone,Good
Microsoft,"Economic, Simulation",Blue Fang Games,"In

, you'll be challenged to build the most healthy and vibrant zoo possible. With an easy to learn interface, you can begin planning your strategy and building your ultimate zoo the moment you start the game. Which is a good thing since you'll need to build, manage, and maintain a zoo with over 200 animals, exhibits, and zoo materials. Plan wisely, because your success depends on your ability to keep the animals happy!",Zoo Tycoon [2001],http://www.ign.com/games/zoo-tycoon/pc-16183,http://pc.ign.com/articles/166/166183p1.html,29.99 USD,6.9,PC Mac,"Oct 18, 2001","http://www.ign.com/games/civilization-beyond-earth/pc-20016115,http://www.ign.com/games/simcity/pc-128952,http://www.ign.com/games/civilization-beyond-earth-rising-tide/pc-20040683,http://www.ign.com/games/grand-theft-auto-online/pc-20019837,http://www.ign.com/games/mass-effect-andromeda/pc-20034220,http://www.ign.com/games/the-witcher-3-wild-hunt-blood-and-wine/pc-20035505",Good,7.7,Mild Violence,E for Everyone,Okay
