publisher,genres,developers,description,title,url,review_link,price,ign_score,platforms,release_date,related_games,community_score_phrase,community_score,rating_content,rating_category,ign_score_phrase
Atari,Sports,Mistic Software,"Skate, shoot and score with the Backyard Kids and kid versions of the hottest NHL? pros! You can control all of the action in this hockey favorite. Build your own talented team, choose an awesome rink and zoom down the ice! With zany power-ups and that one-of-a-kind Backyard Sports? excitement, Backyard Hockey? provides fun, speedy, end-to-end action ? now that it?s on the Game Boy? Advance system, you can hit the game-winning slapshot anywhere",Backyard Hockey,http://www.ign.com/games/backyard-hockey-805573/gba-572342,http://gameboy.ign.com/articles/458/458598p1.html,17.99 USD,6.0,GBA PC,"October 9, 2003","http://www.ign.com/games/mario-golf-advance-tour/gba-550432,http://www.ign.com/games/tony-hawks-pro-skater-2/gba-16246,http://www.ign.com/games/shaun-palmers-pro-snowboarder/gba-16410,http://www.ign.com/games/metroid-fusion/gba-16227,http://www.ign.com/games/pokemon-emerald-version/gba-692344,http://www.ign.com/games/pokemon-ruby-version/gba-17508",Great,8.1,No Descriptors,E for Everyone,Okay
Vivendi Games,"Third-Person, Shooter",Swingin' Ape Studios,"Set to the backdrop of a distant universe inhabited exclusively by robots, Glitch is on an adventure to save his home planet Iron Star from the evil General Corrosive and his various mechanical minions. You take control of the colorful machine -- think of him as a mini-mech -- who seems innocent enough but in actuality is armed to the teeth with various weapons and unique abilities. The setup results in an experience that approaches perpetual carnage, and it's all paced along and broken apart by some witty banter, too. But the real draw is the character's ability to sneak up behind robot foes equipped with open rear data panels and hack into and take control of them. Add to that split-screen multiplayer battles, and you've got total robot destruction, third-person-shooter-style.",Metal Arms: Glitch in the System,http://www.ign.com/games/metal-arms-glitch-in-the-system/xbox-552237,http://xbox.ign.com/articles/458/458563p1.html,19.99 USD,8.3,Xbox GCN Xbox 360 PS2,"November 18, 2003","http://www.ign.com/games/halo-2/xbox-482228,http://www.ign.com/games/halo-combat-evolved/xbox-15922,http://www.ign.com/games/doom-3/xbox-482119,http://www.ign.com/games/halo-2/xbox-482228,http://www.ign.com/games/halo-combat-evolved/xbox-15922,http://www.ign.com/games/fable/xbox-16526",Great,8.5,Strong Language,T for Teen,Great
Electronic Arts,Sports,EA Canada,"Entry into EA's long-running soccer series, stretching back to the Genesis days. This year's edition tweaks the gameplay over 2003 and adds a more-developed career mode for players' long-term soccer pleasure. Most importantly, EA has done a lot to improve the ball physics, and how the old rock interacts with players' bodies. There's a lot more room for error in this game, meaning that player mistakes, weird bounces and mishandles will be an integral part of the experience. The GameCube version features built-in four-player capabilities and GBA link-up support.",FIFA Soccer 2004,http://www.ign.com/games/fifa-2004/gcn-536024,http://cube.ign.com/articles/458/458605p1.html,17.99 USD,8.3,GCN PC PS Xbox NNG PS2 GBA,"November 11, 2003","http://www.ign.com/games/bmx-xxx/gcn-17510,http://www.ign.com/games/mario-superstar-baseball/gcn-716495,http://www.ign.com/games/madden-nfl-2006/gcn-698630,http://www.ign.com/games/the-legend-of-zelda-the-wind-waker/gcn-17012,http://www.ign.com/games/super-smash-bros-melee/gcn-16387,http://www.ign.com/games/super-mario-sunshine/gcn-16713",Great,8.1,,E for Everyone,Great
Square Enix,"Turn-Based, RPG",Square Enix,"Marking the first true sequel in Squaresoft's popular RPG series, the story of Final Fantasy X-2 picks up two years after the events that took place in Final Fantasy X. Following the young and powerful Summoner Yuna's quest to rid Spira of the destructive force known as Sin, the world enters into a period known as the ""Eternal Calm"".

During this moment of change, the people of Spira have shunned the once-sacred teachings of Yevon, and embraced the use of the formerly forbidden machina. While many of Spira's inhabitants are enjoying this time of peace, evidence of the High Summoner Yuna's lost love Tidus surfaces, prompting her to begin a new quest to find him.",Final Fantasy X-2,http://www.ign.com/games/final-fantasy-x-2/ps2-492220,http://ps2.ign.com/articles/458/458474p1.html,15.99 USD,9.5,PS2,"November 18, 2003","http://www.ign.com/games/shin-megami-tensei-persona-4/ps2-14241813,http://www.ign.com/games/final-fantasy-x/ps2-14008,http://www.ign.com/games/final-fantasy-xii/ps2-488222,http://www.ign.com/games/shin-megami-tensei-persona-4/ps2-14241813,http://www.ign.com/games/god-of-war-ii/ps2-811719,http://www.ign.com/games/god-of-war-ii/ps2-888576",Great,8.4,Suggestive Themes,T for Teen,Amazing
Konami,Action,Konami,"Frogger's Adventures The Rescue goes beyond Firefly Swamp and brings a multiplayer mode to Frogger fans for the first time on next generation platforms. The series' famous ""hop-n-dodge"" gameplay return as Frogger travels across seven diverse worlds, searches for clues to solve challenging puzzles and avoids menacing enemies.",Frogger's Adventures: The Rescue,http://www.ign.com/games/froggers-adventures-the-rescue/gcn-567563,http://cube.ign.com/articles/458/458406p1.html,17.99 USD,5.5,GCN PS2 PC,"November 3, 2003","http://www.ign.com/games/the-legend-of-zelda-the-wind-waker/gcn-17012,http://www.ign.com/games/resident-evil-4/gcn-15821,http://www.ign.com/games/metroid-prime/gcn-15316,http://www.ign.com/games/the-legend-of-zelda-the-wind-waker/gcn-17012,http://www.ign.com/games/super-smash-bros-melee/gcn-16387,http://www.ign.com/games/super-mario-sunshine/gcn-16713",Okay,6.4,Suitable for Persons Ages Six and Older,E for Everyone,Mediocre
Gathering,Simulation,PopTop Software,"The long awaited sequel to the king of the ""tycoon"" games,

realizes your dream of establishing and running a railroad empire. Build rail lines, purchase trains and start hauling cargo to begin building your railroad. Expand your business into major cities, acquire and dominate industries, manipulate the stock market, and force your competitors into bankruptcy to become the ultimate Railroad Tycoon. Make your fortune the old fashioned way - take it from someone else!",Railroad Tycoon 3,http://www.ign.com/games/railroad-tycoon-3/pc-16967,http://pc.ign.com/articles/458/458436p1.html,19.99 USD,8.8,PC Mac,"Oct 27, 2003","http://www.ign.com/games/civilization-beyond-earth/pc-20016115,http://www.ign.com/games/simcity/pc-128952,http://www.ign.com/games/civilization-beyond-earth-rising-tide/pc-20040683,http://www.ign.com/games/grand-theft-auto-online/pc-20019837,http://www.ign.com/games/mass-effect-andromeda/pc-20034220,http://www.ign.com/games/the-witcher-3-wild-hunt-blood-and-wine/pc-20035505",Great,8.5,Alcohol Reference,E for Everyone,Great
Electronic Arts,Sports,Digital Eclipse Software,"In the world of professional golf, one name stands out above the rest -- Tiger Woods. He has no equal on the PGA Tour, but now you have the chance to build a golfer that's even better! Take your custom golfer through the trials and tribulations of all the great courses in Tiger Woods PGA TOUR 2004. With all the top competition on some of the most famous fairways and greens ever, this is the ultimate golf experience. Get your driver ready!",Tiger Woods PGA Tour 2004,http://www.ign.com/games/tiger-woods-pga-tour-2004/gba-573033,http://gameboy.ign.com/articles/458/458443p1.html,19.99 USD,8.0,GBA Cell GCN PS2 PC Xbox NNG,"November 4, 2003","http://www.ign.com/games/mario-golf-advance-tour/gba-550432,http://www.ign.com/games/tony-hawks-pro-skater-2/gba-16246,http://www.ign.com/games/shaun-palmers-pro-snowboarder/gba-16410,http://www.ign.com/games/metroid-fusion/gba-16227,http://www.ign.com/games/pokemon-emerald-version/gba-692344,http://www.ign.com/games/pokemon-ruby-version/gba-17508",Great,8.3,No Descriptors,E for Everyone,Great
Konami,"Third-Person, Action",Konami HWI,"Frogger's Adventures: The Rescue goes beyond Firefly Swamp and brings a multiplayer mode to Frogger fans for the first time. The series' famous ""hop-n-dodge"" gameplay return as Frogger travels across seven diverse worlds, searches for clues to solve challenging puzzles and avoids menacing enemies.

Features include 25 varied stages, story-oriented mini-quests, and four-player simultaneous action.",Frogger's Adventures: The Rescue,http://www.ign.com/games/froggers-adventures-the-rescue/ps2-566819,http://ps2.ign.com/articles/441/441902p1.html,17.99 USD,5.5,PS2 GCN PC,"October 28, 2003","http://www.ign.com/games/god-of-war-ii/ps2-811719,http://www.ign.com/games/kingdom-hearts/ps2-16467,http://www.ign.com/games/grand-theft-auto-san-andreas/ps2-611957,http://www.ign.com/games/shin-megami-tensei-persona-4/ps2-14241813,http://www.ign.com/games/god-of-war-ii/ps2-811719,http://www.ign.com/games/god-of-war-ii/ps2-888576",Okay,6.8,Comic Mischief,E for Everyone,Mediocre
Vivendi Games,"Third-Person, Shooter",Swingin' Ape Studios,"Set to the backdrop of a distant universe inhabited exclusively by robots, Glitch is on an adventure to save his home planet Iron Star from the evil General Corrosive and his various mechanical minions. You take control of the colorful machine -- think of him as a mini-mech -- who seems innocent enough but in actuality is armed to the teeth with various weapons and unique abilities. The setup results in an experience that approaches perpetual carnage, and it's all paced along and broken apart by some witty banter, too. But the real draw is the character's ability to sneak up behind robot foes equipped with open rear data panels and hack into and take control of them. Add to that split-screen multiplayer battles, and you've got total robot destruction, third-person-shooter-style.",Metal Arms: Glitch in the System,http://www.ign.com/games/metal-arms-glitch-in-the-system/gcn-552255,http://cube.ign.com/articles/458/458450p1.html,19.99 USD,8.3,GCN Xbox Xbox 360 PS2,"November 18, 2003","http://www.ign.com/games/james-bond-007-nightfire/gcn-480685,http://www.ign.com/games/star-wars-rogue-squadron-iii-rebel-strike/gcn-546759,http://www.ign.com/games/star-fox-assault/gcn-481615,http://www.ign.com/games/the-legend-of-zelda-the-wind-waker/gcn-17012,http://www.ign.com/games/super-smash-bros-melee/gcn-16387,http://www.ign.com/games/super-mario-sunshine/gcn-16713",Great,8.6,Strong Language,T for Teen,Great
Thumbworks,Music,,"Based on the hit movie School of Rock starring Jack Black, School of Rock Audition is a musical puzzle game in which you take the role of a student trying out for the band. You have to master keyboards, bass guitar, drum and electric guitar before you become a true rocker. If you beat the game, you get to unlock unique FREE Ringtones!",School of Rock Audition,http://www.ign.com/games/school-of-rock-audition/cell-613342,http://wireless.ign.com/articles/458/458418p1.html,,7.0,Cell,2003-11-01,"http://www.ign.com/games/guitar-hero-world-tour/cell-14279525,http://www.ign.com/games/guitar-hero-5-mobile/cell-12106,http://www.ign.com/games/lord-j-of-dance/cell-759608,http://www.ign.com/games/baldurs-gate/cell-688224,http://www.ign.com/games/puzzle-quest-challenge-of-the-warlords/cell-950646,http://www.ign.com/games/just-cause-2/cell-14280725",,,,,Good
Nintendo,"Turn-Based, Strategy",Intelligent Systems,"The first in the series to be released in the US,

shares many similarities with another strategy game on the GBA:

. That's because it's been designed by the same development studio. The differences are subtle but important: where players control anonymous troops in the AW series, players command an array of different characters in

. If one of these characters dies during battle, he or she (or it) is gone for good, and will never be available in future missions. This added element means that players will have to really consider their strategies when attempting to complete the several dozen challenges in this lengthy storyline.",Fire Emblem,http://www.ign.com/games/fire-emblem/gba-499430,http://gameboy.ign.com/articles/458/458227p1.html,24.99 USD,9.5,GBA Wii U,"November 3, 2003","http://www.ign.com/games/advance-wars/gba-15424,http://www.ign.com/games/final-fantasy-tactics-advance/gba-480116,http://www.ign.com/games/advance-wars-2-black-hole-rising/gba-497900,http://www.ign.com/games/dragon-ball-z-the-legacy-of-goku/gba-17519,http://www.ign.com/games/final-fantasy-tactics-advance/gba-480116,http://www.ign.com/games/dragon-ball-z-buus-fury/gba-680571,http://www.ign.com/games/metroid-fusion/gba-16227,http://www.ign.com/games/pokemon-emerald-version/gba-692344,http://www.ign.com/games/pokemon-ruby-version/gba-17508",Amazing,9.1,Violence,E for Everyone,Amazing
Pulse Interactive,Pinball,,,Space Taxi Pinball,http://www.ign.com/games/space-taxi-pinball/cell-613280,http://wireless.ign.com/articles/458/458087p1.html,,5.0,Cell,"Nov 1, 2003","http://www.ign.com/games/pac-man-pinball/cell-716630,http://www.ign.com/games/pac-man-pinball-2/cell-14297637,http://www.ign.com/games/cs-garfield-pinball/cell-679992,http://www.ign.com/games/baldurs-gate/cell-688224,http://www.ign.com/games/puzzle-quest-challenge-of-the-warlords/cell-950646,http://www.ign.com/games/just-cause-2/cell-14280725",,,,,Mediocre
Majesco,Shooter,KaosKontrol,"In Blowout, which features 2D-style play mechanics and 3D graphics, players assume the role of John ""Dutch"" Cane, a TransFed Marshall assigned to suppress a clone uprising before it gains momentum. Unbeknownst to Cane, though, the clones have been infected by a Xeno genome virus, turning them into grotesque and highly dangerous aliens. It's up to gamers to eliminate the threat using whatever means necessary. Cane's arsenal includes 20mm Pump-Action Shotgun, 8-meter Flamethrower, Plasma Rifle, Machine Gun, 8'' NailGun as well as a variety of gadgets, like Jetpacks, bounce-shields, and sonic-impulse cannons.",BlowOut,http://www.ign.com/games/blowout/xbox-497311,http://xbox.ign.com/articles/458/458132p1.html,9.99 USD,6.5,Xbox PS3 PC GCN PS2 Xbox 360,"November 5, 2003","http://www.ign.com/games/halo-2/xbox-482228,http://www.ign.com/games/halo-combat-evolved/xbox-15922,http://www.ign.com/games/doom-3/xbox-482119,http://www.ign.com/games/halo-2/xbox-482228,http://www.ign.com/games/halo-combat-evolved/xbox-15922,http://www.ign.com/games/fable/xbox-16526",Mediocre,5.8,"Realistic Violence, Blood and Gore",T for Teen,Okay
Majesco,Shooter,KaosKontrol,"Budget-priced shooter from Majesco. In Blowout, which features 2D-style play mechanics and 3D graphics, players assume the role of John ""Dutch"" Cane, a TransFed Marshall assigned to suppress a clone uprising before it gains momentum. Unbeknownst to Cane, though, the clones have been infected by a Xeno genome virus, turning them into grotesque and highly dangerous aliens. It's up to gamers to eliminate the threat using whatever means necessary. Cane's arsenal includes 20mm Pump-Action Shotgun, 8-meter Flamethrower, Plasma Rifle, Machine Gun, 8'' NailGun as well as a variety of gadgets, like Jetpacks, bounce-shields, and sonic-impulse cannons.",BlowOut,http://www.ign.com/games/blowout/ps2-497257,http://ps2.ign.com/articles/458/458224p1.html,4.99 USD,6.5,PS2 PS3 PC GCN Xbox Xbox 360,"November 5, 2003","http://www.ign.com/games/star-wars-battlefront-ii-2005/ps2-737697,http://www.ign.com/games/killzone/ps2-568333,http://www.ign.com/games/call-of-duty-finest-hour/ps2-550009,http://www.ign.com/games/shin-megami-tensei-persona-4/ps2-14241813,http://www.ign.com/games/god-of-war-ii/ps2-811719,http://www.ign.com/games/god-of-war-ii/ps2-888576",Okay,6.0,Blood and Gore,T for Teen,Okay
Konami,Music,Harmonix,"Karaoke game for PlayStation 2. Developer Harmonix, the brains behind Amplitude and Frequency, has created a scoring system that measures the player's skill on the included headset microphone. Sing a song in a monotone voice without any rhythm and you will be booed by the crowd. Nail a pitch-perfect version and they'll go wild, with fireworks going off all over. Your on-screen character will get more into it as well, moving across the stage, getting into the song, and even glowing. Even the microphone gets into the act, leaving white vapor trails on the screen. The game features 36 songs and multiplayer action for up to eight.",Karaoke Revolution [2004],http://www.ign.com/games/karaoke-revolution-2004/ps2-566929,http://ps2.ign.com/articles/458/458064p1.html,29.99 USD,8.5,PS2 Xbox,"November 5, 2003","http://www.ign.com/games/amplitude/ps2-17285,http://www.ign.com/games/guitar-hero-ii/ps2-823033,http://www.ign.com/games/guitar-hero-iii-legends-of-rock/ps2-899095,http://www.ign.com/games/shin-megami-tensei-persona-4/ps2-14241813,http://www.ign.com/games/god-of-war-ii/ps2-811719,http://www.ign.com/games/god-of-war-ii/ps2-888576",Great,8.5,"Realistic Blood, Realistic Violence, Strong Language, Suggestive Themes",E for Everyone,Great
Rockstar  Games,"Third-Person, Action","Rockstar North, Rockstar Vienna","From the dark and seedy streets of Liberty City's underworld to the glamorous hedonism of Vice City in the 1980s. Two towns, each brimming with limitless delights and degradation, where anything can happen. Two criminal sagas of greed and desperation that will take you into the world of Grand Theft Auto.

This collectible double-pack release  features two of the highest-selling PlayStation 2 titles from Rockstar: Grand Theft Auto: Vice City and Grand Theft Auto III.",Grand Theft Auto Double Pack: Grand Theft Auto III & Grand Theft Auto: Vice City,http://www.ign.com/games/grand-theft-auto-double-pack/xbox-16137,http://xbox.ign.com/articles/457/457994p1.html,29.99 USD,9.4,Xbox PS2,"November 4, 2003","http://www.ign.com/games/fable/xbox-16526,http://www.ign.com/games/grand-theft-auto-san-andreas/xbox-623715,http://www.ign.com/games/beyond-good-and-evil/xbox-482232,http://www.ign.com/games/grand-theft-auto-san-andreas/xbox-623715,http://www.ign.com/games/beyond-good-and-evil/xbox-482232,http://www.ign.com/games/tom-clancys-splinter-cell-chaos-theory/xbox-683200,http://www.ign.com/games/halo-2/xbox-482228,http://www.ign.com/games/halo-combat-evolved/xbox-15922,http://www.ign.com/games/fable/xbox-16526",Amazing,9.3,"Realistic Violence, Strong Language, Strong Sexual Content, Blood and Gore",M for Mature,Amazing
"Empire Interactive, Strategy First","Real-Time, Strategy",Black Cactus,"Warrior Kings: Battles maintains the excitement that made Warrior Kings a leading RTS. It is a stand-alone title that adds a new strategic and tactical dimension to the series.

Warrior Kings: Battles comes complete with a full skirmish mode, boasting a proficiency of computer AI not yet seen in an RTS product. AI Generals build a functioning economy, offensive/defensive armies, correctly control formations, and intelligently probe your defenses, looking for your weak points. AI Diplomacy, a major new feature, makes you think you are playing a human opponent(s), giving a new depth to single and multiplayer Internet gaming.",Warrior Kings: Battles,http://www.ign.com/games/warrior-kings-battles/pc-489799,http://pc.ign.com/articles/457/457996p1.html,9.99 USD,7.0,PC,Q3 2003,"http://www.ign.com/games/halo-wars-2/pc-20041132,http://www.ign.com/games/starcraft-remastered/pc-20066763,http://www.ign.com/games/rome-total-war-2/pc-136961,http://www.ign.com/games/grand-theft-auto-online/pc-20019837,http://www.ign.com/games/mass-effect-andromeda/pc-20034220,http://www.ign.com/games/the-witcher-3-wild-hunt-blood-and-wine/pc-20035505",Great,8.4,"Blood, Violence",T for Teen,Good
Sony Computer Entertainment,"First-Person, Shooter",Zipper Interactive,"The fight against terrorism rages on in

for the PlayStation 2. Assume the role of a Navy SEAL commander and lead an elite group of soldiers through twelve international missions. Collaborate with other international groups such as the Russian Spetznaz and British SAS groups in a fight for international freedom.

Join forces with friends online and assemble a force of up to 16 people by way of the PS2 network adapter. Communicate with other online players with the compatible headset in order to formulate strategies against the enemy. Expect realistic SEAL action as the game was developed in association with US Naval Special Warfare Command.",SOCOM II: U.S. Navy SEALs,http://www.ign.com/games/socom-ii-us-navy-seals/ps2-552397,http://ps2.ign.com/articles/457/457886p1.html,49.99 USD,8.8,PS2,"November 4, 2003","http://www.ign.com/games/star-wars-battlefront-ii-2005/ps2-737697,http://www.ign.com/games/killzone/ps2-568333,http://www.ign.com/games/call-of-duty-finest-hour/ps2-550009,http://www.ign.com/games/shin-megami-tensei-persona-4/ps2-14241813,http://www.ign.com/games/god-of-war-ii/ps2-811719,http://www.ign.com/games/god-of-war-ii/ps2-888576",Great,8.9,"Blood, Violence",M for Mature,Great
Sony Computer Entertainment,Party,"SIE London Studio, SIE Europe","Sony's EyeToy is a small digital camera that sits on top of your TV and plugs into your PS2. The motion sensitive camera films you as you stand in front of your TV, putting your image on screen in the middle of the action. Then you use your arms, legs, head, bottom... in fact any part of your body to play the games. EyeToy is an entirely unique party gaming experience for people of all ages. Incorporating a unique USB camera that utilizes motion-tracking technology, gamers instantly become the main character in their own game as interactive entertainment is taken to a new level. Features 12 mini-games that let you beat back ninjas in Kung Foo, perform rhythmical feet tapping in Beat Freak, and show your leg work in Soccer Craze.",EyeToy: Play,http://www.ign.com/games/eyetoy-play/ps2-570957,http://ps2.ign.com/articles/457/457924p1.html,39.99 USD,7.0,PS2,"November 4, 2003","http://www.ign.com/games/spongebob-squarepants-featuring-nicktoons-globs-of-doom/ps2-14256560,http://www.ign.com/games/spongebob-squarepants-lights-camera-pants/ps2-727054,http://www.ign.com/games/ape-escape-pumped-primed/ps2-620962,http://www.ign.com/games/shin-megami-tensei-persona-4/ps2-14241813,http://www.ign.com/games/god-of-war-ii/ps2-811719,http://www.ign.com/games/god-of-war-ii/ps2-888576",Good,7.7,Violence,E for Everyone,Good
Midway  Games,Racing,Midway  Games,"RoadKill lets players fight it out on the go in a post-apocalyptic world destroyed by a plague and ruled by gangs. Players get behind the controls of 30 vehicles with weapons such as machine-guns, guided missiles and grenade launchers destroying enemy gangs and building a gang of their own to take control of roads of this abysmal world. The game offers 30 core missions with plenty of side missions, 30 vehicles armed with a variety of weapons, combat against vehicles, armed pedestrians and stationary targets, and a reputation system that slowly raises your status and enables you to create a gang of thugs. Players can also unlock secret items that can be used to soup up vehicles, and 2-4 player split-screen multiplayer modes for when you're finished with the single player missions.",RoadKill,http://www.ign.com/games/roadkill/gcn-550499,http://cube.ign.com/articles/457/457861p1.html,9.99 USD,7.7,GCN Xbox PS2,"November 4, 2003","http://www.ign.com/games/action-replay-ultimate-codes-mario-kart-double-dash/gcn-16574,http://www.ign.com/games/kirby-air-ride/gcn-499716,http://www.ign.com/games/need-for-speed-most-wanted/gcn-740900,http://www.ign.com/games/the-legend-of-zelda-the-wind-waker/gcn-17012,http://www.ign.com/games/super-smash-bros-melee/gcn-16387,http://www.ign.com/games/super-mario-sunshine/gcn-16713",Good,7.9,Strong Language,M for Mature,Good
Sierra,"Real-Time, Strategy",Liquid Entertainment,"Though it capitalizes on the momentum generated by the recent films,

uses the original books as source material and extends the conflicts beyond the core story of the Fellowship. Displaying the same level of personality and animation found in Liquid's previous game,

, the world of Middle Earth comes to life with vast grassy plains, gathering storm clouds and the blight of Sauron passing over the land.

Players are able to take both sides of this conflict as they extend Sauron's reach over the lands of Middle Earth or try to battle his minions back to the gates of Mordor. Fielding units from hobbits to Balrogs, you'll have the chance to refight some of the classic battles from the series including Helm's Deep, Edoras, Cirith Ungol and Dol Guldur.",The Lord of the Rings: War of the Ring,http://www.ign.com/games/the-lord-of-the-rings-war-of-the-ring/pc-496389,http://pc.ign.com/articles/457/457947p1.html,19.99 USD,7.9,PC,"Nov 4, 2003","http://www.ign.com/games/halo-wars-2/pc-20041132,http://www.ign.com/games/starcraft-remastered/pc-20066763,http://www.ign.com/games/rome-total-war-2/pc-136961,http://www.ign.com/games/grand-theft-auto-online/pc-20019837,http://www.ign.com/games/mass-effect-andromeda/pc-20034220,http://www.ign.com/games/the-witcher-3-wild-hunt-blood-and-wine/pc-20035505",Good,7.4,Realistic Violence,T for Teen,Good
