publisher,genres,developers,description,title,url,review_link,price,ign_score,platforms,release_date,related_games,community_score_phrase,community_score,rating_content,rating_category,ign_score_phrase
Sony Online Entertainment,"Real-Time, Strategy",Verant Interactive,"Lords of EverQuest brings the best elements of the real-time strategy (RTS) world together with the epic storyline and depth of the legendary EverQuest fantasy roleplaying game (RPG). By capitalizing on the rich history, detailed characters and literally hundreds of monsters found in EverQuest, and building upon successful feature sets of the RTS genre, Lords of EverQuest creates a revolutionary gaming experience. Three factions will vie for the control of the continent Antonica to ultimately shape the future of Norrath. Players choose from 16 individually customizable heroes to dominate the action on the medieval battlefield. From its graphics, to its ease of use, to its epic storyline, Lords of EverQuest is sure to be the new king of the RTS genre.",Lords of EverQuest,http://www.ign.com/games/lords-of-everquest/pc-550295,http://pc.ign.com/articles/445/445051p1.html,14.99 USD,6.5,PC,"Dec 1, 2003","http://www.ign.com/games/halo-wars-2/pc-20041132,http://www.ign.com/games/starcraft-remastered/pc-20066763,http://www.ign.com/games/rome-total-war-2/pc-136961,http://www.ign.com/games/grand-theft-auto-online/pc-20019837,http://www.ign.com/games/mass-effect-andromeda/pc-20034220,http://www.ign.com/games/the-witcher-3-wild-hunt-blood-and-wine/pc-20035505",Mediocre,5.9,"Blood and Gore, Violence",T for Teen,Okay
Atari,"First-Person, Shooter",Black Ops,"Ten years after John Connor helped save mankind from annihilation, the inevitable has occurred: The mechanized Tech-Com forces have risen, and war between man and machine has begun. Based on the third Terminator movie, but following a separate storyline, Rise of the Machine is a first-person shooter with hand-to-hand combat and vehicle-based elements. The game features over six minutes of original film footage not included in the T3 theatrical release, voices and likenesses of the entire cast, and the ability to play as a Tech-Com Terminator and a CRS Fighter, placing players in both good and evil roles from the film's storyline and beyond.",Terminator 3: Rise of the Machines,http://www.ign.com/games/terminator-3-rise-of-the-machines/ps2-552243,http://ps2.ign.com/articles/445/445080p1.html,9.99 USD,3.5,PS2 Cell PC GCN GBA Xbox,"November 11, 2003","http://www.ign.com/games/star-wars-battlefront-ii-2005/ps2-737697,http://www.ign.com/games/killzone/ps2-568333,http://www.ign.com/games/call-of-duty-finest-hour/ps2-550009,http://www.ign.com/games/shin-megami-tensei-persona-4/ps2-14241813,http://www.ign.com/games/god-of-war-ii/ps2-811719,http://www.ign.com/games/god-of-war-ii/ps2-888576",Mediocre,5.5,"Mild Language, Violence",T for Teen,Awful
Electronic Arts,Action,Griptonite Games,"Third-person, isometric action game, based on EA's own Everything or Nothing console titles. Players earn unlockable rewards for completing objectives with Bond style rather than by brute force. Employ espionage, tactical skills, and Q-Lab gadgets to analyze every situation, master an over-the-top hand-to-hand fighting system, and dispatch your enemies with a variety of useful objects. In addition to linking up to the Nintendo GameCube to access exclusive features, the GBA Bond also features all-out, arena-style combat with up to four players by using the Game Boy Advance Game Link cable to hook up. Multiple game modes and new maps featuring both co-operative and competitive play add a new dimension to link play.",James Bond 007: Everything or Nothing,http://www.ign.com/games/james-bond-007-everything-or-nothing/gba-566621,http://gameboy.ign.com/articles/444/444419p1.html,16.99 USD,8.0,GBA PS2 GCN Xbox,"November 17, 2003","http://www.ign.com/games/metroid-fusion/gba-16227,http://www.ign.com/games/the-legend-of-zelda-the-minish-cap/gba-499614,http://www.ign.com/games/dragon-ball-z-the-legacy-of-goku/gba-17519,http://www.ign.com/games/metroid-fusion/gba-16227,http://www.ign.com/games/pokemon-emerald-version/gba-692344,http://www.ign.com/games/pokemon-ruby-version/gba-17508",Good,7.8,"Mild Animated Violence, Mild Realistic Violence, Suggestive Themes",T for Teen,Great
"Rockstar  Games, Take-Two Interactive","Third-Person, Action","Remedy, Rockstar Vienna","Remedy, the developers of the original Max Payne title have joined forces with Rockstar Games to create the dark and gritty sequel

for PlayStation 2, Xbox and PC. The bullet-time fight sequences that made the first title famous are back, and are more stylish than ever. 

A revamped physics engine and detailed interactive environments turn slow-motion shootout levels into breathtaking cinematic experiences. Rockstar Games has ensured the production values in this tragic film-noir love story are top notch, complete with movie quality voice acting, motion capture, and roller-coaster storyline.",Max Payne 2: The Fall of Max Payne,http://www.ign.com/games/action-replay-ultimate-codes-max-payne-2/ps2-482730,http://ps2.ign.com/articles/444/444361p1.html,19.99 USD,7.9,PS2 PC Xbox 360 Xbox,"December 3, 2003","http://www.ign.com/games/god-of-war-ii/ps2-811719,http://www.ign.com/games/kingdom-hearts/ps2-16467,http://www.ign.com/games/grand-theft-auto-san-andreas/ps2-611957,http://www.ign.com/games/shin-megami-tensei-persona-4/ps2-14241813,http://www.ign.com/games/god-of-war-ii/ps2-811719,http://www.ign.com/games/god-of-war-ii/ps2-888576",Great,8.3,"Mature Sexual Themes, Strong Language, Blood, Intense Violence",M for Mature,Good
Ubisoft,Adventure,"Cyan Worlds, Inc.","In this chapter of the Myst franchise, players can move at their own pace, spending hours discovering the game's real-time 3D worlds, solving a large variety of mind-challenging puzzles, and following an epic storyline. There, players are part of an ever-expanding world that brings more areas to explore and more mysteries to solve.",Uru: Ages Beyond Myst,http://www.ign.com/games/uru-ages-beyond-myst/pc-482160,http://pc.ign.com/articles/444/444432p1.html,29.99 USD,9.0,PC Xbox,"Nov 11, 2003","http://www.ign.com/games/recore/pc-20047415,http://www.ign.com/games/life-is-strange-episode-4/pc-20031273,http://www.ign.com/games/the-walking-dead-the-game/pc-100880,http://www.ign.com/games/grand-theft-auto-online/pc-20019837,http://www.ign.com/games/mass-effect-andromeda/pc-20034220,http://www.ign.com/games/the-witcher-3-wild-hunt-blood-and-wine/pc-20035505",Great,8.4,Suitable for Persons Ages Six and Older,E for Everyone,Amazing
Nintendo,Virtual Pet,Nintendo,"Part virtual pet sim, part activity tool for younger players, Pokemon Channel lets players befriend popular Pokemon Pikachu. In Pokemon Channel, the Pokemon television station has lost segments of its most popular show. Players must find and collect the clips and return them to the station. To aid them in their quest, players call upon the help of Pikachu. Once all the pieces are collected, the show will be restored and ready for broadcast. Everyone can enjoy watching TV with Pikachu and find other ways to play with Pikachu. They can communicate with Pikachu by providing advice, or take Pikachu to a grassy field or forest and get to know other Pokemon.",Pokemon Channel,http://www.ign.com/games/pokemon-channel/gcn-566823,http://cube.ign.com/articles/444/444446p1.html,19.99 USD,5.0,GCN,"December 1, 2003","http://www.ign.com/games/mutsu-to-no-hohon/gcn-481905,http://www.ign.com/games/the-legend-of-zelda-the-wind-waker/gcn-17012,http://www.ign.com/games/super-smash-bros-melee/gcn-16387,http://www.ign.com/games/super-mario-sunshine/gcn-16713",Okay,6.5,No Descriptors,E for Everyone,Mediocre
Disney Internet Group,Action,Lavastorm Engineering,,Tron 2.0: Light Cycles,http://www.ign.com/games/tron-20-light-cycles/cell-616939,http://wireless.ign.com/articles/444/444284p1.html,,7.0,Cell,"Nov 25, 2003","http://www.ign.com/games/just-cause-2/cell-14280725,http://www.ign.com/games/rayman/cell-567023,http://www.ign.com/games/galaxy-on-fire-2/cell-14270785,http://www.ign.com/games/baldurs-gate/cell-688224,http://www.ign.com/games/puzzle-quest-challenge-of-the-warlords/cell-950646,http://www.ign.com/games/just-cause-2/cell-14280725",Great,8.5,,,Good
Atari,Adventure,Atari,"Magic: The Gathering ? Battlegrounds is filled with faithful translations of classic creatures, spells and enchantments from the premier trading card game in a visually stunning 3D game environment rife with real-time strategic fighting, devastating wizard arsenals and intense creature combat.",Magic: The Gathering Battlegrounds,http://www.ign.com/games/magic-the-gathering-battlegrounds/pc-564177,http://pc.ign.com/articles/442/442926p1.html,12.99 USD,7.9,PC Xbox,"Nov 18, 2003","http://www.ign.com/games/recore/pc-20047415,http://www.ign.com/games/life-is-strange-episode-4/pc-20031273,http://www.ign.com/games/the-walking-dead-the-game/pc-100880,http://www.ign.com/games/grand-theft-auto-online/pc-20019837,http://www.ign.com/games/mass-effect-andromeda/pc-20034220,http://www.ign.com/games/the-witcher-3-wild-hunt-blood-and-wine/pc-20035505",Good,7.4,Fantasy Violence,T for Teen,Good
Midway  Games,"Extreme, Sports",Midway  Games,"Freestyle Metal X unleashes anarchy with the freedom to do what you want, when you want. Be anti-establishment: break windows, run over people, ride where you normally can?t ride?and get away with it.

With an unlimited stunt system and a lawless energy, Freestyle Metal X dares riders to push the envelope with psychotic tricks in limitless, freestyle environments full of challenges and side events.

Freestyle Metal X doesn?t just cross the line, it eliminates it. A sizable dose of insanity will help you perform stunts on the tops of buildings, get air over the Vegas Strip, or shoot yourself out of a cannon onto the Marina streets.",Freestyle Metal X,http://www.ign.com/games/freestyle-metal-x/gcn-498839,http://cube.ign.com/articles/442/442839p1.html,19.99 USD,7.6,GCN Xbox PS2,"Oct 3, 2003","http://www.ign.com/games/bmx-xxx/gcn-17510,http://www.ign.com/games/mario-superstar-baseball/gcn-716495,http://www.ign.com/games/madden-nfl-2006/gcn-698630,http://www.ign.com/games/the-legend-of-zelda-the-wind-waker/gcn-17012,http://www.ign.com/games/super-smash-bros-melee/gcn-16387,http://www.ign.com/games/super-mario-sunshine/gcn-16713",Good,7.7,"Blood, Mild Violence, Suggestive Themes",T for Teen,Good
Atari,RPG,BioWare,"One of the most popular and awe-inspiring worlds in the history of pen-and-paper games is reawakened, in this second expansion for Bioware's popular

RPG.

is a high-level (15+) RPG module based on the Advanced Dungeons and Dragons 3rd edition rules. As war erupts between the diverse hordes of the Underdark and the heroes of Waterdeep, RPG players experience an amazing array of characters, creatures and conflict. But that's only the beginning: Hordes of the Underdark provides a remarkable first in Neverwinter Nights play: it allows for rare and powerful Epic characters (levels 21 and beyond), making this pack an absolute must-have for true RPG players.",Neverwinter Nights: Hordes of the Underdark,http://www.ign.com/games/neverwinter-nights-hordes-of-the-underdark/pc-569720,http://pc.ign.com/articles/442/442594p1.html,14.99 USD,8.6,PC Mac Linux,"December 2, 2003","http://www.ign.com/games/mass-effect-andromeda/pc-20034220,http://www.ign.com/games/the-witcher-3-wild-hunt-blood-and-wine/pc-20035505,http://www.ign.com/games/the-witcher-3/pc-134497,http://www.ign.com/games/grand-theft-auto-online/pc-20019837,http://www.ign.com/games/mass-effect-andromeda/pc-20034220,http://www.ign.com/games/the-witcher-3-wild-hunt-blood-and-wine/pc-20035505",Great,8.7,"Blood, Violence",T for Teen,Great
Metro 3D (M3),Puzzle,Frame Studios,"Wrapper in a sci-fi back story, this puzzle game stars the creatures BAU, BAM and BOM who, as Gem Smashers, travel the world to spring, spin, and smash the crystal cells where their friends are imprisoned. It's up to you to help our little heroes survive. Use their magic energy which makes them change colors -- it is only possible for them to break down the gems and free their friends if they are the same color as the gem. The game features various modes of gameplay: Arcade, Story, VS Battle mode, and three special unlockable modes. To guarantee long-term puzzle fun, Gem Smashers offers more than 100 levels in the story mode and over 60 levels in the arcade mode.",Gem Smashers,http://www.ign.com/games/gem-smashers/gba-568467,http://gameboy.ign.com/articles/442/442916p1.html,,8.0,GBA Wii Vita 3DS PS4,"July 1, 2003","http://www.ign.com/games/barbie-superpack/gba-490732,http://www.ign.com/games/tweety-and-the-magic-gems/gba-15444,http://www.ign.com/games/super-monkey-ball-jr/gba-480095,http://www.ign.com/games/metroid-fusion/gba-16227,http://www.ign.com/games/pokemon-emerald-version/gba-692344,http://www.ign.com/games/pokemon-ruby-version/gba-17508",Good,7.2,,E for Everyone,Great
Sony Online Entertainment,RPG,Sony Online Entertainment,"is the second PlayStation 2 edition of the popular online RPG

series. Venture through a living breathing online world complete with huge cities, dungeons and underground lairs. Continually added content and new events will expand the gameplay and make the range of things to do virtually limitless. Create custom characters from a vast list of ten races and fifteen different classes--including the newly added Alchemist--each with specific abilities. Immerse yourself in the bustling online community filled with thousands of players; interact with others by chatting, fighting along side, and helping one another.",EverQuest Online Adventures: Frontiers,http://www.ign.com/games/everquest-online-adventures-frontiers/ps2-566313,http://ps2.ign.com/articles/442/442907p1.html,7.99 USD,7.6,PS2,"November 18, 2003","http://www.ign.com/games/shin-megami-tensei-persona-4/ps2-14241813,http://www.ign.com/games/final-fantasy-x/ps2-14008,http://www.ign.com/games/final-fantasy-xii/ps2-488222,http://www.ign.com/games/shin-megami-tensei-persona-4/ps2-14241813,http://www.ign.com/games/god-of-war-ii/ps2-811719,http://www.ign.com/games/god-of-war-ii/ps2-888576",Good,7.8,"Blood, Suggestive Themes, Violence",T for Teen,Good
Electronic Arts,Platformer,Warthog,"Looney Tunes Back In Action is a hilarious new adventure featuring everyone's favorite cartoon two-some, Bugs Bunny and Daffy Duck, in a globetrotting scavenger hunt to find the mythical Blue Monkey Diamond. From Hollywood to Las Vegas, from Paris to Africa, our roving heroes must run, jump, slide, and bounce their way through a heap of cartoon perils and put an end to the sinister plans of the evil ACME Corporation in an effort to save the world. ""Toon Swapping"" lets you switch between Bugs and Daffy at any time on your quest as you explore loads of exciting challenges on this globetrotting adventure inspired by the movie.",Looney Tunes: Back in Action,http://www.ign.com/games/looney-tunes-back-in-action/gba-498557,http://gameboy.ign.com/articles/442/442912p1.html,29.99 USD,4.5,GBA GCN PS2,"November 11, 2003","http://www.ign.com/games/super-mario-bros-3/gba-497892,http://www.ign.com/games/super-mario-world/gba-16931,http://www.ign.com/games/super-mario-world-2-yoshis-island/gba-482090,http://www.ign.com/games/metroid-fusion/gba-16227,http://www.ign.com/games/pokemon-emerald-version/gba-692344,http://www.ign.com/games/pokemon-ruby-version/gba-17508",Okay,6.5,Mild Animated Violence,E for Everyone,Bad
LucasArts,Action,Planet Moon Studios,"Take a band of gun-toting rebels -a robot, a madman, a mole and a criminal mastermind. Put them in a vividly stunning fantasy realm. Then give them an impossible mission - pulling off the biggest heist of all time in the middle of a war. All you have to do is battle your way through dastardly enemies, giant war machines and an army of psychopathic robots. But don't worry; you have plenty of ammo and absolutely no common sense. Victory is yours in 12,000 bullets or less as your fight your way through 21 action-packed missions, explore five diverse environments, and brandish over 17 outlandish weapons like the Cyclops Sniper Rifle, the Vindaloo Rocket Launcher, or the Topsy-Turvy and Sticky bomb.",Armed & Dangerous,http://www.ign.com/games/armed-dangerous/pc-562207,http://pc.ign.com/articles/442/442917p1.html,29.99 USD,8.3,PC Xbox,"December 2, 2003","http://www.ign.com/games/grand-theft-auto-online/pc-20019837,http://www.ign.com/games/metal-gear-solid-5/pc-20023125,http://www.ign.com/games/resident-evil-7/pc-20054862,http://www.ign.com/games/grand-theft-auto-online/pc-20019837,http://www.ign.com/games/mass-effect-andromeda/pc-20034220,http://www.ign.com/games/the-witcher-3-wild-hunt-blood-and-wine/pc-20035505",Great,8.1,"Crude Humor, Mild Language, Violence",T for Teen,Great
Atari,Adventure,Secret Level,"Magic: The Gathering ? Battlegrounds is filled with faithful translations of classic creatures, spells and enchantments from the premier trading card game in a visually stunning 3D game environment rife with real-time strategic fighting, devastating wizard arsenals and intense creature combat.",Magic: The Gathering Battlegrounds,http://www.ign.com/games/magic-the-gathering-battlegrounds/xbox-15516,http://xbox.ign.com/articles/442/442752p1.html,19.99 USD,7.9,Xbox PC,"Nov 18, 2003","http://www.ign.com/games/call-of-cthulhu-dark-corners-of-the-earth/xbox-496019,http://www.ign.com/games/dreamfall-the-longest-journey/xbox-735105,http://www.ign.com/games/tom-clancys-splinter-cell/xbox-481175,http://www.ign.com/games/halo-2/xbox-482228,http://www.ign.com/games/halo-combat-evolved/xbox-15922,http://www.ign.com/games/fable/xbox-16526",Good,7.3,Fantasy Violence,T for Teen,Good
Atari,Fighting,Dimps,"Go beyond the Dragon Ball Z sagas and experience a new way to battle with the most powerful fighters in the universe. Dragon Ball Z: Budokai 2 will challenge players like no other DBZ game before. Begin with an all-new single player ""Dragon Mode"" that opens the story to new matchups, surprising character appearances and missions that will amaze. You can also battle your friends in multiplayer ""VS."" and ""Tournament"" modes. If your will and skill prevail, you will come face-to-face with Buu, the most lethal of all DBZ villains. Do you have what it takes not only to survive, but to dominate?",Dragon Ball Z Budokai 2,http://www.ign.com/games/dragon-ball-z-budokai-2/ps2-552483,http://ps2.ign.com/articles/442/442606p1.html,29.99 USD,7.4,PS2 GCN,"December 4, 2003","http://www.ign.com/games/tekken-5/ps2-681191,http://www.ign.com/games/mortal-kombat-shaolin-monks/ps2-709115,http://www.ign.com/games/dragon-ball-z-budokai-3/ps2-679951,http://www.ign.com/games/shin-megami-tensei-persona-4/ps2-14241813,http://www.ign.com/games/god-of-war-ii/ps2-811719,http://www.ign.com/games/god-of-war-ii/ps2-888576",Good,7.9,Violence,T for Teen,Good
"Electronic Arts, Electronic Arts",Sports,EA Canada,"EA Sports gives basketball fans a heaping dose of NBA action with NBA Live 2004 for the GameCube, Xbox, PlayStation 2, and PC. Live 2004 delivers the most realistic basketball recreation yet from EA with redesigned player models, as well as all 29 accurately rendered NBA arenas. Customize the level of computer competition with easy-to-use AI adjusting slider controls. 

Simplified controls scheme allows players to run play formations at the touch of a single button. Exclusive EA Sports ""Freestyle Control"" lets players express their game easily with the right analog stick. Updated Dynasty Mode integrates the ability to import favorite college players in order to create the ultimate NBA team.",NBA Live 2004,http://www.ign.com/games/nba-live-2004/pc-566347,http://pc.ign.com/articles/442/442702p1.html,9.99 USD,8.5,PC PS2 Xbox GCN,Fall 2003,"http://www.ign.com/games/nba-2k17/pc-20052300,http://www.ign.com/games/pro-evolution-soccer-2017/pc-20054110,http://www.ign.com/games/wwe-2k17/pc-20063609,http://www.ign.com/games/grand-theft-auto-online/pc-20019837,http://www.ign.com/games/mass-effect-andromeda/pc-20034220,http://www.ign.com/games/the-witcher-3-wild-hunt-blood-and-wine/pc-20035505",Great,8.4,Suitable for Persons Ages Six and Older,E for Everyone,Great
Sierra,Action,Saffire,"Handheld adaptation of J.R.R. Tolkien's famous Lord of the Rings prequel. Produced by Saffire, the minds behind several GBA titles as well as the Brood Wars add-on to PC's Starcraft, Sierra's The Hobbit is a 2D actioner for the GBA with detailed environments and plenty of puzzling thrown in as well. In it, you play Bilbo as he helps out a band of dwarves led by wizard Gandalf, battle the dragon Smaug and swipe that ring from pathetic old Gollum. The game is presented in a perspective similar to the recent Banjo-Kazooie: Grunty's Revenge -- a sort of 3/4 perspective, but with more emphasis placed on vertical objects like walls and trees.",The Hobbit,http://www.ign.com/games/the-hobbit/gba-550098,http://gameboy.ign.com/articles/442/442695p1.html,19.99 USD,6.5,GBA PC PS2 Xbox GCN,"November 11, 2003","http://www.ign.com/games/metroid-fusion/gba-16227,http://www.ign.com/games/the-legend-of-zelda-the-minish-cap/gba-499614,http://www.ign.com/games/dragon-ball-z-the-legacy-of-goku/gba-17519,http://www.ign.com/games/metroid-fusion/gba-16227,http://www.ign.com/games/the-legend-of-zelda-the-minish-cap/gba-499614,http://www.ign.com/games/metroid-zero-mission/gba-566746,http://www.ign.com/games/metroid-fusion/gba-16227,http://www.ign.com/games/pokemon-emerald-version/gba-692344,http://www.ign.com/games/pokemon-ruby-version/gba-17508",Okay,6.8,"Animated Violence, Mild Animated Violence",E for Everyone,Okay
LucasArts,"Third-Person, Shooter",Planet Moon Studios,"Take a band of gun-toting rebels -a robot, a madman, a mole and a criminal mastermind. Put them in a vividly stunning fantasy realm. Then give them an impossible mission - pulling off the biggest heist of all time in the middle of a war. All you have to do is battle your way through dastardly enemies, giant war machines and an army of psychopathic robots. But don't worry; you have plenty of ammo and absolutely no common sense. Victory is yours in 12,000 bullets or less as your fight your way through 21 action-packed missions, explore five diverse environments, and brandish over 17 outlandish weapons like the Cyclops Sniper Rifle, the Vindaloo Rocket Launcher, or the Topsy-Turvy and Sticky bomb.",Armed & Dangerous,http://www.ign.com/games/armed-dangerous/xbox-566932,http://xbox.ign.com/articles/442/442707p1.html,9.99 USD,8.2,Xbox PC,"December 2, 2003","http://www.ign.com/games/halo-2/xbox-482228,http://www.ign.com/games/halo-combat-evolved/xbox-15922,http://www.ign.com/games/doom-3/xbox-482119,http://www.ign.com/games/halo-2/xbox-482228,http://www.ign.com/games/halo-combat-evolved/xbox-15922,http://www.ign.com/games/fable/xbox-16526",Great,8.2,"Mild Language, Realistic Violence",T for Teen,Great
Square,Action,Brownie Brown,"Despite its similarities in name,

isn't exactly a sequel to the classic SNES adventure,

. It's actually a rethinking and retelling of a past Game Boy classic RPG created by Square,

released a decade ago.

, while sharing the same storyline and characters, has been enhanced with improved graphics and sound, as well as much more impressive creatures and extended challenges. It's almost like an entirely new adventure. The game also features link-up support that will enhance the single-player adventure; the more friends that players link up to, the more powerful the special ""Amigo"" attack will become during the battles.",Sword of Mana,http://www.ign.com/games/sword-of-mana/gba-487812,http://gameboy.ign.com/articles/442/442729p1.html,34.99 USD,7.0,GBA,"December 1, 2003","http://www.ign.com/games/metroid-fusion/gba-16227,http://www.ign.com/games/the-legend-of-zelda-the-minish-cap/gba-499614,http://www.ign.com/games/dragon-ball-z-the-legacy-of-goku/gba-17519,http://www.ign.com/games/dragon-ball-z-the-legacy-of-goku/gba-17519,http://www.ign.com/games/final-fantasy-tactics-advance/gba-480116,http://www.ign.com/games/fire-emblem/gba-499430,http://www.ign.com/games/metroid-fusion/gba-16227,http://www.ign.com/games/pokemon-emerald-version/gba-692344,http://www.ign.com/games/pokemon-ruby-version/gba-17508",Good,7.8,Fantasy Violence,E for Everyone,Good
