publisher,genres,developers,description,title,url,review_link,price,ign_score,platforms,release_date,related_games,community_score_phrase,community_score,rating_content,rating_category,ign_score_phrase
Activision,"Extreme Sports, Sports",Edge of Reality,"While Tony Hawk's Pro Skater put extreme sports on the videogame map, Tony Hawk's Pro Skater 2 redefined an already great game. Its addition of stellar new features (like Create-A-Park), and great gameplay tweaks (the manual maneuver will be copied for years to come) made it the best installment in a killer series of games. Anyone who has ever skated the Philadelphia level will agree -- this game is a masterpiece of level design. Hell, it's a masterpiece all around. There isn't a bad park or dull moment, just pure gaming nirvana. Developed by Neversoft Entertainment, THPS2 came out in 2000 across a range of platforms.",Tony Hawk's Pro Skater 2,http://www.ign.com/games/tony-hawks-pro-skater-2/n64-14169,http://ign64.ign.com/articles/164/164169p1.html,20.99 USD,8.6,N64 DC GBA iPhone PC Mac PS GBC Xbox,"August 15, 2001","http://www.ign.com/games/mario-golf/n64-10628,http://www.ign.com/games/international-superstar-soccer-2000/n64-15240,http://www.ign.com/games/all-star-baseball-2000/n64-1907,http://www.ign.com/games/the-legend-of-zelda-ocarina-of-time/n64-437,http://www.ign.com/games/the-legend-of-zelda-ocarina-of-time/n64-14248881,http://www.ign.com/games/the-legend-of-zelda-majoras-mask/n64-1933",Great,8.7,"Comic Mischief, Mild Lyrics, Mild Violence",E for Everyone,Great
Nintendo,"Turn-Based, RPG",Camelot Software Planning,"RPG from the makers of Shining Force, featuring an  adventure filled with tried-and-true overhead-wandering, random-battle gameplay that looks absolutely sweet on the Game Boy Advance small screen...in fact, this game arguably rivals most of the classic RPGs that have ended up on the console systems, like Dragon Warrior or the aforementioned Final Fantasy series, for example. You play Isaac, a young swordsman and resident of the town of Vale, and at the beginning of the adventure a storm is brewing outside that forces Isaac to flee to safety. But every virtual adventurer knows that it's never as simple as that, and eventually you're thrust into the role of the world's savior, befriending other skilled adventurers that will join your crusade...there's strength in numbers, as the phrase goes.",Golden Sun,http://www.ign.com/games/golden-sun/gba-15255,http://gameboy.ign.com/articles/165/165255p1.html,14.99 USD,9.7,GBA Wii U,November 2001,"http://www.ign.com/games/pokemon-emerald-version/gba-692344,http://www.ign.com/games/pokemon-ruby-version/gba-17508,http://www.ign.com/games/pokemon-firered-version/gba-605909,http://www.ign.com/games/metroid-fusion/gba-16227,http://www.ign.com/games/pokemon-emerald-version/gba-692344,http://www.ign.com/games/pokemon-ruby-version/gba-17508",Amazing,9.1,Mild Violence,E for Everyone,Amazing
Microsoft,Adventure,Oddworld Inhabitants,"In Oddworld, you played as a former slave/worker that, almost despite himself, rose to lead his Mudokon people against the evil corporate scumbags the Glukkons. In Munch you're introduced to a new race, the Gabbits, who have been driven to extinction simply because their lungs happen to match the chain-smoking Glukkon's size and fit for replacement surgery. To make matters worse, Munch has been implanted with a sonic device by the Vykkers in an experiment, and is to be used to capture more creatures. With the help of the Fuzzles, big-toothed fuzzballs used for product testing, Munch escapes, meets up with Abe, and together they set out to stop the Glukkons at their game... not to mention win back the last can of Gabbiar -- Gabbit eggs -- in the world.",Oddworld: Munch's Oddysee,http://www.ign.com/games/oddworld-munchs-oddysee/xbox-15524,http://xbox.ign.com/articles/165/165524p1.html,19.99 USD,7.4,Xbox GBA Vita PS3 PS2 Xbox 360 PC,"November 09, 2001","http://www.ign.com/games/call-of-cthulhu-dark-corners-of-the-earth/xbox-496019,http://www.ign.com/games/dreamfall-the-longest-journey/xbox-735105,http://www.ign.com/games/tom-clancys-splinter-cell/xbox-481175,http://www.ign.com/games/halo-2/xbox-482228,http://www.ign.com/games/halo-combat-evolved/xbox-15922,http://www.ign.com/games/fable/xbox-16526",Good,7.9,"Comic Mischief, Violence",T for Teen,Good
Activision,"Extreme Sports, Sports",Shaba Games,"The Tony Hawk's Pro Skater series comes back to the PlayStation for this installment. Tony Hawk's Pro Skater 3 delivers realistic, cutting edge graphics, action-packed gameplay, seamless video cinematic sequences and crisp special effects. The game extends beyond the boundaries of the traditional skateboarding genre by setting players in living environments that evolve. Players can choose to skate through realistic urban settings complete with pedestrians, cars, traffic accidents, natural disasters and changing weather conditions. Players go high flying through some of the hottest skating locales in the world including Skater's Island in Middleton, Rhode Island, Rio, Los Angeles, Canada, Tokyo and Paris. Fluid animations let gamers pull off hundreds of combo moves and tricks including nollies, manuals and lip tricks using the franchise's signature solid control scheme.",Tony Hawk's Pro Skater 3,http://www.ign.com/games/tony-hawks-pro-skater-3/ps-16309,http://psx.ign.com/articles/166/166309p1.html,14.99 USD,9.6,PS GBA GBC Xbox PS2 GCN PC N64 Mac,"November 1, 2001","http://www.ign.com/games/ncaa-football-2001/ps-14657,http://www.ign.com/games/nhl-2001/ps-14658,http://www.ign.com/games/tony-hawks-pro-skater-2/ps-14304,http://www.ign.com/games/final-fantasy-vii/ps-494,http://www.ign.com/games/final-fantasy-viii/ps-3847,http://www.ign.com/games/baldurs-gate/ps-13673",Great,8.6,"Mild Lyrics, Violence",E for Everyone,Amazing
Electronic Arts,Adventure,Argonaut Games,"What a lucky kid! Harry's got his own book series, a feature film directed by Steven Spielberg, and now his very own video game for the PlayStation. Based on J.K. Rowling's popular novels for young people, HARRY POTTER AND THE SORCERER'S STONE (the game) pretty much follows the story of the original book. You'll begin as a first-year student at Hogwarts School of Witchcraft and Wizardry; eventually perfecting your skills to the point where you can venture out into the real world and try a few things out. There are plenty of popular characters to keep young gamers as enthralled as they were by the books (Hermione Granger, Ron Weasley, and Draco Malfoy among others are all here), and there's an encounter at the end of the game with a not-so-friendly face from the story. The game is packed with tons of magic, secrets, power-ups and hidden goodies for kids to seek out, and the graphics do the story justice.",Harry Potter and the Sorcerer's Stone,http://www.ign.com/games/harry-potter-and-the-sorcerers-stone/ps-16595,http://psx.ign.com/articles/166/166595p1.html,28.99 USD,8.0,PS GBC Xbox GCN Mac PC GBA PS2,"November 11, 2001","http://www.ign.com/games/silent-hill/ps-3982,http://www.ign.com/games/dino-crisis/ps-11235,http://www.ign.com/games/oddworld-abes-oddysee/ps-2094,http://www.ign.com/games/final-fantasy-vii/ps-494,http://www.ign.com/games/final-fantasy-viii/ps-3847,http://www.ign.com/games/baldurs-gate/ps-13673",Good,7.5,"Comic Mischief, Mild Violence",E for Everyone,Great
Ubisoft,"First-Person, Action",Red Storm Entertainment,"The Red Army is back. Now that Russia's government has collapsed, a hardline leader is bent on taking over the republics. Enter Ghost Recon, an advanced, futuristic squad of U.S. Army soldiers. Unlike previous Rainbow Six games, the setting is much more focused on the military instead of anti-terrorist maneuvers. Next-generation inventory and weapons will give players a glimpse into the real U.S. Army ""Land Warrior"" program on which Ghost Recon is based.",Tom Clancy's Ghost Recon,http://www.ign.com/games/tom-clancys-ghost-recon/pc-16525,http://pc.ign.com/articles/166/166525p1.html,49.99 USD,9.3,PC GBA PS3 PS2 Xbox GCN NNG,"Nov 13, 2001","http://www.ign.com/games/grand-theft-auto-online/pc-20019837,http://www.ign.com/games/metal-gear-solid-5/pc-20023125,http://www.ign.com/games/resident-evil-7/pc-20054862,http://www.ign.com/games/grand-theft-auto-online/pc-20019837,http://www.ign.com/games/mass-effect-andromeda/pc-20034220,http://www.ign.com/games/the-witcher-3-wild-hunt-blood-and-wine/pc-20035505",Great,8.6,"Blood and Gore, Violence",M for Mature,Amazing
Capcom,RPG,Capcom Production Studio 2,"In the future, a young net-battler named Lan boots his 'personal information terminal'(PET) and prepares to hack into the network to battle net crime. Lan's PET is no ordinary network navigator. It is Mega Man.EXE, the cyber-identity, which infiltrates the crime-ridden network to battle destructive computer viruses. Defeat viruses in real time and collect Battle Chips program data, containing valuable weapons data and critical system info. Collect over 175 Battle Chips to help Netto and Mega Man.EXE restore peace and order to the network. Trade Battle Chips with your friends using a link cable.",Mega Man Battle Network,http://www.ign.com/games/mega-man-battle-network/gba-15252,http://gameboy.ign.com/articles/165/165252p1.html,12.99 USD,8.5,GBA Cell Wii U,"November 1, 2001","http://www.ign.com/games/pokemon-emerald-version/gba-692344,http://www.ign.com/games/pokemon-ruby-version/gba-17508,http://www.ign.com/games/pokemon-firered-version/gba-605909,http://www.ign.com/games/metroid-fusion/gba-16227,http://www.ign.com/games/pokemon-emerald-version/gba-692344,http://www.ign.com/games/pokemon-ruby-version/gba-17508",Great,8.3,No Descriptors,E for Everyone,Great
Microsoft,Racing,Bizarre Creations,"Project Gotham is a racing game set in real cities. Your driving skill, style and daring are pushed to the limit!  Choose from more than 25 different cars and compete on more than 200 city-based circuits in this future generation racing game; fun and reward come from focusing equally on speed, flair and risk-taking!",Project Gotham Racing,http://www.ign.com/games/project-gotham-racing/xbox-16195,http://xbox.ign.com/articles/166/166195p1.html,49.99 USD,8.8,Xbox,"November 08, 2001","http://www.ign.com/games/forza-motorsport/xbox-682857,http://www.ign.com/games/need-for-speed-most-wanted/xbox-740898,http://www.ign.com/games/action-replay-ultimate-codes-need-for-speed-underground-2/xbox-679033,http://www.ign.com/games/halo-2/xbox-482228,http://www.ign.com/games/halo-combat-evolved/xbox-15922,http://www.ign.com/games/fable/xbox-16526",Great,8.4,Mild Lyrics,E for Everyone,Great
Microsoft,"First-Person, Shooter",Bungie Software,"As a member of an elite military force, you must fight to defend the Earth from alien aggressors on the ancient alien artifact known as Halo. You must fight your way through Halo's mountainous terrain and underground labyrinth to discover the secrets of the mysterious world, and protect the human race. Escaping Halo with your life requires a cunning wit and a major arsenal of weapons.

Switch between foot-based fighting and vehicle-based attacks, where you can pilot flyers, tanks, or buggies, or man the guns while another squad member drives. Multiplayer action in Halo: Combat Evolved gives players the option of co-op missions or free-for-all shootouts.",Halo: Combat Evolved,http://www.ign.com/games/halo-combat-evolved/xbox-15922,http://xbox.ign.com/articles/165/165922p1.html,19.99 USD,9.7,Xbox PS2 Mac Xbox 360 PC Giz,"November 15, 2001","http://www.ign.com/games/halo-2/xbox-482228,http://www.ign.com/games/doom-3/xbox-482119,http://www.ign.com/games/half-life-2/xbox-552580,http://www.ign.com/games/halo-2/xbox-482228,http://www.ign.com/games/fable/xbox-16526,http://www.ign.com/games/star-wars-knights-of-the-old-republic/xbox-480687",Amazing,9.3,"Blood and Gore, Violence",M for Mature,Amazing
BAM! Entertainment,Action,Virtucraft Ltd.,"Dexter has created the ultimate invention - The Clone-a-matic - but his older sister Dee Dee has meddled again and accidentally cloned herself. And, there's not just one of her. Dexter's Laboratory is infested with mini-Dee Dee's bent on destroying Dexter's wonderful experiments - what a nightmare! It's up to players to help Dexter catch the Dee Dee's, put his lab back to normal, and get Dee Dee back to her single self before Mom calls for dinner.",Dexter's Laboratory: Deesaster Strikes,http://www.ign.com/games/dexters-laboratory-deesaster-strikes/gba-15408,http://gameboy.ign.com/articles/165/165408p1.html,8.99 USD,6.5,GBA,November 2001,"http://www.ign.com/games/metroid-fusion/gba-16227,http://www.ign.com/games/the-legend-of-zelda-the-minish-cap/gba-499614,http://www.ign.com/games/dragon-ball-z-the-legacy-of-goku/gba-17519,http://www.ign.com/games/metroid-fusion/gba-16227,http://www.ign.com/games/pokemon-emerald-version/gba-692344,http://www.ign.com/games/pokemon-ruby-version/gba-17508",Okay,6.3,,E for Everyone,Okay
Microsoft,Party,Blitz Games,Fuzion Frenzy is a non-stop party game. which combines frenetic action of a futuristic street sport with the action-packed fun of mini-games set in a dynamic 3-D urban environment. The game includes six arenas and more than 45 mini-games.,Fuzion Frenzy,http://www.ign.com/games/fuzion-frenzy/xbox-16189,http://xbox.ign.com/articles/166/166189p1.html,9.99 USD,8.3,Xbox Xbox 360,"October 24, 2001","http://www.ign.com/games/nickelodeon-party-blast/xbox-481306,http://www.ign.com/games/shrek-super-party/xbox-482491,http://www.ign.com/games/fuzion-frenzy-2/xbox-487477,http://www.ign.com/games/halo-2/xbox-482228,http://www.ign.com/games/halo-combat-evolved/xbox-15922,http://www.ign.com/games/fable/xbox-16526",Good,7.9,Violence,E for Everyone,Great
Electronic Arts,Sports,EA Tiburon,"Madden NFL 2002 for the Xbox is the latest in the stellar Madden series of sports games. This version features enhanced AI and graphics, and all the great gameplay that has made the Madden series one of the top-selling series of games for every platform. Madden NFL 2002 was GameSpy's Xbox Game of the Year for 2001.",Madden NFL 2002,http://www.ign.com/games/madden-nfl-2002/xbox-16236,http://xbox.ign.com/articles/166/166236p1.html,4.99 USD,8.6,Xbox GCN PC GBC PS PS2 GBA N64,"October 31, 2001","http://www.ign.com/games/espn-nfl-2k5/xbox-674666,http://www.ign.com/games/dead-or-alive-xtreme-beach-volleyball/xbox-482154,http://www.ign.com/games/tony-hawks-american-wasteland/xbox-740724,http://www.ign.com/games/halo-2/xbox-482228,http://www.ign.com/games/halo-combat-evolved/xbox-15922,http://www.ign.com/games/fable/xbox-16526",Great,8.3,No Descriptors,E for Everyone,Great
"Take-Two Interactive , Gathering of Developers (aka GOD Games)","Real-Time, Strategy",MumboJumbo,"Myth III is the third installment of this ground-breaking series of real-time strategy games. Set one thousand years before the other games, it explores the life of Connacht the Wolf. Set in 1421 AE, Myth III: The Wolf Age opens with the world in chaos. Most of humanity has been scattered for centuries. To defeat your enemies, you must cast spells, gain experience, collect items, and build ancient devices. The single-player campaign spans 25 levels with over 40 units.",Myth III: The Wolf Age,http://www.ign.com/games/myth-iii-the-wolf-age/pc-15794,http://pc.ign.com/articles/165/165794p1.html,14.99 USD,8.7,PC Mac,"November 2, 2001","http://www.ign.com/games/halo-wars-2/pc-20041132,http://www.ign.com/games/starcraft-remastered/pc-20066763,http://www.ign.com/games/rome-total-war-2/pc-136961,http://www.ign.com/games/grand-theft-auto-online/pc-20019837,http://www.ign.com/games/mass-effect-andromeda/pc-20034220,http://www.ign.com/games/the-witcher-3-wild-hunt-blood-and-wine/pc-20035505",Great,8.0,"Blood and Gore, Violence",M for Mature,Great
Electronic Arts,Racing,EA Tiburon,"EA Sports brings all the excitement of NASCAR to the Xbox with a stock car racing sim that looks and feels like the real thing. The advanced new graphics engine creates realistic cars and tracks, with heavy environmental interaction and realistic damage models.  The racing fields sport the entire 43 cars, and all 23 real NASCAR tracks are represented. Look for every NASCAR star from rookie to veteran to make an appearance.

The Career mode lets you create your own driver and car, then customize it to your specifications. Just like in reality, landing the big sponsors is the key to success.",NASCAR Thunder 2002,http://www.ign.com/games/nascar-thunder-2002/xbox-16237,http://xbox.ign.com/articles/166/166237p1.html,7.99 USD,8.5,Xbox PS2 PS,"November 8, 2001","http://www.ign.com/games/forza-motorsport/xbox-682857,http://www.ign.com/games/need-for-speed-most-wanted/xbox-740898,http://www.ign.com/games/action-replay-ultimate-codes-need-for-speed-underground-2/xbox-679033,http://www.ign.com/games/halo-2/xbox-482228,http://www.ign.com/games/halo-combat-evolved/xbox-15922,http://www.ign.com/games/fable/xbox-16526",Good,7.9,,E for Everyone,Great
Infogrames,Racing,Angel Studios,"Test Drive Off-Road ? Wide Open gives you brute force off-road racing through nature's untamed badlands. Twelve kick-ass trucks fight for off-road supremacy in the wide open wilderness. Prove your skills in a Hummer, Dodge T-Rex, Ford Bronco, and more. Take towering jumps at high speeds in your unstoppable trucks. Grab your guts and hold on, because this one gets rough!",Test Drive Off-Road -- Wide Open,http://www.ign.com/games/test-drive-off-road-wide-open/xbox-16854,http://xbox.ign.com/articles/166/166854p1.html,12.99 USD,7.0,Xbox PS2,"November 14, 2001","http://www.ign.com/games/forza-motorsport/xbox-682857,http://www.ign.com/games/need-for-speed-most-wanted/xbox-740898,http://www.ign.com/games/action-replay-ultimate-codes-need-for-speed-underground-2/xbox-679033,http://www.ign.com/games/halo-2/xbox-482228,http://www.ign.com/games/halo-combat-evolved/xbox-15922,http://www.ign.com/games/fable/xbox-16526",Good,7.1,Mild Lyrics,E for Everyone,Good
Microsoft,Flight,Microsoft,"Flight Simulator 2002 is the latest in the Flight Simulator series from Microsoft Games. It includes real-time, interactive ATC, new auto-generated scenery and visual effects, cool new airplanes ? including a floatplane ? plus more activities to challenge and excite new virtual pilots and long-time enthusiasts.",Microsoft Flight Simulator 2002,http://www.ign.com/games/microsoft-flight-simulator-2002/pc-16184,http://pc.ign.com/articles/166/166184p1.html,44.99 USD,9.0,PC,"Nov 1, 2001","http://www.ign.com/games/squadron-42/pc-20046151,http://www.ign.com/games/star-citizen/pc-144978,http://www.ign.com/games/microsoft-flight/pc-83711,http://www.ign.com/games/mechwarrior-online/pc-18954,http://www.ign.com/games/stardew-valley/pc-20001247,http://www.ign.com/games/omerta-city-of-gangsters-134706/pc-129676,http://www.ign.com/games/grand-theft-auto-online/pc-20019837,http://www.ign.com/games/mass-effect-andromeda/pc-20034220,http://www.ign.com/games/the-witcher-3-wild-hunt-blood-and-wine/pc-20035505",Great,8.4,No Descriptors,E for Everyone,Amazing
Sony Computer Entertainment,Platformer,"SCEA, Disney Interactive Studios","What would you say if you found out that the scary monsters hiding in children's closet were all part of a corporate conspiracy? Well, that's the premise of the 2001 Disney or Pixar film, Monsters, Inc., and it's the basis of this videogame for the PlayStation. Play as either Sully or Mike two of the monsters hired to scare little kids as you move from house to house, just trying to do your job. The company you work for is in the business of drumming up ""scream energy,"" so you'll have to be extra frightening if you hope to succeed. Each of the game's 3D environments is detailed and expansive, representing the movie well, and there are dozens of hidden bonuses and power-ups that you can use toy your advantage.","Monsters, Inc. Scream Team",http://www.ign.com/games/monsters-inc-scream-team/ps-17233,http://psx.ign.com/articles/167/167233p1.html,19.99 USD,7.5,PS PSP PS3 PC,"November 5, 2001","http://www.ign.com/games/crash-bandicoot/ps-603,http://www.ign.com/games/crash-bandicoot-warped/ps-3919,http://www.ign.com/games/crash-bandicoot-2-cortex-strikes-back/ps-2037,http://www.ign.com/games/final-fantasy-vii/ps-494,http://www.ign.com/games/final-fantasy-viii/ps-3847,http://www.ign.com/games/baldurs-gate/ps-13673",Good,7.4,Animated Violence,E for Everyone,Good
SEGA,Puzzle,Amusement Vision,"Labyrinth/Marble Madness hybrid with a unique platform twist, based on the Sega arcade game of the same name. Players control not a character, but tilt the entire environment to guide their ""monkey ball"" to the goal. Super Monkey Ball's ""Main Mode"" is constructed of more than 110 different levels of various difficulty, most of them taken from the arcade game. Players begin their monkey adventure going through these different levels on various settings of difficulty. There are an initial 10 Beginner levels, 30 Advanced, and 50 Expert, as well as extra versions on top of it all. A smattering of multiplayer modes rounds off the package.",Super Monkey Ball,http://www.ign.com/games/super-monkey-ball/gcn-16538,http://cube.ign.com/articles/166/166538p1.html,19.99 USD,8.3,GCN iPhone NNG Arcade Cell WinPhone,"November 18, 2001","http://www.ign.com/games/chibi-robo/gcn-550539,http://www.ign.com/games/super-monkey-ball-2/gcn-481482,http://www.ign.com/games/roll-o-rama/gcn-482164,http://www.ign.com/games/action-replay-ultimate-codes-mario-kart-double-dash/gcn-16574,http://www.ign.com/games/mario-superstar-baseball/gcn-716495,http://www.ign.com/games/kirby-air-ride/gcn-499716,http://www.ign.com/games/the-legend-of-zelda-the-wind-waker/gcn-17012,http://www.ign.com/games/super-smash-bros-melee/gcn-16387,http://www.ign.com/games/super-mario-sunshine/gcn-16713",Great,8.5,Mild Violence,E for Everyone,Great
Nintendo,Adventure,Nintendo EAD,"Luigi steps out from the shadow of his brother Mario and into the gloomy shadows of a very haunted house in this, his first-ever starring role.  When Luigi learns that he's the proud new owner of a creepy old mansion, he's thrilled. Of course, his feelings immediately shift when his brother, the storied Mario, disappears from the house. Now, you'll have to help Luigi track his brother down, making your way through expansive 3D levels. Each stage is packed with ghosts and ghouls to put you on edge; and you'll be armed with a flashlight and a vacuum cleaner to help you capture your foes. Armed with a flashlight and a customized vacuum cleaner, Luigi must rid the mansion of Boos and ghouls -- and find his missing brother to boot!",Luigi's Mansion,http://www.ign.com/games/luigis-mansion/gcn-15453,http://cube.ign.com/articles/165/165453p1.html,19.99 USD,7.0,GCN,"November 18, 2001","http://www.ign.com/games/star-fox-adventures/gcn-16140,http://www.ign.com/games/harvest-moon-magical-melody/gcn-780378,http://www.ign.com/games/eternal-darkness-sanitys-requiem/gcn-15887,http://www.ign.com/games/the-legend-of-zelda-the-wind-waker/gcn-17012,http://www.ign.com/games/super-smash-bros-melee/gcn-16387,http://www.ign.com/games/super-mario-sunshine/gcn-16713",Great,8.1,No Descriptors,E for Everyone,Good
LucasArts,Flight,"Factor 5, LucasArts","In Star Wars Rogue Squadron II: Rogue Leader you get the chance to jump into the cockpit of an X-wing and join Luke Skywalker and the Star Wars galaxy's most daring pilots as they return to face off against the Empire. As in the original hit game for N64, you'll relive favorite Star Wars battles including the perilous Death Star trench run, a daring space attack on a Star Destroyer and the legendary battle on the ice planet Hoth. Rogue Leader features stunning, movie like visuals and immerses players in an intense action-arcade experience. Aerial conflict takes place in a variety of craft such as the legendary X-wing, A-wing, and B-wing. For the first time, the game also features on-foot ground combat in missions directly based on or inspired by the original movie trilogy.",Star Wars Rogue Squadron II: Rogue Leader,http://www.ign.com/games/star-wars-rogue-squadron-ii-rogue-leader/gcn-15337,http://cube.ign.com/articles/165/165337p1.html,19.99 USD,9.1,GCN,"November 18, 2001","http://www.ign.com/games/pilotwings-948988/gcn-552530,http://www.ign.com/games/zero-fighter-war-report/gcn-495852,http://www.ign.com/games/army-men-air-combat-the-elite-missions/gcn-486788,http://www.ign.com/games/action-replay-ultimate-codes-mario-kart-double-dash/gcn-16574,http://www.ign.com/games/mario-superstar-baseball/gcn-716495,http://www.ign.com/games/kirby-air-ride/gcn-499716,http://www.ign.com/games/the-legend-of-zelda-the-wind-waker/gcn-17012,http://www.ign.com/games/super-smash-bros-melee/gcn-16387,http://www.ign.com/games/super-mario-sunshine/gcn-16713",Great,8.7,Violence,T for Teen,Amazing
Microsoft,"Persistent Online, RPG",Turbine,"An expansion to Asheron's Call adding a new island called Marae Lassel that will have areas for all levels of characters. Player housing and personal storage will be introduced, with about one thousand pre-built houses per game world. Four new, major monsters types will be introduced.",Asheron's Call: Dark Majesty,http://www.ign.com/games/asherons-call-dark-majesty/pc-16139,http://pc.ign.com/articles/166/166139p1.html,16.99 USD,8.4,PC,late 2001,"http://www.ign.com/games/mass-effect-andromeda/pc-20034220,http://www.ign.com/games/the-witcher-3-wild-hunt-blood-and-wine/pc-20035505,http://www.ign.com/games/the-witcher-3/pc-134497,http://www.ign.com/games/grand-theft-auto-online/pc-20019837,http://www.ign.com/games/mass-effect-andromeda/pc-20034220,http://www.ign.com/games/the-witcher-3-wild-hunt-blood-and-wine/pc-20035505",Amazing,9.0,Blood,T for Teen,Great
