publisher,genres,developers,description,title,url,review_link,price,ign_score,platforms,release_date,related_games,community_score_phrase,community_score,rating_content,rating_category,ign_score_phrase
Interplay,Racing,Rage Software,"Off-Road Redneck Racing is an off road racing game inspired by Redneck Rampage.  It's an arcade style racing game that features stunning visual graphics.  Off-Road Redneck Racing features 16 different vehicles, 24 tracks, and six completely unique locations.",Off-Road Redneck Racing,http://www.ign.com/games/off-road-redneck-racing/pc-15990,http://pc.ign.com/articles/165/165990p1.html,9.99 USD,7.2,PC,"May 4, 2001","http://www.ign.com/games/forza-horizon-3/pc-20054784,http://www.ign.com/games/flatout-4/pc-20068143,http://www.ign.com/games/ubisoft-the-crew/pc-20000080,http://www.ign.com/games/grand-theft-auto-online/pc-20019837,http://www.ign.com/games/mass-effect-andromeda/pc-20034220,http://www.ign.com/games/the-witcher-3-wild-hunt-blood-and-wine/pc-20035505",Good,7.7,Mild Language,E for Everyone,Good
Kemco,Puzzle,Kemco,Tweety's been cursed! A run-in with bad mojo leaves everyone's favorite big-headed bird in danger of being turned to stone. The only way to lift the curse is for Tweety's friends to find five Magic Gems scattered around the world.,Tweety and the Magic Gems,http://www.ign.com/games/tweety-and-the-magic-gems/gba-15444,http://gameboy.ign.com/articles/165/165444p1.html,19.99 USD,4.5,GBA,July 2001,"http://www.ign.com/games/barbie-superpack/gba-490732,http://www.ign.com/games/super-monkey-ball-jr/gba-480095,http://www.ign.com/games/chu-chu-rocket/gba-15981,http://www.ign.com/games/metroid-fusion/gba-16227,http://www.ign.com/games/pokemon-emerald-version/gba-692344,http://www.ign.com/games/pokemon-ruby-version/gba-17508",Mediocre,5.0,,E for Everyone,Bad
Take-Two Interactive,"Third-Person, Action",Human Head Studios,"In

, players assume the role of Ragnar the Viking; the mightiest warrior of a bygone age. In a land where might makes right, it is Ragnar who doles out justice with the blade of his massive battleaxe. His ultimate goal is to confront the Sark Amen, the shadowy warrior-masters of the netherworld. During his journey,

will gain access to 15 different weapons -- including a two-handed sword, magical blades, throwing axes, and war hammers -- as he comes face to face with Dark Vikings, underground dwellers, goblins, and a mysterious race of super beings.",Rune: Viking Warlord,http://www.ign.com/games/rune-viking-warlord/ps2-15838,http://ps2.ign.com/articles/165/165838p1.html,19.99 USD,5.5,PS2,"July 30, 2001","http://www.ign.com/games/god-of-war-ii/ps2-811719,http://www.ign.com/games/kingdom-hearts/ps2-16467,http://www.ign.com/games/grand-theft-auto-san-andreas/ps2-611957,http://www.ign.com/games/god-of-war-ii/ps2-811719,http://www.ign.com/games/grand-theft-auto-san-andreas/ps2-611957,http://www.ign.com/games/god-of-war/ps2-661321,http://www.ign.com/games/shin-megami-tensei-persona-4/ps2-14241813,http://www.ign.com/games/god-of-war-ii/ps2-811719,http://www.ign.com/games/god-of-war-ii/ps2-888576",Okay,6.7,Animated Violence,M for Mature,Mediocre
Sony Computer Entertainment,"Third-Person, Action",Deep Space,"You are U.S. Marine Special Forces Agent, Dennis Riley. Your mission: to stay alive and to take out an infestation of monsters and mutants that have invaded a secret Antarctic military base. Braving the unforgiving hazards, players must run, jump, and climb their way through several realistic environments as they fight an army of unrecognizable organisms with a customizable assault rifle. Other features include: skillfully employed traps created by your enemies, detailed facial expressions and reactions, realistic real-time lighting and weather effects, and a multitude of authentic military situations supervised by Combat Magazine's weapons expert Ichiro Nagata.",Extermination,http://www.ign.com/games/extermination/ps2-14249,http://ps2.ign.com/articles/164/164249p1.html,14.99 USD,6.9,PS2,"July 24, 2001","http://www.ign.com/games/god-of-war-ii/ps2-811719,http://www.ign.com/games/kingdom-hearts/ps2-16467,http://www.ign.com/games/grand-theft-auto-san-andreas/ps2-611957,http://www.ign.com/games/god-of-war-ii/ps2-811719,http://www.ign.com/games/grand-theft-auto-san-andreas/ps2-611957,http://www.ign.com/games/god-of-war/ps2-661321,http://www.ign.com/games/shin-megami-tensei-persona-4/ps2-14241813,http://www.ign.com/games/god-of-war-ii/ps2-811719,http://www.ign.com/games/god-of-war-ii/ps2-888576",Good,7.4,"Animated Violence, Realistic Blood, Realistic Violence",M for Mature,Okay
"Gathering of Developers (aka GOD Games), 3D Realms",Action,Remedy,"Max Payne is a man with nothing to lose in the violent, cold urban night. A fugitive undercover cop framed for murder, and now hunted by cops and the mob. Max is a man with his back against the wall, fighting a battle he cannot hope to win.

Max Payne is a relentless story-driven shooter about a man on the edge, fighting for his justice while uncovering plot-twists and twisted thugs in the gritty bowels of New York during the century's worst blizzard. Using the innovative Bullet Time mechanic, players can slow their sense of time in order to focus shots in intense encounters for deadly accuracy in life-or-death gun duels.",Max Payne,http://www.ign.com/games/max-payne/pc-11645,http://pc.ign.com/articles/161/161645p1.html,19.99 USD,9.3,PC PS2 Mac Xbox 360 DC Xbox Android PS4 iPhone GBA PS3,"Jul 25, 2001","http://www.ign.com/games/grand-theft-auto-online/pc-20019837,http://www.ign.com/games/metal-gear-solid-5/pc-20023125,http://www.ign.com/games/resident-evil-7/pc-20054862,http://www.ign.com/games/grand-theft-auto-online/pc-20019837,http://www.ign.com/games/mass-effect-andromeda/pc-20034220,http://www.ign.com/games/the-witcher-3-wild-hunt-blood-and-wine/pc-20035505",Amazing,9.0,"Blood, Violence",M for Mature,Amazing
Xicat Interactive,Strategy,Funatics,"Cultures is a god game in which each and every one of the game's characters is important to the growth and welfare of their kin- each having their own minds and talents. Their lives are in your hands. In a small Viking village, somewhere in Greenland, the blaring sun raced across the sky. Blinded by the light, the horrified villagers watched as it broke into 12 different pieces as it fell toward the earth. Thinking that the Viking deities expected them to find the pieces and bring them back to Greenland in order to make it shine once again, the Vikings set out to sea headed west toward where the sun broken and hit the earth. After weeks of searching, they came upon a new continent (North America), where it is now their task to start new settlements, colonize the country, discover unknown lands, and find the missing pieces of the broken sun.",Cultures,http://www.ign.com/games/cultures/pc-15356,http://pc.ign.com/articles/165/165356p1.html,,7.3,PC,"Jul 25, 2001","http://www.ign.com/games/halo-wars-2/pc-20041132,http://www.ign.com/games/starcraft-remastered/pc-20066763,http://www.ign.com/games/rome-total-war-2/pc-136961,http://www.ign.com/games/grand-theft-auto-online/pc-20019837,http://www.ign.com/games/mass-effect-andromeda/pc-20034220,http://www.ign.com/games/the-witcher-3-wild-hunt-blood-and-wine/pc-20035505",Good,7.3,"Mild Realistic Violence, Suggestive Themes",T for Teen,Good
Electronic Arts,Sports,EA Tiburon,"NCAA football game, based on the Madden engine. Instead of the cheerleaders that you'll see in Madden NFL 2002, NCAA 2002 has school-specific mascots that will be seen on the sidelines and during big play celebrations. The game has a deep Dynasty Mode that supports up to 12 players at one time. Seniors will leave, you can recruit fictional players out of high school and you can save Seniors and import into your franchise mode in Madden NFL 2002. Additionally, there are almost 120 different playbooks that are loosely based on the styles of the real college teams. Use Campus Cards to unlock special teams, which include the ability to play as team mascots, the 1991-2001 All-American, and 15 All-Time teams.",NCAA Football 2002,http://www.ign.com/games/ncaa-football-2002/ps2-16229,http://ps2.ign.com/articles/166/166229p1.html,57.99 USD,9.0,PS2 PC,"July 24, 2001","http://www.ign.com/games/madden-nfl-2001/ps2-14286,http://www.ign.com/games/tony-hawks-underground/ps2-545800,http://www.ign.com/games/tony-hawks-pro-skater-4/ps2-482065,http://www.ign.com/games/shin-megami-tensei-persona-4/ps2-14241813,http://www.ign.com/games/god-of-war-ii/ps2-811719,http://www.ign.com/games/god-of-war-ii/ps2-888576",Great,8.8,Suitable for Persons Ages Six and Older,E for Everyone,Amazing
Infogrames,Strategy,Spellbound,"Strategy game, set in the Wild West. The story involves the robbery of a train and you've been hired to find out who's behind it. Along the way you'll have to shadow bandits to find their headquarters, rescue one of your teammates from the gallows and sneak into a US Marshal's outpost.. In true Old West style, you begin the game with a single character and must go through the obligatory ""rounding up the old gang"" routine. You'll eventually have six characters at your disposal -- each with a unique batch of tricks and skills that you'll use to progress through the game's twenty-five missions.",Desperados: Wanted Dead or Alive,http://www.ign.com/games/desperados-wanted-dead-or-alive/pc-15315,http://pc.ign.com/articles/165/165315p1.html,,8.1,PC,"Jan 1, 1999","http://www.ign.com/games/halo-wars-2/pc-20041132,http://www.ign.com/games/starcraft-remastered/pc-20066763,http://www.ign.com/games/rome-total-war-2/pc-136961,http://www.ign.com/games/grand-theft-auto-online/pc-20019837,http://www.ign.com/games/mass-effect-andromeda/pc-20034220,http://www.ign.com/games/the-witcher-3-wild-hunt-blood-and-wine/pc-20035505",Great,8.3,Animated Violence,T for Teen,Great
Microsoft,Strategy,FASA Studio,"Take control of an entire company of the most fearsome military machines in history: BattleMechs! As a MechCommander, you command a unit of mercenary MechWarriors in a real-time strategy game of power, combat, and treachery set in the BattleTech Universe. Order your 'Mechs to divide and conquer the enemy as you become deeply involved in a bitter struggle for power among three warring noble houses.",MechCommander 2,http://www.ign.com/games/mechcommander-2/pc-14227,http://pc.ign.com/articles/164/164227p1.html,18.95 USD,8.2,PC,"Jul 19, 2001","http://www.ign.com/games/halo-wars-2/pc-20041132,http://www.ign.com/games/starcraft-remastered/pc-20066763,http://www.ign.com/games/rome-total-war-2/pc-136961,http://www.ign.com/games/grand-theft-auto-online/pc-20019837,http://www.ign.com/games/mass-effect-andromeda/pc-20034220,http://www.ign.com/games/the-witcher-3-wild-hunt-blood-and-wine/pc-20035505",Great,8.3,"Animated Violence, Realistic Violence",T for Teen,Great
Wilco Publishing,Flight,Wilco Publishing,"If you need evidence as to the attention to detail this simulation puts forth, check out the instruction manual: a complete guide to flying a real 767. You'll learn how to handle in-flight emergencies, create your own landing procedures, handle unexpected blowouts, and much more. Incredible cockpit displays and realistic controls make the experience exactly like piloting a real plane, and the game's incredible graphics don't exactly hurt matters. Once you earn your license, there'll be dozens of missions to keep you busy for weeks on end.",767 Pilot In Command,http://www.ign.com/games/767-pilot-in-command/pc-16771,http://pc.ign.com/articles/166/166771p1.html,,8.5,PC,"Jun 1, 2001","http://www.ign.com/games/squadron-42/pc-20046151,http://www.ign.com/games/star-citizen/pc-144978,http://www.ign.com/games/microsoft-flight/pc-83711,http://www.ign.com/games/mechwarrior-online/pc-18954,http://www.ign.com/games/stardew-valley/pc-20001247,http://www.ign.com/games/omerta-city-of-gangsters-134706/pc-129676,http://www.ign.com/games/grand-theft-auto-online/pc-20019837,http://www.ign.com/games/mass-effect-andromeda/pc-20034220,http://www.ign.com/games/the-witcher-3-wild-hunt-blood-and-wine/pc-20035505",,,,E for Everyone,Great
Crave Entertainment,Action,"Runecraft, Raven Software","Soldier of Fortune is a first-person action shooter title from Raven Software. You play a soldier-for-hire who must travel to some of the world's most dangerous political hotspots in order to carry out your task. Take part in over 30 missions with tasks such as locating nukes on a speeding freight train to searching out an Iraqi oil refinery. You'll be utilizing the world's most lethal weaponry, including a sniper rifle, white phosphorous grenades, and prototype microwave pulse guns. With realistic body damage, interactive 3D environments, and the Quake II engine with new GHOUL technology to back it up Soldier of Fortune is placing you into a realistic world filled with violence.",Soldier of Fortune,http://www.ign.com/games/soldier-of-fortune/dc-14594,http://dreamcast.ign.com/articles/164/164594p1.html,49.99 USD,8.5,DC PC,"July 26, 2001","http://www.ign.com/games/shenmue/dc-14499,http://www.ign.com/games/shenmue-ii/dc-15624,http://www.ign.com/games/spider-man-2000/dc-15779,http://www.ign.com/games/baldurs-gate/dc-12490,http://www.ign.com/games/nba-2k1/dc-14602,http://www.ign.com/games/marvel-vs-capcom-clash-of-super-heroes/dc-9967",Good,7.6,"Animated Blood and Gore, Animated Violence",M for Mature,Great
Namco,Platformer,Namco,"The second adventure of our long-eared hero has Klonoa falling into the stormy sea of Lunatea, a world kept in harmony by the power of four bells. Together, those bells maintain an orderly realm, but a dark fifth bell is preparing to sound, threatening the balance that has heretofore been kept. It's up to Klonoa, naturally, to solve the mystery and save the day. Klonoa 2's design is built around a related emphasis on retaining the positive aspects of 2D platforming. Simplicity is the key, so most levels progress from left to right, a friendly automatic camera is used as often as possible, and you can control Klonoa with only the D-pad and two buttons. Features 24 different stages.",Klonoa 2: Lunatea's Veil,http://www.ign.com/games/klonoa-2-lunateas-veil/ps2-15360,http://ps2.ign.com/articles/165/165360p1.html,24.99 USD,9.2,PS2,"July 24, 2001","http://www.ign.com/games/ratchet-and-clank/ps2-481057,http://www.ign.com/games/jak-and-daxter-the-precursor-legacy/ps2-16447,http://www.ign.com/games/jak-ii/ps2-535876,http://www.ign.com/games/shin-megami-tensei-persona-4/ps2-14241813,http://www.ign.com/games/god-of-war-ii/ps2-811719,http://www.ign.com/games/god-of-war-ii/ps2-888576",Great,8.7,,E for Everyone,Amazing
Enix,RPG,Enix,"Dragon Warrior III is a role-playing adventure where players adventure through a world of deserts, mountains, pyramids, towers and dungeons to unlock a secret that sets the stage for the legend of Dragon Warrior. The game follows the saga of a 16 year-old hero who pursues his father's warrior legacy. Your father was a legendary hero of Aliahan who was killed by the Archfiend Baramos. Now, you are 16 years old and must continue your father's quest and destroy Baramos. However, you will not take on this challenge alone. Choose three allies from eight character classes. If you need to, you can change a characters class at any point in the game. Travel throughout the day and night to visit more than 40 castles, towns, villages, and shrines. Naturally, you and your friends will have to fight a large number of enemies while on this adventure. Luckily, there is an expanded list of spells, weapons, and armor to choose from. Try to get your revenge in Dragon Quest III.",Dragon Warrior III,http://www.ign.com/games/dragon-quest-iii/gbc-16206,http://gameboy.ign.com/articles/166/166206p1.html,36.99 USD,10,GBC NES iPhone Android SNES Cell,July 2001,"http://www.ign.com/games/pokemon-silver-version/gbc-16709,http://www.ign.com/games/pokemon-gold-version/gbc-12865,http://www.ign.com/games/pokemon-crystal-version/gbc-15402,http://www.ign.com/games/pokemon-silver-version/gbc-16709,http://www.ign.com/games/pokemon-gold-version/gbc-12865,http://www.ign.com/games/pokemon-crystal-version/gbc-15402",Amazing,9.0,Suggestive Themes,T for Teen,Masterpiece
Take-Two Interactive,Action,Syscom Entertainment,"As a rescue helicopter pilot, it's up to you to save the city from devastation. You must fly across the cityscape, putting out fires with water jets and flame-retardant missile, while saving as many people as you can using the 'copter's resuce winch. There are a limited number of play modes, including a Time Attack, and a mission mode that includes a scenario where you assist in a  police chase. This game's biggest claim to fame is its uniqueness; there are very few helicopter rescue games out there.",City Crisis,http://www.ign.com/games/city-crisis/ps2-16644,http://ps2.ign.com/articles/166/166644p1.html,6.99 USD,4.8,PS2,"July 17, 2001","http://www.ign.com/games/god-of-war-ii/ps2-811719,http://www.ign.com/games/kingdom-hearts/ps2-16467,http://www.ign.com/games/grand-theft-auto-san-andreas/ps2-611957,http://www.ign.com/games/shin-megami-tensei-persona-4/ps2-14241813,http://www.ign.com/games/god-of-war-ii/ps2-811719,http://www.ign.com/games/god-of-war-ii/ps2-888576",Bad,4.7,"Mild Animated Violence, Mild Realistic Violence",E for Everyone,Bad
"Square, Square Electronic Arts (US)",RPG,Square,"Two of the most beloved games in PlayStation history come together in one awesome package in FINAL FANTASY CHRONICLES. Teaming FINAL FANTASY IV and CHRONO TRIGGER, Square Electronic Arts presents this masterful collection that's aimed at fans of the original games and new gamers alike. Both games boat a variety of fresh features that will keep series devotees interested, and CHRONO TRIGGER even has a new beginning and ending. The new sequences shed some light on the game's cryptic story, giving gamers added insight into the mystery surrounding the action in the sequel CHRONO CROSS. Although it's packed with monsters and magic, this version of CHRONO TRIGGER also features innovative modes, such as Theater, Music Box, and Art Gallery. Enhancements to FINAL FANTASY IV include a speedier trip through some of the game's towns, as well as a new Two-Player mode. Classics on their own, these two games are even better side-by-side.",Final Fantasy Chronicles,http://www.ign.com/games/final-fantasy-chronicles/ps-16322,http://psx.ign.com/articles/166/166322p1.html,19.99 USD,9.4,PS,"June 29, 2001","http://www.ign.com/games/final-fantasy-vii/ps-494,http://www.ign.com/games/final-fantasy-viii/ps-3847,http://www.ign.com/games/baldurs-gate/ps-13673,http://www.ign.com/games/final-fantasy-vii/ps-494,http://www.ign.com/games/final-fantasy-viii/ps-3847,http://www.ign.com/games/baldurs-gate/ps-13673",Amazing,9.1,Mild Animated Violence,T for Teen,Amazing
Eidos Interactive,RPG,Ion Storm,"A role-playing game based on id Software's popular Quake II engine. Sylvester ""Sly"" Boots and his companion, Stiletto Anyway, must travel across the galaxy and through three dimensions to unravel the story of a long-dead alien race and their advanced technology. Mysterious beings (perhaps the remnants of the very race they're attempting to learn more about?) are bent on destroying our entire universe, and it's up to Sly, Stiletto, and five other characters to help answer the questions about these beings, and save the universe from annihilation.",Anachronox,http://www.ign.com/games/anachronox/pc-3548,http://pc.ign.com/articles/153/153548p1.html,19.99 USD,8.0,PC,"Jun 27, 2001","http://www.ign.com/games/mass-effect-andromeda/pc-20034220,http://www.ign.com/games/the-witcher-3-wild-hunt-blood-and-wine/pc-20035505,http://www.ign.com/games/the-witcher-3/pc-134497,http://www.ign.com/games/grand-theft-auto-online/pc-20019837,http://www.ign.com/games/mass-effect-andromeda/pc-20034220,http://www.ign.com/games/the-witcher-3-wild-hunt-blood-and-wine/pc-20035505",Great,8.4,"Animated Violence, Mature Sexual Themes",T for Teen,Great
Electronic Arts,Sports,Creative Assembly,"The 2002 edition of EA Sports' Rugby is every rugby fan's dream - 20 international teams featured including the New Zealand All Blacks, the Australian Wallabies, the South African Springboks, England, Scotland and France. Take your team to victory in the World Championship, 6 Nations, Tri - Nations, or Friendly matches.",Rugby,http://www.ign.com/games/rugby/ps2-16647,http://ps2.ign.com/articles/166/166647p1.html,9.99 USD,7.3,PS2,"July 17, 2001","http://www.ign.com/games/madden-nfl-2001/ps2-14286,http://www.ign.com/games/tony-hawks-underground/ps2-545800,http://www.ign.com/games/tony-hawks-pro-skater-4/ps2-482065,http://www.ign.com/games/shin-megami-tensei-persona-4/ps2-14241813,http://www.ign.com/games/god-of-war-ii/ps2-811719,http://www.ign.com/games/god-of-war-ii/ps2-888576",Good,7.0,Suitable for Persons Ages Six and Older,E for Everyone,Good
Sony Computer Entertainment,Action,Eurocom,"Deep... below the earth's surface dwells mystery beyond your wildest dreams. Deeper... lies an ancient, undiscovered land. Deeper still... the keys to unlock its secret wait deep below the earth's surface. Driven by the legend of Atlantis, join Milo Thatch as he leads a team of experts to unlock the secrets of The Lost Empire. Journey to uncharted depths, far below the ocean surface where hidden dangers swim, lurk and spy from every nook and cranny. What you encounter next will change things forever. The adventure awaits you.",Atlantis: The Lost Empire,http://www.ign.com/games/atlantis-the-lost-empire/ps-16455,http://psx.ign.com/articles/166/166455p1.html,47.99 USD,7.5,PS PS3 PSP GBA GBC,"June 12, 2001","http://www.ign.com/games/metal-gear-solid/ps-569,http://www.ign.com/games/resident-evil-3-nemesis/ps-11482,http://www.ign.com/games/resident-evil-2/ps-504,http://www.ign.com/games/final-fantasy-vii/ps-494,http://www.ign.com/games/final-fantasy-viii/ps-3847,http://www.ign.com/games/baldurs-gate/ps-13673",Good,7.3,Realistic Violence,E for Everyone,Good
Metro 3D (M3),Action,Metro 3D (M3),"Seeing her loved ones suffer through a torturous metamorphosis into inhuman creatures with a lust for blood due to a strange illness nobody can identify has been too much for young Anna to bear. Someone has to find out who, or what, is causing this plague and fast. In DARK ANGEL: Vampire Apocalypse, players will guide Anna on her action-packed quest through the dark underworld of vampires and other evil creatures as she attempts to find a cure for this terrible disease and put an end to its creators! You'll encounter a wide variety of undead and mutated creatures bent on human destruction, dispatching them with numerous weapons; some made of wood and steel, others with more mystical origins. Your actions and decisions during the game will affect the story in more ways than you can possibly imagine, but only you can pierce the veil of darkness and conquer the mysterious evil that plagues mankind!",Dark Angel: Vampire Apocalypse,http://www.ign.com/games/dark-angel-vampire-apocalypse/ps2-15374,http://ps2.ign.com/articles/165/165374p1.html,49.99 USD,5.2,PS2 DC,"July 12, 2001","http://www.ign.com/games/god-of-war-ii/ps2-811719,http://www.ign.com/games/kingdom-hearts/ps2-16467,http://www.ign.com/games/grand-theft-auto-san-andreas/ps2-611957,http://www.ign.com/games/shin-megami-tensei-persona-4/ps2-14241813,http://www.ign.com/games/god-of-war-ii/ps2-811719,http://www.ign.com/games/god-of-war-ii/ps2-888576",Mediocre,5.2,"Blood, Realistic Violence, Blood and Gore",T for Teen,Mediocre
Strategy First,"First-Person, Strategy","Microids, Etranges Libellules","Empire of the Ants is a real-time strategy game based on the best-selling novel of the same name, written by Bernard Werber. Enter the brutal and amazing world of ants! Take on the role of an up-and-coming ant commander that has been given the task to oversee the welfare and expansion of a colony of russet ants. Each player must build up their forces, guard their anthill, collect food and building materials, and maintain and grow their colony of ants.",Empire of the Ants,http://www.ign.com/games/empire-of-the-ants/pc-16705,http://pc.ign.com/articles/166/166705p1.html,39.99 USD,6.0,PC,"July 17, 2001","http://www.ign.com/games/halo-wars-2/pc-20041132,http://www.ign.com/games/starcraft-remastered/pc-20066763,http://www.ign.com/games/rome-total-war-2/pc-136961,http://www.ign.com/games/grand-theft-auto-online/pc-20019837,http://www.ign.com/games/mass-effect-andromeda/pc-20034220,http://www.ign.com/games/the-witcher-3-wild-hunt-blood-and-wine/pc-20035505",Okay,6.7,"Animated Violence, Realistic Violence",E for Everyone,Okay
Namco,Action,Mass Media,"One of the first video games ever created, PAC-MAN still happens to be one of the best, as well. This comprehensive collection includes three unique Pac-Man titles in one complete package. Inside you'll find the original Pac-Man which has you traversing mazes, avoiding deadly ghosts, and chomping down nutritious dots; Pac-Mania is a 3D take on the first version, in which you can actually jump over the ghosts; and Pac-Attack is a Tetris-like experience that'll have you lining up blocks in a fast-paced environment.",Pac-Man Collection,http://www.ign.com/games/pac-man-collection/gba-15897,http://gameboy.ign.com/articles/165/165897p1.html,19.99 USD,9.0,GBA Wii U,July 2001,"http://www.ign.com/games/metroid-fusion/gba-16227,http://www.ign.com/games/the-legend-of-zelda-the-minish-cap/gba-499614,http://www.ign.com/games/dragon-ball-z-the-legacy-of-goku/gba-17519,http://www.ign.com/games/metroid-fusion/gba-16227,http://www.ign.com/games/pokemon-emerald-version/gba-692344,http://www.ign.com/games/pokemon-ruby-version/gba-17508",Great,8.3,No Descriptors,E for Everyone,Amazing
