publisher,genres,developers,description,title,url,review_link,price,ign_score,platforms,release_date,related_games,community_score_phrase,community_score,rating_content,rating_category,ign_score_phrase
"Battlefront.com, Matrix Games","Turn-Based, Strategy",Hussar Games,"For Liberty! is a turn based computer strategy game covering two wars of independence - the American Revolution (1775-1783) and the Rakoczi War of Independence in Europe 1703-1711. Based on historical research, the game features realistic depictions of battles and campaigns -- units that will not fight to the last man, you win battles by routing the enemy army from the field. In-game events include a number of random encounters, such as pirates attacks, epidemics, betrayal, fires, revolts, desertion, Indian discontent and many others. Towns can be pillaged to gain supply Fleet Bombardments and Troop Landings A tactical battle system randomly generates maps for encounters. Multiplayer support includes hotSeat, email and and LAN play. This game is the side-sequel to Hussar Games' 1848.",For Liberty!,http://www.ign.com/games/for-liberty/pc-825042,http://pc.ign.com/articles/780/780500p1.html,,6.5,PC,"July 4, 2006","http://www.ign.com/games/halo-wars-2/pc-20041132,http://www.ign.com/games/starcraft-remastered/pc-20066763,http://www.ign.com/games/rome-total-war-2/pc-136961,http://www.ign.com/games/grand-theft-auto-online/pc-20019837,http://www.ign.com/games/mass-effect-andromeda/pc-20034220,http://www.ign.com/games/the-witcher-3-wild-hunt-blood-and-wine/pc-20035505",Okay,6.5,,,Okay
Sony Online Entertainment,Fighting,"Backbone Entertainment, Digital Eclipse Software","The second chapter in the popular Mortal Kombat series, available for the PlayStation 3 via download over the Playstion Network service.",Mortal Kombat II,http://www.ign.com/games/mortal-kombat-2/ps3-874204,http://ps3.ign.com/articles/780/780492p1.html,,7.3,PS3 SNES 32X Arcade SMS Gen GB Amiga PS PC GG Saturn,"April 12, 2007","http://www.ign.com/games/dragon-ball-xenoverse/ps3-20018802,http://www.ign.com/games/tekken-tag-tournament-2/ps3-124584,http://www.ign.com/games/persona-4-arena/ps3-116910,http://www.ign.com/games/grand-theft-auto-online/ps3-20006859,http://www.ign.com/games/metal-gear-online-mgs5/ps3-20028682,http://www.ign.com/games/the-elder-scrolls-v-skyrim-dragonborn/ps3-146419",Good,7.4,"Blood and Gore, Violence",M for Mature,Good
Aspyr,"Third-Person, Action","SilverBack Studios, Acclaim Studios Manchester","Made Man is based on real-world events, allowing players to assume the role of Joey Verola as he is indoctrinated into the dark world of organized crime and relive his life -- every moment, every kill -- as he rises through the ranks to become a ""Made Man"". The storyline spans three decades of his life, from the horror of Vietnam to the urban jungle of Brooklyn, with the missions written by best selling authority on the Mafia, David Fisher.",Made Man,http://www.ign.com/games/made-man/ps2-683966,http://ps2.ign.com/articles/780/780061p1.html,,2.4,PS2 Xbox 360 Xbox PC GCN,"March 27, 2007","http://www.ign.com/games/god-of-war-ii/ps2-811719,http://www.ign.com/games/kingdom-hearts/ps2-16467,http://www.ign.com/games/grand-theft-auto-san-andreas/ps2-611957,http://www.ign.com/games/god-of-war-ii/ps2-811719,http://www.ign.com/games/grand-theft-auto-san-andreas/ps2-611957,http://www.ign.com/games/god-of-war/ps2-661321,http://www.ign.com/games/shin-megami-tensei-persona-4/ps2-14241813,http://www.ign.com/games/god-of-war-ii/ps2-811719,http://www.ign.com/games/god-of-war-ii/ps2-888576",Mediocre,5.2,"Blood, Drug Reference, Intense Violence, Sexual Themes, Strong Language",M for Mature,Painful
Ubisoft,Action,"Pipeworks Software, Ubisoft Montreal","In Prince of Persia Rival Swords, the Prince makes his way home to Babylon, bearing with him Kaileena, the enigmatic Empress of Time, and unspeakable scars from the Island of Time. But instead of the peace he longs for, he finds his kingdom ravaged by war and Kaileena the target of a brutal plot. When she is kidnapped, the Prince tracks her to the palace – only to see her murdered by a powerful enemy. Her death unleashes the Sands of Time, which strike the Prince and threaten to destroy everything he holds dear. Cast out on the streets, hunted as a fugitive, the Prince soon discovers that the Sands have tainted him, too. They have given rise to a deadly Dark Prince, whose spirit gradually possesses him.",Prince of Persia:  Rival Swords,http://www.ign.com/games/prince-of-persia-the-two-thrones/psp-853083,http://psp.ign.com/articles/781/781149p1.html,39.99 USD,7.0,PSP Cell PC GCN Xbox GBA tba PS2 PS3 Mac Wii,"April 3, 2007","http://www.ign.com/games/resident-evil-3-nemesis/psp-18950,http://www.ign.com/games/metal-gear-solid-peace-walker/psp-71143,http://www.ign.com/games/metal-gear-solid-peace-walker/psp-965242,http://www.ign.com/games/final-fantasy-vii/psp-14340290,http://www.ign.com/games/final-fantasy-viii/psp-33571,http://www.ign.com/games/resident-evil-3-nemesis/psp-18950",Great,8.0,"Blood, Violence",T for Teen,Good
Nintendo,Action,Intelligent Systems,"Paper Mario isn't just out of this world ... it's out of this dimension. What at first glance appears to be a 2-D sidescroller ripped straight from the pages of the Paper Mario universe soon turns into a 3-D action-adventure that defies all video game logic. Fusing 2-D and 3-D perspectives, not to mention RPG and platformer elements, the game slips back and forth between dimensions. The action sprawls across eight worlds filled with traps, puzzles, bizarre mysteries and items that often draw themselves out of thin air. Oh, and just because Mario's in the title doesn't mean he's the only star -- players also get to play as Peach and Bowser.",Super Paper Mario,http://www.ign.com/games/super-paper-mario/wii-853822,http://wii.ign.com/articles/778/778606p1.html,49.99 USD,8.9,Wii GCN,"April 9, 2007","http://www.ign.com/games/the-legend-of-zelda-ocarina-of-time/wii-865246,http://www.ign.com/games/the-legend-of-zelda-skyward-sword/wii-872155,http://www.ign.com/games/the-legend-of-zelda-twilight-princess/wii-748589,http://www.ign.com/games/the-legend-of-zelda-ocarina-of-time/wii-865246,http://www.ign.com/games/the-last-story/wii-59789,http://www.ign.com/games/the-legend-of-zelda-skyward-sword/wii-872155",Great,8.6,"Comic Mischief, Mild Cartoon Violence",E for Everyone,Great
Gameloft,Sports,Gameloft,,Derek Jeter Pro Baseball 2007,http://www.ign.com/games/derek-jeter-pro-baseball-2007/cell-895777,http://wireless.ign.com/articles/778/778683p1.html,,8.5,Cell,"Mar 20, 2007","http://www.ign.com/games/beijing-2008/cell-787986,http://www.ign.com/games/captain-tsubasa-nankatsu-vs-toho/cell-848854,http://www.ign.com/games/freestyle-moto-x-ii-142665/cell-826649,http://www.ign.com/games/baldurs-gate/cell-688224,http://www.ign.com/games/puzzle-quest-challenge-of-the-warlords/cell-950646,http://www.ign.com/games/just-cause-2/cell-14280725",Amazing,9.5,,,Great
Sony Computer Entertainment,"Third-Person, Shooter",Eidetic,"From the days of the PS one, this downloadable game allows you to play the classic original on your PSP handheld system or PS3 home console.

A terrorist organization steals a top-secret virus known as Syphon Filter, and they plan to use it to extort money from the world's governments. Only special agent Gabe Logan can stop them and keep the world safe. Take control of Logan has works his way through parks, subway lines, a museum, and a military compound. Along the way, Logan will be able to utilize a large number of weapons including a taser, machine guns, shotguns, and grenades. If he runs across an enemy wearing armor, he will have to take them out with a quick shot to the head. While blasting the bad guys is great fun, there are times when stealth will make a task much easier. Stop the terrorists and return the virus to the proper authorities in Syphon Filter.",Syphon Filter,http://www.ign.com/games/syphon-filter/psp-867901,http://psp.ign.com/articles/778/778828p1.html,5.99 USD,6.5,PSP Android PS PS3,"December 4, 2006","http://www.ign.com/games/resistance-retribution/psp-14267012,http://www.ign.com/games/tom-clancys-ghost-recon-predator/psp-61124,http://www.ign.com/games/star-wars-battlefront-renegade-squadron/psp-905515,http://www.ign.com/games/final-fantasy-vii/psp-14340290,http://www.ign.com/games/final-fantasy-viii/psp-33571,http://www.ign.com/games/resident-evil-3-nemesis/psp-18950",Okay,6.7,"Animated Blood, Animated Violence",T for Teen,Okay
Sony Computer Entertainment,Music,SIE London Studio,"Complimenting the acclaimed

range with a fresh new look and a broad contemporary song selection,

includes 30 new tracks, with songs from superstars including original artists such as Avril Lavigne, Jamelia, Keane, Robbie Williams and the Black Eyed Peas. Pass the Mic and Duets return, along with new original features. Rap Scoring lets MCs gain extra points as you battle against your crew to see who is the master of the mic! In Medley mode, short segments of five different songs are strung together, challenging would be pop stars to think fast and score high before the tune changes. In addition, SingStar Pop incorporates brand new voice filters that can be used in Playback Mode to distort and enhance players' vocal performance. SingStar Pop is also EyeToy compatible for players to actually see themselves singing within the game.",SingStar Pop,http://www.ign.com/games/singstar-pop/ps2-734343,http://ps2.ign.com/articles/778/778786p1.html,29.99 USD,7.7,PS2,"April 3, 2007","http://www.ign.com/games/amplitude/ps2-17285,http://www.ign.com/games/guitar-hero-ii/ps2-823033,http://www.ign.com/games/guitar-hero-iii-legends-of-rock/ps2-899095,http://www.ign.com/games/shin-megami-tensei-persona-4/ps2-14241813,http://www.ign.com/games/god-of-war-ii/ps2-811719,http://www.ign.com/games/god-of-war-ii/ps2-888576",Good,7.6,"Alcohol Reference, Mild Lyrics, Mild Violence, Suggestive Themes",E10+ for Everyone 10 and older,Good
MumboJumbo,Puzzle,MumboJumbo,"In the second installment of the casual game series, players travel through 88 levels shooting and destroying the magical balls that threaten the pyramids at the end of their paths. Players can earn up to 15 exciting power-ups, play through four distinct levels of difficulty, challenge themselves to a total of 13 bonus rounds and work their way up through the new 100-level player ranking system. There's even a new arcade-style mode of play called the Pharaoh's Challenge.",Luxor 2,http://www.ign.com/games/luxor-2/xbox-360-881249,http://xboxlive.ign.com/articles/778/778757p1.html,,6.8,Xbox 360 Cell PC PC NDS,"April 4, 2007","http://www.ign.com/games/valiant-hearts-the-great-war/xbox-360-20005426,http://www.ign.com/games/quantum-conundrum/xbox-360-116552,http://www.ign.com/games/vessel/xbox-360-116771,http://www.ign.com/games/ubisoft-the-crew/xbox-360-20023103,http://www.ign.com/games/fantasia-music-evolved/xbox-360-20000219,http://www.ign.com/games/guacamelee/xbox-360-20014216,http://www.ign.com/games/grand-theft-auto-online/xbox-360-20006860,http://www.ign.com/games/metal-gear-online-mgs5/xbox-360-20028684,http://www.ign.com/games/halo-4/xbox-360-110563",Good,7.0,No Descriptors,E for Everyone,Okay
Ubisoft,Action,Ubisoft Montreal,"Based on 2005's Prince of Persia: The Two Thrones, this first entry in the series for the Wii takes advantage of the system's revolutionary controllers. Players will be able to clash swords with enemies, execute speed kills and perform the Prince's well-known acrobatic moves such as running on walls. The game creates an epic experience by combining two playable characters in gameplay that mixes combat, platforming, puzzles and a compelling storyline.

The Prince of Persia makes his way home to Babylon, bearing with him Kaileena, the enigmatic Empress of Time, and unspeakable scars from the Island of Time. But instead of the peace he longs for, he finds his kingdom ravaged by war and Kaileena the target of a brutal plot. When she is kidnapped, the Prince tracks her to the Palace – only to see her murdered by a powerful enemy. Her death unleashes the Sands of Time, which strike the Prince and threaten to destroy everything he holds dear. Cast to the streets, hunted as a fugitive, the Prince soon discovers that the Sands have tainted him, too. They have given rise to a deadly Dark Prince, whose spirit gradually possesses him.",Prince of Persia: Rival Swords,http://www.ign.com/games/prince-of-persia-the-two-thrones/wii-846384,http://wii.ign.com/articles/778/778269p1.html,49.99 USD,7.1,Wii Cell PC GCN Xbox GBA tba PS2 PS3 Mac PSP,"April 3, 2007","http://www.ign.com/games/the-legend-of-zelda-ocarina-of-time/wii-865246,http://www.ign.com/games/the-legend-of-zelda-skyward-sword/wii-872155,http://www.ign.com/games/the-legend-of-zelda-twilight-princess/wii-748589,http://www.ign.com/games/the-legend-of-zelda-ocarina-of-time/wii-865246,http://www.ign.com/games/the-last-story/wii-59789,http://www.ign.com/games/the-legend-of-zelda-skyward-sword/wii-872155",Good,7.8,"Blood, Violence",T for Teen,Good
Gamevil,Puzzle,Gamevil,,Skipping Stone IQ,http://www.ign.com/games/skipping-stone-iq/cell-898092,http://wireless.ign.com/articles/777/777946p1.html,,7.6,Cell,"Mar 1, 2006","http://www.ign.com/games/puzzle-quest-challenge-of-the-warlords/cell-950646,http://www.ign.com/games/3d-tower-bloxx-deluxe/cell-14232300,http://www.ign.com/games/xxx-puzzle/cell-761657,http://www.ign.com/games/baldurs-gate/cell-688224,http://www.ign.com/games/puzzle-quest-challenge-of-the-warlords/cell-950646,http://www.ign.com/games/just-cause-2/cell-14280725",,,,,Good
DreamCatcher Interactive,"Real-Time, Strategy",Metamorf Studios,"Play as one of of three races in this full 3D futuristic RTS. Set in a mysterious futuristic universe where organic machines are built using genetic engineering, take on the role of Captain Iconah to explore and conquer the Universal Heart, the only part of the universe remaining unconquered 3,000 years into the future.",Genesis Rising: The Universal Crusade,http://www.ign.com/games/genesis-rising-the-universal-crusade/pc-823618,http://pc.ign.com/articles/778/778564p1.html,39.99 USD,6.5,PC,"March 20, 2007","http://www.ign.com/games/halo-wars-2/pc-20041132,http://www.ign.com/games/starcraft-remastered/pc-20066763,http://www.ign.com/games/rome-total-war-2/pc-136961,http://www.ign.com/games/grand-theft-auto-online/pc-20019837,http://www.ign.com/games/mass-effect-andromeda/pc-20034220,http://www.ign.com/games/the-witcher-3-wild-hunt-blood-and-wine/pc-20035505",Okay,6.7,"Blood, Fantasy Violence, Mild Suggestive Themes, Use of Alcohol",T for Teen,Okay
Electronic Arts,Music,Bizarre Creations,"In Boom Boom Rocket, players trigger rockets to the beat of the music while travelling through a 3D cityscape. The better the player times the explosions, the more spectacular the fireworks effects. The fireworks are choreographed to 10 original tracks created by Ian Livingstone. Players can play in single player mode or go head-to-head against a friend on the same console.",Boom Boom Rocket,http://www.ign.com/games/boom-boom-rocket/xbox-360-877611,http://xboxlive.ign.com/articles/780/780107p1.html,10 USD,7.0,Xbox 360,"April 11, 2007","http://www.ign.com/games/dance-central-3/xbox-360-135601,http://www.ign.com/games/guitar-hero-live/xbox-360-20035853,http://www.ign.com/games/rock-band-blitz/xbox-360-131273,http://www.ign.com/games/ubisoft-the-crew/xbox-360-20023103,http://www.ign.com/games/fantasia-music-evolved/xbox-360-20000219,http://www.ign.com/games/guacamelee/xbox-360-20014216,http://www.ign.com/games/grand-theft-auto-online/xbox-360-20006860,http://www.ign.com/games/metal-gear-online-mgs5/xbox-360-20028684,http://www.ign.com/games/halo-4/xbox-360-110563",Good,7.2,,,Good
NEC,Action,Hudson Soft,"Dragon's Curse follows a warrior, who after an unfortunate run-in with a dragon becomes Lizard-Man. The object of the game is to retrieve the Salamander Cross, and become human once more. En route the player must defeat various dragon bosses in order to change his form and eventually return to a human state!",Dragon's Curse,http://www.ign.com/games/dragons-curse/tg16-11401,http://retro.ign.com/articles/878/878637p1.html,,7.5,TG16 GG SMS Wii Wii,"Dec 31, 1990","http://www.ign.com/games/dungeon-explorer/tg16-8772,http://www.ign.com/games/legendary-axe/tg16-5644,http://www.ign.com/games/ninja-spirit/tg16-5633,http://www.ign.com/games/air-zonk/tg16-9312,http://www.ign.com/games/dungeon-explorer/tg16-8772,http://www.ign.com/games/legendary-axe/tg16-5644",Great,8.5,,,Good
Nintendo,Flight,Nintendo EAD,"A downloadable version of the 1997 N64 game, provided through Nintendo's Virtual Console service.

Players take the controls of their Arwing and complete 15 missions to reach the final 
objective: a showdown on Venom, the home planet of the interplanetary tyrant, Andross.  Throughout the adventure, players have to accomplish challenging 
objectives in order to reach and conquer every mission.  Skim over the surface of an alien sea, weave through the concrete canyons of a futuristic metropolis or dodge planetoids the size of mountains.  Between missions, players will be 
treated to real-time 3-D movies that progress the story of the Star Fox team of space mercenaries in their struggle against thevil ape emperor, Andross.",Star Fox 64,http://www.ign.com/games/star-fox-64/wii-865245,http://wii.ign.com/articles/779/779902p1.html,10 USD,8.5,Wii N64 Wii U 3DS iQ,"April 2, 2007","http://www.ign.com/games/blazing-angels-squadrons-of-wwii/wii-846378,http://www.ign.com/games/combat-wings-the-great-battles-of-wwii/wii-23783,http://www.ign.com/games/the-sky-crawlers-innocent-aces/wii-14241822,http://www.ign.com/games/mario-kart-wii/wii-949580,http://www.ign.com/games/boom-blox/wii-892269,http://www.ign.com/games/nba-jam/wii-56365,http://www.ign.com/games/the-legend-of-zelda-ocarina-of-time/wii-865246,http://www.ign.com/games/the-last-story/wii-59789,http://www.ign.com/games/the-legend-of-zelda-skyward-sword/wii-872155",Great,8.8,Violence,E for Everyone,Great
Electronic Arts,"Economic, Simulation",EA Japan,"Taking advantage of the unique controls in the DS, this version of the classic simulation game allows players to create, manage, and develop their own fun-filled park, packed with amazing rides, enticing shops and engaging sideshows, all via an intuitive Touch Screen interface.",Theme Park,http://www.ign.com/games/theme-park-867814/nds-867813,http://ds.ign.com/articles/779/779876p1.html,29.99 USD,7.5,NDS,"March 20, 2007","http://www.ign.com/games/harvest-moon-the-tale-of-two-towns/nds-71562,http://www.ign.com/games/harvest-moon-ds/nds-695643,http://www.ign.com/games/harvest-moon-island-of-happiness/nds-848020,http://www.ign.com/games/pokemon-black-version-2/nds-129224,http://www.ign.com/games/pokemon-conquest/nds-125156,http://www.ign.com/games/pokemon-white-version-2/nds-129228",Good,7.6,,E for Everyone,Good
"cdv Software Entertainment, Focus Home Interactive",Adventure,Pendulo Studios,"The sequel to the humorous adventure game Runaway: A Road to Adventure. Players will be able to explore more than 100 different places across the globe, throughout the 6 extensive chapters of this new adventure. In Alaska, Hawaii, under the sea or up in the sky, in the middle of a hostile jungle or on board a huge yacht, you will experience an unforgettable adventure in a rich and varied environment. The game is filled with juicy puzzles and exciting challenges which can be solved more or less easily depending on the player's level.",Runaway: The Dream of the Turtle,http://www.ign.com/games/runaway-the-dream-of-the-turtle/pc-489984,http://pc.ign.com/articles/779/779898p1.html,29.99 USD,7.2,PC Wii NDS iPhone,"March 16, 2007","http://www.ign.com/games/recore/pc-20047415,http://www.ign.com/games/life-is-strange-episode-4/pc-20031273,http://www.ign.com/games/the-walking-dead-the-game/pc-100880,http://www.ign.com/games/grand-theft-auto-online/pc-20019837,http://www.ign.com/games/mass-effect-andromeda/pc-20034220,http://www.ign.com/games/the-witcher-3-wild-hunt-blood-and-wine/pc-20035505",Great,8.0,"Crude Humor, Language, Mild Violence, Sexual Themes, Use of Drugs",T for Teen,Good
Konami,Action,Konami,"A downloadable version of the 1989 NES game, provided through Nintendo's Virtual Console service.

Based on the hit cartoon, Teenage Mutant Ninja Turtles has players go up against Shredder and his Foot Clan followers. Leonardo's weapon are the Katana Blades, which makes it easy to strike far and fast. Raphael carries a Sai in each of his three fingered fast hands. His striking range is short but a little more powerful than Leonardo. Michaelangelo uses Nunchuks, and  Donatello, a master of the Bo has some serious reach and power though he is a bit slow to strike. Unlike most games, rather than just give the plot at the beginning, here the story unravels throughout the adventure. First Shredder gets Beebop and Rocksteady to capture the Turtles friend April O'Neal. Once April is rescued it turns out that Shredder has set eight bombs around the local dam. The dam though was a ploy to lure the Turtles away from their lair so that Mechaturtle, another of Shredder's minions, could kidnap Splinter.",Teenage Mutant Ninja Turtles [1989],http://www.ign.com/games/teenage-mutant-ninja-turtles/wii-887113,http://wii.ign.com/articles/779/779897p1.html,6 USD,5.5,Wii NES CPC LCD C64 PC,"April 2, 2007","http://www.ign.com/games/the-legend-of-zelda-ocarina-of-time/wii-865246,http://www.ign.com/games/the-legend-of-zelda-skyward-sword/wii-872155,http://www.ign.com/games/the-legend-of-zelda-twilight-princess/wii-748589,http://www.ign.com/games/the-legend-of-zelda-ocarina-of-time/wii-865246,http://www.ign.com/games/the-last-story/wii-59789,http://www.ign.com/games/the-legend-of-zelda-skyward-sword/wii-872155",Okay,6.3,,,Mediocre
NEC,Adventure,Hudson Soft,"A downloadable version of the 1990 Turbo Grafx-16/PC Engine game, provided through Nintendo's Virtual Console service.

After defeating the Mecha Dragon in the depths of the Dragon Castle, the wounded beast casts a spell on the hero, turning him into an uglycreature.  To return to human form, he must find the Salamander Cross, which can break any curse.  This side-scrolling action role-playing game is nonlinear, allowing players to venture freely.  Collect gold and items while upgrading equipment and powering up stats.  The hero starts as Lizard-Man but, upon defeating the dragon bosses, is changed into other creatures such as Mouse-Man, Piranha-Man, Tiger-Man and Hawk-Man.  Each creature possesses distinct abilities such as the ability to fly, swim, walk on ceilings or cling to walls.  Players use each creature's special skills to widen your search for the Salamander Cross and bring the hero back to his human form!",Dragon's Curse,http://www.ign.com/games/dragons-curse/wii-897236,http://wii.ign.com/articles/779/779903p1.html,,7.5,Wii GG SMS TG16 TG16,"April 2, 2007","http://www.ign.com/games/fatal-frame-ii-crimson-butterfly/wii-87940,http://www.ign.com/games/okami/wii-884970,http://www.ign.com/games/back-to-the-future-the-game/wii-116482,http://www.ign.com/games/the-legend-of-zelda-ocarina-of-time/wii-865246,http://www.ign.com/games/the-last-story/wii-59789,http://www.ign.com/games/the-legend-of-zelda-skyward-sword/wii-872155",Great,8.4,"Mild Fantasy Violence, Use of Tobacco",E for Everyone,Good
Reaxion,Puzzle,Reaxion,,Spin-It!,http://www.ign.com/games/spin-it/cell-899439,http://wireless.ign.com/articles/779/779644p1.html,,7.0,Cell,"Apr 10, 2007","http://www.ign.com/games/puzzle-quest-challenge-of-the-warlords/cell-950646,http://www.ign.com/games/3d-tower-bloxx-deluxe/cell-14232300,http://www.ign.com/games/xxx-puzzle/cell-761657,http://www.ign.com/games/baldurs-gate/cell-688224,http://www.ign.com/games/puzzle-quest-challenge-of-the-warlords/cell-950646,http://www.ign.com/games/just-cause-2/cell-14280725",,,,,Good
Infogrames,Sports,Humongous,"Hit the court with NBA superstar Paul Pierce and other basketball heroes as kids—LeBron James, Shaquille O'Neal, Allen Iverson, Dwyane Wade, Tracy McGrady, Yao Ming, and more.  Full court basketball sim with arcade action, Backyard Basketball 2007 features spectacular new graphics, interactive backgrounds, and realistic game play with season mode, stats, minigames, unlockables, and tons of surprises.  The best selling kid's basketball videogame of all time, Backyard Basketball 2007 is the only one to hold the National Basketball Association license.",Backyard Basketball 2007,http://www.ign.com/games/backyard-basketball-887839/ps2-845385,http://ps2.ign.com/articles/779/779579p1.html,29.99 USD,2.5,PS2 NDS GBA PC GCN,"February 15, 2007","http://www.ign.com/games/madden-nfl-2001/ps2-14286,http://www.ign.com/games/tony-hawks-underground/ps2-545800,http://www.ign.com/games/tony-hawks-pro-skater-4/ps2-482065,http://www.ign.com/games/shin-megami-tensei-persona-4/ps2-14241813,http://www.ign.com/games/god-of-war-ii/ps2-811719,http://www.ign.com/games/god-of-war-ii/ps2-888576",Okay,6.5,No Descriptors,E for Everyone,Painful
