publisher,genres,developers,description,title,url,review_link,price,ign_score,platforms,release_date,related_games,community_score_phrase,community_score,rating_content,rating_category,ign_score_phrase
Activision,"First-Person, Shooter",Amaze Entertainment,"Featuring all-new missions, never-before seen in a Call of Duty game, Call of Duty: Roads to Victory thrusts players into the boots of an 82nd Airborne Division infantry soldier, a Canadian First Army rifleman (both new to the franchise) and an elite British Parachuting Regiment commando.

Featuring a completely unique set of challenges that include mounted machine gun battles, sniper encounters and aircraft attacks, as well as multiplayer warfare for up to six players (ad-hoc wireless), Call of Duty: Roads to Victory enlists handheld gamers into the fast-paced action and adrenaline-pumping intensity of Call of Duty.",Call of Duty: Roads to Victory,http://www.ign.com/games/call-of-duty-roads-to-victory/psp-862822,http://psp.ign.com/articles/773/773255p1.html,39.99 USD,6.6,PSP,"March 13, 2007","http://www.ign.com/games/resistance-retribution/psp-14267012,http://www.ign.com/games/tom-clancys-ghost-recon-predator/psp-61124,http://www.ign.com/games/star-wars-battlefront-renegade-squadron/psp-905515,http://www.ign.com/games/final-fantasy-vii/psp-14340290,http://www.ign.com/games/final-fantasy-viii/psp-33571,http://www.ign.com/games/resident-evil-3-nemesis/psp-18950",Good,7.4,"Blood, Language, Violence",T for Teen,Okay
Electronic Arts,Sports,EA Tiburon,"The second game in the popular AFL series features a roster of more than 40 teams, including all the AFL teams and teams from the AFL's developmental league, the AF2.",Arena Football: Road to Glory,http://www.ign.com/games/arena-football-road-to-glory/ps2-872481,http://ps2.ign.com/articles/772/772767p1.html,29.99 USD,6.5,PS2,"February 22, 2007","http://www.ign.com/games/madden-nfl-2001/ps2-14286,http://www.ign.com/games/tony-hawks-underground/ps2-545800,http://www.ign.com/games/tony-hawks-pro-skater-4/ps2-482065,http://www.ign.com/games/shin-megami-tensei-persona-4/ps2-14241813,http://www.ign.com/games/god-of-war-ii/ps2-811719,http://www.ign.com/games/god-of-war-ii/ps2-888576",Okay,6.3,"Language, Mild Violence",E10+ for Everyone 10 and older,Okay
Electronic Arts,Sports,EA Redwood Shores Studio,"The 2007 game of EA's golfing game sim, designed with a new development philosophy for driving gameplay and feature innovation. Earn respect and climb the ranks with the Tiger Challenge as you play through 18 championship courses and compete against 35 pro and fantasy golfers. Use the cutting edge Wii controller to swing the clubs like the pros. Perfect using the Wii-mote interface for enhanced interaction with the game.",Tiger Woods PGA Tour 07,http://www.ign.com/games/tiger-woods-pga-tour-07/wii-826454,http://wii.ign.com/articles/772/772711p1.html,49.95 USD,7.0,Wii PS2 Xbox PSP PC Xbox 360 Cell PS3,"March 13, 2007","http://www.ign.com/games/wii-sports/wii-826987,http://www.ign.com/games/wii-sports-resort/wii-14266992,http://www.ign.com/games/fifa-2013/wii-115690,http://www.ign.com/games/the-legend-of-zelda-ocarina-of-time/wii-865246,http://www.ign.com/games/the-last-story/wii-59789,http://www.ign.com/games/the-legend-of-zelda-skyward-sword/wii-872155",Good,7.3,,E for Everyone,Good
Ubisoft,Action,"Digital Eclipse Software, Konami","In celebration of the TMNT movie and videogame, the classic 1989 arcade game is back and available in its full form on Xbox Live Arcade. Bringing the coin-op arcade game into the comfort of the living room, this version features the original seven levels, two- to four-player co-op modes and voice-chat capabilities. Choose from one of four Ninja Turtles—Leonardo, Michelangelo, Donatello, or Raphael—and master their unique ninja weapons and abilities. Play through the original seven levels alone, or with up to three others cooperatively via Xbox LIVE.",Teenage Mutant Ninja Turtles: The Classic Arcade Game,http://www.ign.com/games/teenage-mutant-ninja-turtles-the-arcade-game/xbox-360-891520,http://xboxlive.ign.com/articles/772/772896p1.html,5 USD,6.7,Xbox 360 Wii NES Arcade,"March 14,  2007","http://www.ign.com/games/grand-theft-auto-online/xbox-360-20006860,http://www.ign.com/games/metal-gear-online-mgs5/xbox-360-20028684,http://www.ign.com/games/metal-gear-solid-5/xbox-360-149842,http://www.ign.com/games/grand-theft-auto-online/xbox-360-20006860,http://www.ign.com/games/metal-gear-online-mgs5/xbox-360-20028684,http://www.ign.com/games/halo-4/xbox-360-110563",Good,7.5,Cartoon Violence,E10+ for Everyone 10 and older,Okay
Disney Interactive Studios,Action,Jupiter,"Spectrobes introduces two junior Interplanetary Patrol officers named Rallen and Jeena who learn of strange, prehistoric creatures called Spectrobes that possess special powers. These fossilized Spectrobes hold the key to defeating a vicious and merciless force, known only as the Krawl that threatens to destroy the galaxy. The two heroes embark on a mission to save their galaxy - to do so they must excavate, awaken, train and collect all the Spectrobes they can and battle to defeat the Krawl.

Spectrobes allows players to excavate, train and battle with nearly 500 unique creatures -- utilizing every interactive feature of the Nintendo DS. Players must collect, train and help their Spectrobes evolve in order to progress and succeed in the game. With highly customizable elements and powers, each Spectrobe is unique to individual game players.",Spectrobes,http://www.ign.com/games/spectrobes/nds-825823,http://ds.ign.com/articles/772/772512p1.html,29.99 USD,7.0,NDS,"March 13, 2007","http://www.ign.com/games/the-legend-of-zelda-phantom-hourglass/nds-694756,http://www.ign.com/games/the-legend-of-zelda-spirit-tracks/nds-14333936,http://www.ign.com/games/kingdom-hearts-3582-days/nds-964462,http://www.ign.com/games/pokemon-conquest/nds-125156,http://www.ign.com/games/kingdom-hearts-3582-days/nds-964462,http://www.ign.com/games/kingdom-hearts-coded/nds-14354710,http://www.ign.com/games/pokemon-black-version-2/nds-129224,http://www.ign.com/games/pokemon-conquest/nds-125156,http://www.ign.com/games/pokemon-white-version-2/nds-129228",Good,7.4,,E for Everyone,Good
Tequila Mobile,Action,Tequila Mobile,Get on your donkey and prepare for a lauch! Bungee Desperado is a humorous and extremley easy to play combination of arcade and sports. Pedro the Vulture will guide you through 11 exciting levels full of traps and surprises waiting for you and your buddy-donkey.,Bungee Desperado,http://www.ign.com/games/bungee-desperado/cell-893269,http://wireless.ign.com/articles/772/772520p1.html,,2.0,Cell,"Mar 5, 2007","http://www.ign.com/games/just-cause-2/cell-14280725,http://www.ign.com/games/rayman/cell-567023,http://www.ign.com/games/galaxy-on-fire-2/cell-14270785,http://www.ign.com/games/baldurs-gate/cell-688224,http://www.ign.com/games/puzzle-quest-challenge-of-the-warlords/cell-950646,http://www.ign.com/games/just-cause-2/cell-14280725",,,,,Painful
Tecmo,Sports,Tecmo,"A downloadable version of the 1989 NES game, provided through Nintendo's Virtual Console service.

Tecmo Bowl pits the player versus the computer in 11-game, single-elimination playoff action. Players also can go head-to-head with a human opponent in action or coach mode. The player can select from 12 teams.  On offense there are usually two run and two pass plays to choose from.  The player takes control of the quarterback before the snap and then either hands off to the running back or works through his receiver progression from the top to the bottom of the screen.  Defense consists of trying to guess which offensive play the opponent will select and then taking control of one of the defensive players before the snap. A very simple power-meter system is used for kicking field goals, extra points and punts.",Tecmo Bowl,http://www.ign.com/games/tecmo-bowl-8-bit/wii-892818,http://wii.ign.com/articles/772/772496p1.html,5 USD,7.0,Wii GB NES Cell 3DS Wii U,"March 12, 2007","http://www.ign.com/games/wii-sports/wii-826987,http://www.ign.com/games/wii-sports-resort/wii-14266992,http://www.ign.com/games/fifa-2013/wii-115690,http://www.ign.com/games/the-legend-of-zelda-ocarina-of-time/wii-865246,http://www.ign.com/games/the-last-story/wii-59789,http://www.ign.com/games/the-legend-of-zelda-skyward-sword/wii-872155",Great,8.1,,E for Everyone,Good
NEC,RPG,NCS,"Double Dungeons is a dungeon role-playing game.  Two players can play at the same time.  There are 22 unique scenarios, spread out among six levels. The higher the level is, the harder the scenario.  Because each scenario is independent, players can choose to start the game from any scenario other than the final one.  Players defeat monsters in each dungeon to gain experience while searching for the ""key"" that opens the door to the room with the boss.  They buy equipment at the shop, team up with characters and defeat the boss to clear a scenario.  Players must conquer all 21 scenarios from levels 1 through 5 to obtain passwords.  If they obtain all of them, they make their way to the final scenario.",Double Dungeons,http://www.ign.com/games/double-dungeons/tg16-9851,http://retro.ign.com/articles/868/868026p1.html,,3.5,TG16 Wii,1990,"http://www.ign.com/games/order-of-the-griffon/tg16-7676,http://www.ign.com/games/might-and-magic/tg16-9225,http://www.ign.com/games/brandish/tg16-9220,http://www.ign.com/games/air-zonk/tg16-9312,http://www.ign.com/games/dungeon-explorer/tg16-8772,http://www.ign.com/games/legendary-axe/tg16-5644",Okay,6.4,,,Awful
uClick,Action,Overloaded Pocket Media,,TMNT: Power of Four,http://www.ign.com/games/tmnt-power-of-four/cell-893170,http://wireless.ign.com/articles/772/772459p1.html,,5.0,Cell,"Mar 1, 2007","http://www.ign.com/games/just-cause-2/cell-14280725,http://www.ign.com/games/rayman/cell-567023,http://www.ign.com/games/galaxy-on-fire-2/cell-14270785,http://www.ign.com/games/baldurs-gate/cell-688224,http://www.ign.com/games/puzzle-quest-challenge-of-the-warlords/cell-950646,http://www.ign.com/games/just-cause-2/cell-14280725",,,,,Mediocre
NEC,Adventure,NCS,"A downloadable version of the 1990 Turbo Grafx-16/PC Engine game, provided through Nintendo's Virtual Console service.

Double Dungeons is a dungeon role-playing game.  Two players can play at the same time.  There are 22 unique scenarios, spread out among six levels. The higher the level is, the harder the scenario.  Because each scenario is independent, players can choose to start the game from any scenario other than the final one.  Players defeat monsters in each dungeon to gain experience while searching for the ""key"" that opens the door to the room with the boss.  They buy equipment at the shop, team up with characters and defeat the boss to clear a scenario.  Players must conquer all 21 scenarios from levels 1 through 5 to obtain passwords.  If they obtain all of them, they make their way to the final scenario.",Double Dungeons,http://www.ign.com/games/double-dungeons/wii-892859,http://wii.ign.com/articles/772/772492p1.html,6 USD,3.5,Wii TG16,"March 12, 2007","http://www.ign.com/games/fatal-frame-ii-crimson-butterfly/wii-87940,http://www.ign.com/games/okami/wii-884970,http://www.ign.com/games/back-to-the-future-the-game/wii-116482,http://www.ign.com/games/the-legend-of-zelda-ocarina-of-time/wii-865246,http://www.ign.com/games/the-last-story/wii-59789,http://www.ign.com/games/the-legend-of-zelda-skyward-sword/wii-872155",Mediocre,5.3,Mild Fantasy Violence,E for Everyone,Awful
Sony Computer Entertainment,Racing,Psygnosis,"From the days of the PS one, this downloadable game allows you to play the classic original on your PSP handheld system or PS3 home console.

Get ready for a racing adventure like no other with WIPEOUT for the PlayStation. The game is unique from most other titles, in that it allows the player to fly hovering craft above the surface of the track, traveling at incredible speeds that will leave any gamer breathless. Each race occurs with several other vehicles on the track, though the gameplay does not rest with simply beating the opponent. Each course is littered with numerous weapons and power-ups that can be used to help destroy, or otherwise delay, the enemy. The included techno soundtrack is fast-paced and invigorating, helping pull the player right into the game. WIPEOUT is sure to please fans looking for a fast and exciting racing game that offers one of the most entertaining challenges around.",WipEout,http://www.ign.com/games/wipeout/psp-878065,http://psp.ign.com/articles/772/772325p1.html,5.99 USD,7.0,PSP PC Saturn PS Android PS3,"March 8, 2007","http://www.ign.com/games/twisted-metal-head-on/psp-682965,http://www.ign.com/games/need-for-speed-most-wanted-5-1-0/psp-740903,http://www.ign.com/games/wipeout-pure/psp-682962,http://www.ign.com/games/final-fantasy-vii/psp-14340290,http://www.ign.com/games/final-fantasy-viii/psp-33571,http://www.ign.com/games/resident-evil-3-nemesis/psp-18950",Good,7.0,No Descriptors,E for Everyone,Good
Sony Computer Entertainment,Platformer,"Exact, MuuMuu","From the days of the PS one, this downloadable game allows you to play the classic original on your PSP handheld system or PS3 home console.

Baron Aloha is out to take over the world in Jumping Flash! And only a mechanical rabbit named Robbit can stop him. Take control of Robbit as he travels through 18 expansive 3D levels of action collecting the missing jetpods. Most of the levels have distinct themes including industrial wastelands, snowy mountains, and a carnival. However, getting though each level is not a walk in the park the robotic rabbit must interact with the environments, and there are enemies out to stop the mechanical hero at every turn. Luckily, Robbit can dispose of enemies by jumping on them or tackling them. When the time comes for mass destruction, powerful weapons are scattered throughout the levels for Robbit to use. Help Robbit save the world from Baron Aloha!",Jumping Flash!,http://www.ign.com/games/jumping-flash/psp-867914,http://psp.ign.com/articles/772/772340p1.html,5.99 USD,4.5,PSP PS3 Android PS,"January 4, 2007","http://www.ign.com/games/crash-bandicoot/psp-867854,http://www.ign.com/games/littlebigplanet-psp/psp-14286080,http://www.ign.com/games/daxter/psp-688226,http://www.ign.com/games/final-fantasy-vii/psp-14340290,http://www.ign.com/games/final-fantasy-viii/psp-33571,http://www.ign.com/games/resident-evil-3-nemesis/psp-18950",Okay,6.5,Mild Animated Violence,E for Everyone,Bad
Warner Bros. Digital Distribution,Action,Universomo,,300,http://www.ign.com/games/300/cell-885948,http://wireless.ign.com/articles/772/772327p1.html,,8.0,Cell,"Mar 1, 2007","http://www.ign.com/games/just-cause-2/cell-14280725,http://www.ign.com/games/rayman/cell-567023,http://www.ign.com/games/galaxy-on-fire-2/cell-14270785,http://www.ign.com/games/baldurs-gate/cell-688224,http://www.ign.com/games/puzzle-quest-challenge-of-the-warlords/cell-950646,http://www.ign.com/games/just-cause-2/cell-14280725",Amazing,9.2,,,Great
,"Turn-Based, Strategy",Team17 Software,"Team17's classic strategy game of armed worms blowing each other to smithereens returns yet again in this downloadable edition on Xbox Live Arcade. The game reverts to the classic 2D viewpoint and graphic style, with online multiplayer gameplay.",Worms [2007],http://www.ign.com/games/worms-2007/xbox-360-875974,http://xboxlive.ign.com/articles/772/772006p1.html,10 USD,7.3,Xbox 360 PS3,"March 7, 2007","http://www.ign.com/games/xcom-enemy-unknown/xbox-360-126074,http://www.ign.com/games/prison-architect/xbox-360-20048296,http://www.ign.com/games/halo-wars/xbox-360-857436,http://www.ign.com/games/grand-theft-auto-online/xbox-360-20006860,http://www.ign.com/games/metal-gear-online-mgs5/xbox-360-20028684,http://www.ign.com/games/halo-4/xbox-360-110563",Good,7.8,,E10+ for Everyone 10 and older,Good
Empire Interactive,Puzzle,Atomic Planet,"Channel 4 Countdown presenter and best selling author Carol Vorderman presents this version of the addictive and challenging puzzle craze that has swept the globe. Sudoku challenges you to fill in the missing numbers in a 9x9 grid. It's a game of reasoning, that doesn't require calculating or special math skills – but instead focuses on concentration and brain power. Let Carol take you step-by-step via live action video explaining the methods of Sudoku and revealing her handy hints so that you too can become a Sudoku master. If you feel you've mastered the methods of Sudoku then the game will allow you to lay down the gauntlet and challenge her to the ultimate Sudoku showdown. Also features are multiplayer gaming and several different modes of play.",Carol Vorderman's Sudoku,http://www.ign.com/games/carol-vordermans-handheld-sudoku/psp-821571,http://psp.ign.com/articles/771/771330p1.html,29.99 USD,7.8,PSP LED PS2 LED PC,"March 7, 2007","http://www.ign.com/games/angry-birds/psp-82423,http://www.ign.com/games/locoroco-2/psp-883935,http://www.ign.com/games/sudoku-ea/psp-23184,http://www.ign.com/games/final-fantasy-vii/psp-14340290,http://www.ign.com/games/final-fantasy-viii/psp-33571,http://www.ign.com/games/resident-evil-3-nemesis/psp-18950",Great,8.4,,E for Everyone,Good
Ubisoft,Action,Ubisoft Montreal,"In TMNT, the Turtles must save New York City from a monstrous evil that lurks around every corner, while trying to maintain their unity as a group.  Based on the CG animated movie produced by Imagi Animation Studios and based on Mirage Studios' Foot Clan-kicking Turtle heroes.",TMNT,http://www.ign.com/games/tmnt/gcn-794093,http://cube.ign.com/articles/774/774889p1.html,39.99 USD,6.0,GCN PS2 Wii NDS PC Xbox 360 PSP GBA,"March 20, 2007","http://www.ign.com/games/the-legend-of-zelda-the-wind-waker/gcn-17012,http://www.ign.com/games/resident-evil-4/gcn-15821,http://www.ign.com/games/metroid-prime/gcn-15316,http://www.ign.com/games/the-legend-of-zelda-the-wind-waker/gcn-17012,http://www.ign.com/games/super-smash-bros-melee/gcn-16387,http://www.ign.com/games/super-mario-sunshine/gcn-16713",Good,7.3,"Cartoon Violence, Mild Language",E10+ for Everyone 10 and older,Okay
Ubisoft,Action,Ubisoft Montreal,"This Teenage Mutant Ninja Turtles game is based on the CG animated movie produced by Imagi Animation Studios and based on Mirage Studios' Foot Clan-kicking Turtle heroes. The game takes place in a New York City plagued by secretive villains and strange, otherworldly creatures. Faced with these perils, the Turtles will experience their most trying time as heroes and as a family, as Raphael, Donatello and Michelangelo lose their focus and struggle to maintain their unity and ninja discipline. It's up to Leonardo and the faithful father figure Splinter to reunite the band of brothers and save New York City from a monstrous evil that lurks around every corner. Players engage in over-the-top acrobatic navigation, collaborative combat and powerful fighting moves.",TMNT,http://www.ign.com/games/tmnt/ps2-794092,http://ps2.ign.com/articles/774/774575p1.html,39.99 USD,6.0,PS2 Wii GCN NDS PC Xbox 360 PSP GBA,"March 20, 2007","http://www.ign.com/games/god-of-war-ii/ps2-811719,http://www.ign.com/games/kingdom-hearts/ps2-16467,http://www.ign.com/games/grand-theft-auto-san-andreas/ps2-611957,http://www.ign.com/games/shin-megami-tensei-persona-4/ps2-14241813,http://www.ign.com/games/god-of-war-ii/ps2-811719,http://www.ign.com/games/god-of-war-ii/ps2-888576",Good,7.3,"Cartoon Violence, Mild Language",E10+ for Everyone 10 and older,Okay
SEGA,Sports,SEGA-AM2,"Virtua Tennis  returns with enhanced, photo-realistic graphics and advanced player animations that perfectly match the behavior and mannerisms of individual professional athletes. Improvements to the game's AI have also upped the challenge to becoming the top seed of the tennis world.

In Career Mode, gamers will travel the world and take on the biggest stars of the tennis world. Improvements to the Player Creation Mode allow gamers to customize their own tennis star with a wealth of licensed tennis equipment and increased detail like never before. And, in addition to the popular mini-games from previous titles used to sharpen players' skills, there are a whole host of brand new challenges to keep players in top form.",Virtua Tennis 3,http://www.ign.com/games/virtua-tennis-3/ps3-824785,http://ps3.ign.com/articles/774/774115p1.html,59.99 USD,7.3,PS3 Arcade Xbox 360 PC PSP,"March 20, 2007","http://www.ign.com/games/madden-nfl-2013/ps3-128098,http://www.ign.com/games/nba-2k17/ps3-20052297,http://www.ign.com/games/fifa-2013/ps3-115679,http://www.ign.com/games/grand-theft-auto-online/ps3-20006859,http://www.ign.com/games/metal-gear-online-mgs5/ps3-20028682,http://www.ign.com/games/the-elder-scrolls-v-skyrim-dragonborn/ps3-146419",Good,7.6,,E for Everyone,Good
Nintendo,Racing,Nintendo R&D1,"The Nintendo EAD-developed 2D racer was one of the first to stick you on the steep hills of the off-road biking bracket. Forced to worry about overheating and launching off each jump at just the right angle, players were privy to a very unique and demanding gameplay experience. Not only that, but it also offered up a rare create-a-track mode. Not only has this highly respected classic endured the test of time, but it went on to see a warmly received 3D follow-up, Excitebike 64.",Excitebike,http://www.ign.com/games/excitebike/nes-7159,http://retro.ign.com/articles/879/879422p1.html,,8.4,NES GBA Wii Wii U,"October 15, 1985","http://www.ign.com/games/rc-pro-am/nes-7176,http://www.ign.com/games/micro-machines-1/nes-7352,http://www.ign.com/games/spy-hunter/nes-7228,http://www.ign.com/games/the-legend-of-zelda/nes-5990,http://www.ign.com/games/super-mario-bros-3/nes-6694,http://www.ign.com/games/super-mario-bros/nes-6693",Great,8.3,,,Great
SEGA,Racing,Deep Fried Entertainment,"Full Auto 2: Battlelines puts high-speed vehicles outfitted with weapons and armor into fully realized and fully destructible urban street environments. Players can destroy the environment to dynamically change track conditions to block competitors, open new paths, or crush opponents with falling debris caused by well-timed missiles. Full Auto 2: Battlelines for the PSP features exclusive content including a new 56 event single-player story mode, 15 selectable cars designed specifically for the PSP version, numerous multiplayer and arena modes via ad-hoc connections, and a host of new weapons guaranteed to cause massive destruction and havok.",Full Auto 2: Battlelines,http://www.ign.com/games/full-auto-2-battlelines/psp-865505,http://psp.ign.com/articles/774/774975p1.html,39.95 USD,6.1,PSP PS3,"March 20, 2007","http://www.ign.com/games/twisted-metal-head-on/psp-682965,http://www.ign.com/games/need-for-speed-most-wanted-5-1-0/psp-740903,http://www.ign.com/games/wipeout-pure/psp-682962,http://www.ign.com/games/ace-combat-x-skies-of-deception/psp-822479,http://www.ign.com/games/angry-birds/psp-82423,http://www.ign.com/games/naruto-shippuden-ultimate-ninja-impact/psp-104110,http://www.ign.com/games/final-fantasy-vii/psp-14340290,http://www.ign.com/games/final-fantasy-viii/psp-33571,http://www.ign.com/games/resident-evil-3-nemesis/psp-18950",Good,7.5,"Mild Lyrics, Violence",E10+ for Everyone 10 and older,Okay
Ubisoft,Action,Ubisoft Montreal,"This Teenage Mutant Ninja Turtles game is based on the CG animated movie produced by Imagi Animation Studios and based on Mirage Studios' Foot Clan-kicking Turtle heroes. The game takes place in a New York City plagued by secretive villains and strange, otherworldly creatures. Faced with these perils, the Turtles will experience their most trying time as heroes and as a family, as Raphael, Donatello and Michelangelo lose their focus and struggle to maintain their unity and ninja discipline. It's up to Leonardo and the faithful father figure Splinter to reunite the band of brothers and save New York City from a monstrous evil that lurks around every corner. Players engage in over-the-top acrobatic navigation, collaborative combat and powerful fighting moves.",TMNT,http://www.ign.com/games/tmnt/pc-794100,http://pc.ign.com/articles/774/774647p1.html,29.95 USD,6.0,PC PS2 Wii GCN NDS Xbox 360 PSP GBA,"March 20, 2007","http://www.ign.com/games/grand-theft-auto-online/pc-20019837,http://www.ign.com/games/metal-gear-solid-5/pc-20023125,http://www.ign.com/games/resident-evil-7/pc-20054862,http://www.ign.com/games/grand-theft-auto-online/pc-20019837,http://www.ign.com/games/mass-effect-andromeda/pc-20034220,http://www.ign.com/games/the-witcher-3-wild-hunt-blood-and-wine/pc-20035505",Okay,6.7,"Cartoon Violence, Mild Language",E10+ for Everyone 10 and older,Okay
