community_score,community_score_phrase,description,developers,genres,ign_score,ign_score_phrase,platforms,price,publisher,rating_category,rating_content,related_games,release_date,review_link,title,url
7.9,Good,"The ultimate goal of any skater is to get on the cover of THRASHER magazine as their Skater of the Year. Now you have a chance to reach that level with THRASHER: Skate and Destroy. Choose from six different fictional skaters and hit any of the 12 levels. In order to progress through the game, you must perform tricks to score points. Once you score a certain number of points, you can advance to the next level. After completing a course, you will gain new tricks and earn the chance to get sponsors that will give you all kinds of fringe benefits. After completing all of the levels, your character will be able to perform more than 100 tricks. If your friends want in on the action, there are several multiplayer modes including Best Tricks, Worst Wrecks, H-O-R-S-E, Longest Grind, Biggest Wallride, and Two-Minute Session. Play THRASHER: Skate and Destroy and find out if you have what it takes to become the THRASHER Skater of the Year.",Z-Axis,Sports,8.5,Great,PS GBC,28.99 USD,Rockstar  Games,T for Teen,Animated Violence,"http://www.ign.com/games/ncaa-football-2001/ps-14657,http://www.ign.com/games/nhl-2001/ps-14658,http://www.ign.com/games/tony-hawks-pro-skater-2/ps-14304,http://www.ign.com/games/final-fantasy-vii/ps-494,http://www.ign.com/games/final-fantasy-viii/ps-3847,http://www.ign.com/games/baldurs-gate/ps-13673",November 1999,http://psx.ign.com/articles/161/161885p1.html,Thrasher: Skate and Destroy,http://www.ign.com/games/thrasher-skate-and-destroy/ps-11885
8.5,Great,"Gabriel and Grace return, and this time they're taking on deadly vampires in their search for a kidnapped child. The macabre action takes place in a small burg in France, and the game is packed with dozens of puzzles, mysteries to solve, and clues to decipher. To aid you in your attempt to unravel the plot of this dark crime, you'll have access to the Schattenjager Information Database, an all-inclusive collection of clues, maps, and more. Many of the characters you encounter will be allies, but many of them are only pretending to be friendly, so be on guard. Don't trust anyone without a reflection.",Sierra Studios,Adventure,8.3,Great,PC,9.99 USD,"Sierra Studios, Sierra",M for Mature,"Animated Violence, Mature Sexual Themes, Strong Language","http://www.ign.com/games/recore/pc-20047415,http://www.ign.com/games/life-is-strange-episode-4/pc-20031273,http://www.ign.com/games/the-walking-dead-the-game/pc-100880,http://www.ign.com/games/grand-theft-auto-online/pc-20019837,http://www.ign.com/games/mass-effect-andromeda/pc-20034220,http://www.ign.com/games/the-witcher-3-wild-hunt-blood-and-wine/pc-20035505","Nov 19, 1999",http://pc.ign.com/articles/161/161944p1.html,"Gabriel Knight III: Blood of the Sacred, Blood of the Damned",http://www.ign.com/games/gabriel-knight-iii-blood-of-the-sacred-blood-of-the-damned/pc-11944
7.7,Good,"Yeti wants to rule over the entire world, so he is using his magical powers to turn it into a large mass of ice. There is only one person who can save the day: Mr. Nutz the Squirrel. You take control of Mr. Nutz as he runs, jumps, swims, and flies through six different worlds. Along the way, you must collect acorns, coins, extra lives, and extra energy. Getting through the levels and collecting the goodies is no walk in the park, as there are plenty of bad guys waiting to stop you. Luckily, Mr. Nutz can dispose of them by jumping on their heads or whipping them with his giant tail. Will you be able to find all of the secrets and defeat Yeti in MR. NUTZ?","Planet Interactive, Otaboo",Platformer,7.0,Good,GBC Gen GBA GB SNES,34.99 USD,Infogrames,E for Everyone,No Descriptors,"http://www.ign.com/games/shantae/gbc-15286,http://www.ign.com/games/wario-land-ii/gbc-11140,http://www.ign.com/games/super-mario-bros-deluxe/gbc-11703,http://www.ign.com/games/pokemon-silver-version/gbc-16709,http://www.ign.com/games/pokemon-gold-version/gbc-12865,http://www.ign.com/games/pokemon-crystal-version/gbc-15402",November 1999,http://gameboy.ign.com/articles/162/162580p1.html,Mr. Nutz,http://www.ign.com/games/mr-nutz/gbc-12580
7.5,Good,"A first person shooter based on Robert Jordan's best-selling fantasy novel series, The Wheel of Time. The magical devices known as the Ter'Angreal fill in for the guns and rocket launchers here. In the single-player story mode, explore various areas and battle enemies drawn straight from the books. In the multiplayer modes, go for some classic deathmatch action, or set up clever traps at your team's fort before starting the fight in the capture-the-flag scenarios.",Legend Entertainment,Action,7.3,Good,PC,9.99 USD,GT Interactive,T for Teen,Animated Violence,"http://www.ign.com/games/grand-theft-auto-online/pc-20019837,http://www.ign.com/games/metal-gear-solid-5/pc-20023125,http://www.ign.com/games/resident-evil-7/pc-20054862,http://www.ign.com/games/grand-theft-auto-online/pc-20019837,http://www.ign.com/games/mass-effect-andromeda/pc-20034220,http://www.ign.com/games/the-witcher-3-wild-hunt-blood-and-wine/pc-20035505","November 15, 1999",http://pc.ign.com/articles/152/152316p1.html,The Wheel of Time,http://www.ign.com/games/the-wheel-of-time/pc-2316
7.0,Good,"In Nuclear Strike 64, you are an agent of Strike Team, an international special operations unit. The goal is to stop Colonel LeMonde, a former CIA Intelligence Officer, and his followers before they wage a nuclear war that would mean the end of the world. After stealing a nuclear weapon, the terrorists have fled deep into the lush jungles of Southeast Asia. Fifteen detail-rich landscapes, from the South Seas to jungles, provide the setting for the action.

You have more than 10 vehicles at your disposal, including jets, helicopters, tanks, and hovercraft. The different levels demand your skills as a tactician in order to accomplish each mission successfully. Optimal weapon selection, ammunition and fuel conservation, and POWs all play a part in your victory. The assault technique requires strategic use of the automatic target feature, the manual override, and left and right strafing buttons, among others. Destroy the evil terrorists and fight the good fight as you strive to save the world from total annihilation.",Pacific Coast Power and Light (PC&L),Action,7.1,Good,N64 PS PS3 PSP PC,58.99 USD,THQ,E for Everyone,Animated Violence,"http://www.ign.com/games/the-legend-of-zelda-ocarina-of-time/n64-437,http://www.ign.com/games/the-legend-of-zelda-ocarina-of-time/n64-14248881,http://www.ign.com/games/the-legend-of-zelda-majoras-mask/n64-1933,http://www.ign.com/games/the-legend-of-zelda-ocarina-of-time/n64-437,http://www.ign.com/games/the-legend-of-zelda-ocarina-of-time/n64-14248881,http://www.ign.com/games/the-legend-of-zelda-majoras-mask/n64-1933","December 2, 1999",http://ign64.ign.com/articles/152/152000p1.html,Nuclear Strike,http://www.ign.com/games/nuclear-strike/n64-2000
7.4,Good,"Jump on a motorcycle and become a master of hairpin turns, bumps, and jumps with SUPERCROSS 2000. Choose from among 24 real-world drivers and hit the track. When you want some competition, you will need to decide what type of action you want. If speed is your thing, play the Race mode and concentrate on finishing in first place. Should you prefer showmanship to speed, perform huge tricks and try to score as many points as possible with the judges in the Freestyle mode. In both modes you will have to contend with a true-to-life physics model, which makes the game a stop and start affair just like real supercross racing, and big tricks are harder to accomplish. Get the experience of supercross racing without having to buy a bike with SUPERCROSS 2000.",MBL Research,Racing,8.1,Great,N64 PS,19.99 USD,Electronic Arts,E for Everyone,Mild Animated Violence,"http://www.ign.com/games/mario-kart-64/n64-502,http://www.ign.com/games/diddy-kong-racing/n64-2146,http://www.ign.com/games/f-zero-x/n64-418,http://www.ign.com/games/the-legend-of-zelda-ocarina-of-time/n64-437,http://www.ign.com/games/the-legend-of-zelda-ocarina-of-time/n64-14248881,http://www.ign.com/games/the-legend-of-zelda-majoras-mask/n64-1933","December 3, 1999",http://ign64.ign.com/articles/161/161672p1.html,Supercross 2000,http://www.ign.com/games/supercross-2000/n64-11672
5.0,Mediocre,"In BILLY BOB'S HUNTIN' AND FISHIN' for Game Boy Color, you play the role of a hapless guy named Billy Bob, who is trying to impress a girl. She'll ask Billy Bob to fetch her rabbits or bass, and it's up to you to help Billy Bob get them. Obviously, to get the things she wants you'll have to either go hunting or fishing. Not so fast though, because you need bullets for hunting, bait for fishing, and a license to do either of the two activities. Luckily, you can earn these items by playing a variety of mini-games. The games vary in their gameplay, but the usual assortment of speed and reflex tests are the common thread. You'll need to clear four mini-games each to go hunting and fishing. Once you've finally cleared them and gotten the items you need, you'll head out to catch your real prize. BILLY BOB'S HUNTIN' AND FISHIN' is for one player and is compatible only with Game Boy Color.",Saffire,Hunting,5.0,Mediocre,GBC,34.99 USD,Midway  Games,E for Everyone,Animated Violence,"http://www.ign.com/games/zebco-fishing/gbc-12919,http://www.ign.com/games/tnn-outdoor-fishing-championship/gbc-12927,http://www.ign.com/games/bass-lure-fishing/gbc-10772,http://www.ign.com/games/pokemon-silver-version/gbc-16709,http://www.ign.com/games/pokemon-gold-version/gbc-12865,http://www.ign.com/games/pokemon-crystal-version/gbc-15402",November 1999,http://gameboy.ign.com/articles/163/163034p1.html,Billy Bob's Huntin' 'n Fishin',http://www.ign.com/games/billy-bobs-huntin-n-fishin/gbc-13034
7.0,Good,"It's a familiar story: aliens are on a rampage, and will stop at nothing to destroy the Earth and all its inhabitants. That's where you come in. As one of the most well respected soldiers in the world, it's up to you to put a stop to the extraterrestrial terror and make the Earth a safe place to live again. You'll go to battle on all kinds of terrain, from mountains to deserts to oceans, and you'll have a variety of vehicles that are appropriate for the job: tanks, gun turrets, helicopters, and jets. Each mission will call for a different skill, whether it's reconnaissance, search and destroy, or defense. Your battle skills will definitely be put to the test as you go on the most important mission of your life. You can also recruit a friend to help your cause with some awesome two-player action. If you aren't feeling friendly you can compete with a buddy to see who can blast the most aliens and be the hero.",Rage Software,Action,7.0,Good,DC PC Mac Arcade,9.99 USD,Interplay,T for Teen,Mild Animated Violence,"http://www.ign.com/games/shenmue/dc-14499,http://www.ign.com/games/shenmue-ii/dc-15624,http://www.ign.com/games/spider-man-2000/dc-15779,http://www.ign.com/games/baldurs-gate/dc-12490,http://www.ign.com/games/nba-2k1/dc-14602,http://www.ign.com/games/marvel-vs-capcom-clash-of-super-heroes/dc-9967","December 1, 1999",http://dreamcast.ign.com/articles/160/160382p1.html,Incoming,http://www.ign.com/games/incoming/dc-10382
6.2,Okay,"You're an Armorine, a soldier in a nuclear-powered suit prepared to slaughter the legions of killer alien bugs plotting to render the human population extinct. Acclaim Entertainment brings you this all out action assault, in which you'll tear through evil insects with a bevy of powerful super weapons. You'll be called on to exterminate their presence in volcanoes, sandstorms, snowy mountains, and the far reaches of outer space. And, just your luck these bugs are smart. With advanced AI and dozens of unique enemies, you'd better bring a lot of ammo. If you so choose, a friend can join the assault with you, or if you need some practice before you commence your bug squashing mission, play with up to four friends in a Multiplayer room, where you can take shots at one another with weapons designed for bug blasting. Armorine, the success of Project S.W.A.R.M depends on you.",Acclaim Studios London,Action,5.8,Mediocre,N64 GBC,27.99 USD,Acclaim Entertainment,T for Teen,"Blood, Animated Violence","http://www.ign.com/games/the-legend-of-zelda-ocarina-of-time/n64-437,http://www.ign.com/games/the-legend-of-zelda-ocarina-of-time/n64-14248881,http://www.ign.com/games/the-legend-of-zelda-majoras-mask/n64-1933,http://www.ign.com/games/the-legend-of-zelda-ocarina-of-time/n64-437,http://www.ign.com/games/the-legend-of-zelda-ocarina-of-time/n64-14248881,http://www.ign.com/games/the-legend-of-zelda-majoras-mask/n64-1933","December 2, 1999",http://ign64.ign.com/articles/160/160826p1.html,Armorines: Project S.W.A.R.M.,http://www.ign.com/games/armorines-project-swarm-805472/n64-10826
5.9,Mediocre,"Try to get your marble to the end of the maze in MARBLE MADNESS. You must guide a marble through a maze within a specified amount of time. You have an unlimited supply of marbles, but rolling one off the edge or having one destroyed by an enemy will cost you valuable seconds. Along the way, your marbles will face acid puddles that dissolve the marble instantly, marble munchers that jump up and down trying to eat the marble, and your dreaded nemesis, the black marble. As a stroke of luck, there are tunnels, ramps, and chutes that will lead your marble to other parts of the maze. You score points by completing levels with time left on the clock and traversing through all six stages. There is plenty of marble-rolling action in MARBLE MADNESS.",Digital Eclipse Software,Action,5.0,Mediocre,GBC LCD Gen ST Cell SMS CPC C64 Apple-II GG GB NES,34.99 USD,Midway  Games,E for Everyone,No Descriptors,"http://www.ign.com/games/the-legend-of-zelda-oracle-of-seasons/gbc-16042,http://www.ign.com/games/the-legend-of-zelda-oracle-of-ages/gbc-16041,http://www.ign.com/games/batman-chaos-in-gotham/gbc-14474,http://www.ign.com/games/pokemon-silver-version/gbc-16709,http://www.ign.com/games/pokemon-gold-version/gbc-12865,http://www.ign.com/games/pokemon-crystal-version/gbc-15402",December 1999,http://gameboy.ign.com/articles/162/162222p1.html,Marble Madness,http://www.ign.com/games/marble-madness/gbc-12222
6.6,Okay,"You must take control of the Boombots and stop the evil aliens that have captured the world's housecats. There are a total of 15 Boombots to choose from, each with an array of punches and kicks, as well as unique grappling moves and weapons. When you are ready to fight, enter one of the 15 arenas and prepare for battle. Fortunately, there are a large number of power-ups hidden in each venue, including energy boosts that will make the fight a little easier for you. Once you collect enough energy, your Boombot enters Mongo mode and grows in size and strength. Graphically, the game retains the claymation feel that the Neverhood is famous for, and there are also a number of full-motion video sequences that are done entirely in claymation. The world is counting on you to help save the frightened felines in BOOMBOTS.",The Neverhood,Fighting,3.5,Awful,PS,19.99 USD,SouthPeak Games,T for Teen,"Animated Violence, Comic Mischief","http://www.ign.com/games/street-fighter-alpha/ps-181,http://www.ign.com/games/digimon-world-2/ps-16355,http://www.ign.com/games/tekken-3/ps-2294,http://www.ign.com/games/final-fantasy-vii/ps-494,http://www.ign.com/games/final-fantasy-viii/ps-3847,http://www.ign.com/games/baldurs-gate/ps-13673",December 1999,http://psx.ign.com/articles/163/163397p1.html,Boombots,http://www.ign.com/games/boombots/ps-13397
7.7,Good,"You must try to defend your land from rushing invaders in RAMPART. The game breaks down into three phases. The building phase has the player build walls around the castles that populate the land. By completely surrounding a castle, the player earns a cannon. In the second phase, the player must position all of the cannons earned in the first phase. Finally, the attack phase commences, and the enemy invades by sea. Aim the cannons and fire at the enemy ships to keep them from making landfall. After the attack phase is over, you must begin again. If you start to beat the computer-controlled competition on a regular basis, challenge your friends to a game with the Two-Player option. Keep your lands safe from the rushing onslaught in RAMPART.",Digital Eclipse Software,Strategy,9.0,Amazing,GBC Gen GB PC PS3 Arcade SNES SMS NES Lynx,34.99 USD,Midway  Games,E for Everyone,"Animated Violence, Mild Animated Violence","http://www.ign.com/games/lemmings/gbc-14459,http://www.ign.com/games/heroes-of-might-magic-millennium-edition/gbc-13216,http://www.ign.com/games/game-boy-wars-2/gbc-10784,http://www.ign.com/games/pokemon-silver-version/gbc-16709,http://www.ign.com/games/pokemon-gold-version/gbc-12865,http://www.ign.com/games/pokemon-crystal-version/gbc-15402",November 1999,http://gameboy.ign.com/articles/162/162320p1.html,Rampart,http://www.ign.com/games/rampart/gbc-12320
7.9,Good,"Lara Croft faces the great dangers of an unleashed Egyptian god in her fourth tomb raiding adventure. Last Revelation's redesigned inventory system gives Tomb Raider brand-new gameplay. Combined with Lara's new moves and abilities, gameplay features greater scope than ever before. Clear objectives and smaller locations result in less time spent traveling between areas. Individual environments are more reminiscent of the original game - tightly focused and puzzle-orientated, but with higher levels of detail and a greater number of objects than seen before. An emphasis on ancient locations and tombs allows mystery, suspense and characteristic atmosphere to play key roles throughout.",CORE Design Limited,Action,8.5,Great,PS DC PSP Mac PS3 PC,28.99 USD,Eidos Interactive,T for Teen,"Animated Blood, Animated Violence","http://www.ign.com/games/metal-gear-solid/ps-569,http://www.ign.com/games/resident-evil-3-nemesis/ps-11482,http://www.ign.com/games/resident-evil-2/ps-504,http://www.ign.com/games/final-fantasy-vii/ps-494,http://www.ign.com/games/final-fantasy-viii/ps-3847,http://www.ign.com/games/baldurs-gate/ps-13673","November 22, 1999",http://psx.ign.com/articles/161/161882p1.html,Tomb Raider: The Last Revelation,http://www.ign.com/games/tomb-raider-the-last-revelation/ps-11882
6.4,Okay,"Designed and developed by Wings Simulations, Panzer Elite is poised to take the high ground as one of the most realistic platoon-based WWII tank simulation games yet seen for your PC. Models are created from original tank blueprints and accurate measurements from actual working WWII tanks at the Panzer Museum in Munster, Germany. The complex game engine allows for individual trees and bushes in forests, different terrain movement and performance, destructible buildings and more for realistic tactical options.",Wings Simulations GmbH,Simulation,5.3,Mediocre,PC,,Psygnosis,T for Teen,Animated Violence,"http://www.ign.com/games/civilization-beyond-earth/pc-20016115,http://www.ign.com/games/simcity/pc-128952,http://www.ign.com/games/civilization-beyond-earth-rising-tide/pc-20040683,http://www.ign.com/games/grand-theft-auto-online/pc-20019837,http://www.ign.com/games/mass-effect-andromeda/pc-20034220,http://www.ign.com/games/the-witcher-3-wild-hunt-blood-and-wine/pc-20035505","Oct 26, 1999",http://pc.ign.com/articles/159/159978p1.html,Panzer Elite,http://www.ign.com/games/panzer-elite/pc-9978
6.7,Okay,"Does your trigger finger have the speed and accuracy to earn you a showdown with the big guns? Enter shootouts in old-west locales, like Red River, The Church, Santa Fe Railroad, and a Gold Mine. You'll have a whole range of period-accurate firearms at your disposal ranging from Colt revolvers to shotguns and rifles. Four different difficulty levels let gunslingers of all ages appreciate the detailed action, and complete stats are kept on each of your shootouts. If you're good, you might just earn a match-up with Jesse James, Billy the Kid, Black Bart, and other storybook marksmen.",Contraband Entertainment,Action,3.9,Awful,PC,19.99 USD,Encore,T for Teen,Animated Violence,"http://www.ign.com/games/grand-theft-auto-online/pc-20019837,http://www.ign.com/games/metal-gear-solid-5/pc-20023125,http://www.ign.com/games/resident-evil-7/pc-20054862,http://www.ign.com/games/grand-theft-auto-online/pc-20019837,http://www.ign.com/games/mass-effect-andromeda/pc-20034220,http://www.ign.com/games/the-witcher-3-wild-hunt-blood-and-wine/pc-20035505","Dec 15, 1999",http://pc.ign.com/articles/163/163662p1.html,Colt's Wild West Shootout,http://www.ign.com/games/colts-wild-west-shootout/pc-13662
7.4,Good,,Androsoft,Puzzle,7.5,Good,PC,,Hasbro Interactive,E for Everyone,,"http://www.ign.com/games/the-witness/pc-23509,http://www.ign.com/games/valiant-hearts-the-great-war/pc-20005430,http://www.ign.com/games/never-alone/pc-20017754,http://www.ign.com/games/grand-theft-auto-online/pc-20019837,http://www.ign.com/games/mass-effect-andromeda/pc-20034220,http://www.ign.com/games/the-witcher-3-wild-hunt-blood-and-wine/pc-20035505","Dec 17, 1999",http://pc.ign.com/articles/163/163663p1.html,Rubik's Games,http://www.ign.com/games/rubiks-games/pc-13663
4.5,Bad,"A wizard has been assigned to watch over the magic crystals in the kingdom. While performing an experiment, his gloves fall into a cauldron, and the resulting explosion scatters the crystals across the land. The substance in the cauldron makes the gloves come to life. The good news is that one of the gloves is good and wants to recover the crystals. The bad news is that the other glove is evil and wants the crystals for his menacing plans. You take the role of the good glove, Glover. Rather than just finding the crystal in each level, Glover must take the crystal to the end of the stage. As luck would have it, Glover can change the properties of the crystals to help him solve puzzles: the crystal can be turned into bouncy rubber or into a magnetized ball bearing. With challenging puzzles and inventive gameplay, GLOVER will keep the whole family entertained.",Interactive Studios,Platformer,2.6,Painful,PS PC Cell N64,13.99 USD,Hasbro Interactive,E for Everyone,Comic Mischief,"http://www.ign.com/games/crash-bandicoot/ps-603,http://www.ign.com/games/crash-bandicoot-warped/ps-3919,http://www.ign.com/games/crash-bandicoot-2-cortex-strikes-back/ps-2037,http://www.ign.com/games/final-fantasy-vii/ps-494,http://www.ign.com/games/final-fantasy-viii/ps-3847,http://www.ign.com/games/baldurs-gate/ps-13673",December 1999,http://psx.ign.com/articles/153/153903p1.html,Glover,http://www.ign.com/games/glover/ps-3903
8.3,Great,"George Stobbard's girlfriend, Nico, stumbles upon the drug smuggling operations of a Central American cartel. Drug lords don't like witnesses, so they kidnap Nico to keep her quiet. If that wasn't enough, Nico's kidnapping is also related to a mysterious piece of obsidian. Stobbard is the only one who can save Nico and solve the mystery behind the unusual stone. You, as Stobbard, must solve puzzles in such exotic locales as Mexico, France, Britain, and the Caribbean. Luckily, clues to solving all the puzzles can be found by listening to the spoken dialogue of the locals and paying attention to the hand-drawn graphics and animation. Will Stobbard be able to save Nico from the drug lords? Play BROKEN SWORD II: The Smoking Mirror to find out.",Revolution Software Ltd.,Adventure,8.0,Great,PS iPhone PC,9.99 USD,Crave Entertainment,T for Teen,"Animated Blood, Animated Violence, Mild Language","http://www.ign.com/games/silent-hill/ps-3982,http://www.ign.com/games/dino-crisis/ps-11235,http://www.ign.com/games/oddworld-abes-oddysee/ps-2094,http://www.ign.com/games/final-fantasy-vii/ps-494,http://www.ign.com/games/final-fantasy-viii/ps-3847,http://www.ign.com/games/baldurs-gate/ps-13673","December 25, 1999",http://psx.ign.com/articles/159/159681p1.html,Broken Sword II: The Smoking Mirror,http://www.ign.com/games/broken-sword-ii-the-smoking-mirror/ps-9681
6.0,Okay,"Spices are the most valuable commodity in the universe, and they can only be found on the planet Arrakis. The House that controls the spice mines will control the planet. You will take command of one of three Houses: the noble Atreides, the treacherous Harkonnen, and the mysterious Ordos. Each group has 10 unique missions, as well as unique units and technological developments. In all of the missions, one goal remains the same: you must harvest as much spice as possible to build your military units and fund other objectives. Once have enough military power, you'll have to go on the offensive and try to take out the other two Houses. If you are successful, you claim a larger share of the spice industry. As you game progresses, you'll discover the reasons behind each side's involvement in the spice trade. In DUNE 2000, you'll either be the controller of the spice trade or merely a pawn in the grand scheme of it all.",Westwood Studios,Strategy,4.0,Bad,PS PC PC,38.99 USD,Electronic Arts,T for Teen,"Animated Violence, Realistic Violence","http://www.ign.com/games/final-fantasy-tactics/ps-26,http://www.ign.com/games/age-of-empires/ps-20051961,http://www.ign.com/games/command-and-conquer-red-alert/ps-2198,http://www.ign.com/games/final-fantasy-vii/ps-494,http://www.ign.com/games/final-fantasy-viii/ps-3847,http://www.ign.com/games/baldurs-gate/ps-13673",November 1999,http://psx.ign.com/articles/162/162016p1.html,Dune 2000,http://www.ign.com/games/dune-2000/ps-12016
