community_score,community_score_phrase,description,developers,genres,ign_score,ign_score_phrase,platforms,price,publisher,rating_category,rating_content,related_games,release_date,review_link,title,url
8.9,Great,"There are music-mixing computer programs that cost thousands of dollars, but none of them are this fun. You chose your rhythm tracks, bass lines, guitar riffs, and triangle hits in this complete music-making experience. You can make rock, pop, hip-hop, techno, or jazz songs, and each will be vastly different from the others. There are more than 1,500 riffs and 3,000 instrument sounds to choose from, and you can even write your own parts instead of using the pre-programmed melodies. Just about everything you can think of can be manipulated here, right down to the volume of the floor toms, the amount of reverb applied to each instrument, and the song's tempo. The next step is to create a music video for your masterpiece, and you'll have plenty of 3D clips at your disposal in so doing. Once you have your complete package, you can save everything to a memory card and access any part of it (from an instrument sound or keyboard riff to the entire song) later. All in all, it's about the most creative use of a video game console imaginable.",Jester Interactive,Music,9.0,Amazing,PS PC,26.24 USD,Codemasters,E for Everyone,Suitable for Persons Ages Six and Older,"http://www.ign.com/games/guitar-freaks/ps-12563,http://www.ign.com/games/bust-a-groove-2/ps-11939,http://www.ign.com/games/music-2000-music-creation-for-the-playstation/ps-571768,http://www.ign.com/games/rpg-maker/ps-3771,http://www.ign.com/games/music-2000-music-creation-for-the-playstation/ps-571768,http://www.ign.com/games/final-fantasy-vii/ps-494,http://www.ign.com/games/final-fantasy-viii/ps-3847,http://www.ign.com/games/baldurs-gate/ps-13673",December 1999,http://psx.ign.com/articles/163/163748p1.html,MTV Music Generator,http://www.ign.com/games/mtv-music-generator/ps-13748
8.2,Great,"Silhouette Mirage is an action classic 2-D game where you take control of a small character who must battle enemies made up of silhouettes and mirages. Shoot your way through several levels loaded with enemies, large fully animated bosses and beautiful multi-scrolling backgrounds.",Treasure,Action,8.9,Great,PS Saturn,7.99 USD,"Working Designs, ESP",E for Everyone,"Mild Animated Violence, Mild Language","http://www.ign.com/games/metal-gear-solid/ps-569,http://www.ign.com/games/resident-evil-3-nemesis/ps-11482,http://www.ign.com/games/resident-evil-2/ps-504,http://www.ign.com/games/final-fantasy-vii/ps-494,http://www.ign.com/games/final-fantasy-viii/ps-3847,http://www.ign.com/games/baldurs-gate/ps-13673",December 1999,http://psx.ign.com/articles/153/153921p1.html,Silhouette Mirage,http://www.ign.com/games/silhouette-mirage/ps-3921
6.3,Okay,,EAI Interactive,Adventure,5.2,Mediocre,PC,,SouthPeak Games,,,"http://www.ign.com/games/recore/pc-20047415,http://www.ign.com/games/life-is-strange-episode-4/pc-20031273,http://www.ign.com/games/the-walking-dead-the-game/pc-100880,http://www.ign.com/games/grand-theft-auto-online/pc-20019837,http://www.ign.com/games/mass-effect-andromeda/pc-20034220,http://www.ign.com/games/the-witcher-3-wild-hunt-blood-and-wine/pc-20035505","Dec 28, 1999",http://pc.ign.com/articles/162/162318p1.html,Scooby-Doo! Mystery of the Fun Park Phantom,http://www.ign.com/games/scooby-doo-mystery-of-the-fun-park-phantom/pc-12318
6.3,Okay,"Adapt Mars so it can be colonized by humans? It might not sound like the smartest idea, but that's your task and you're determined to accomplish it. It's 2012, and you're part of the first manned mission to Mars. After a mysterious crash landing on the red planet, you find yourself with no communication means and a severely damaged ship and crew. Using Russian and American space technology, the game delivers realistic equipment models and high-tech weapons aplenty to help you battle the mysterious forces at work.",Aneiva,Adventure,5.2,Mediocre,PC,14.99 USD,DreamCatcher Interactive,E for Everyone,Suitable for Persons Ages Six and Older,"http://www.ign.com/games/recore/pc-20047415,http://www.ign.com/games/life-is-strange-episode-4/pc-20031273,http://www.ign.com/games/the-walking-dead-the-game/pc-100880,http://www.ign.com/games/grand-theft-auto-online/pc-20019837,http://www.ign.com/games/mass-effect-andromeda/pc-20034220,http://www.ign.com/games/the-witcher-3-wild-hunt-blood-and-wine/pc-20035505","Oct 29, 1999",http://pc.ign.com/articles/163/163741p1.html,Lightbringer: The Next Giant Leap for Mankind,http://www.ign.com/games/lightbringer-the-next-giant-leap-for-mankind/pc-13741
7.9,Good,"Wetrix+ is a hypnotic, addictive, blindingly colorful water-based puzzle game that plays on an ever changing 3-D landscape. ""Uppers,"" pieces which raise the land on the platform, fall from the sky. Players use these to build pools and dams to encase the water bubbles which sometimes fall. The object of the game is to keep the water on the board without overflowing off the edges or down into holes created by the other less desirable pieces.

Weltrix+ is a surprising if somewhat shallow puzzle game with enough interesting elements to make it worth looking into. Although it does somewhat borrows concepts from Tetris, the game itself has a unique concept yet to be replicated. If you're looking for a good puzzle game for your Dreamcast, Weltrix+ is one of them.",Zed Two,Puzzle,8.7,Great,DC,47.99 USD,Xicat Interactive,E for Everyone,,"http://www.ign.com/games/super-puzzle-fighter-ii-x-for-matching-service/dc-492483,http://www.ign.com/games/chu-chu-rocket/dc-14096,http://www.ign.com/games/bust-a-move-4/dc-14152,http://www.ign.com/games/baldurs-gate/dc-12490,http://www.ign.com/games/nba-2k1/dc-14602,http://www.ign.com/games/marvel-vs-capcom-clash-of-super-heroes/dc-9967","January 5, 2000",http://dreamcast.ign.com/articles/163/163554p1.html,Wetrix+,http://www.ign.com/games/wetrix-958154/dc-13554
3.7,Awful,"Straight from the hit Disney computer-animated movie, A BUG'S LIFE comes to the Game Boy Color. Play as the young ant Flik as he races through nine levels of varied action in his quest to save his ant colony from the cruel Hopper and his gang of grasshoppers. Hopper is bent on stealing all of the ants' food and destroying the colony. Fortunately, Flik is creative and has a few plans to help his friends. On the flip side, he's also very accident-prone, so not all of his plans work out. Play through the levels collecting parts to assemble his inventions while avoiding enemies and natural obstacles. Grasshoppers aren't the only bugs out to stop Flik, as he will also encounter bees, worms, wasps, and others. His only defenses against these nasty bugs are his throwing arm and a limited supply of berries. Never fear though, because scattered throughout the levels are more berries of the throwing variety and the health-giving variety. Just when things look their darkest, Flik can count on his insect friends to make the save!!! You've tried real-life; now try living A BUG'S LIFE.",Tiertex Design Studios,Action,3.0,Awful,GBC PS PC PS3 PSP N64 PC,27.99 USD,THQ,E for Everyone,,"http://www.ign.com/games/the-legend-of-zelda-oracle-of-seasons/gbc-16042,http://www.ign.com/games/the-legend-of-zelda-oracle-of-ages/gbc-16041,http://www.ign.com/games/batman-chaos-in-gotham/gbc-14474,http://www.ign.com/games/pokemon-silver-version/gbc-16709,http://www.ign.com/games/pokemon-gold-version/gbc-12865,http://www.ign.com/games/pokemon-crystal-version/gbc-15402",May 1999,http://gameboy.ign.com/articles/160/160782p1.html,A Bug's Life,http://www.ign.com/games/a-bugs-life/gbc-10782
6.4,Okay,"Get ready to play ball with the pros in this baseball game for PSX. Using real licensed teams and players from the 1999 season, ALL-STAR BASEBALL 2000 challenges you to take your favorite MLB team to a World Series victory. ALL-STAR BASEBALL 2000 offers a wide variety of gameplay options. If you think you have what it takes to play through a full season of MLB action, try the Season mode. If you like to cut to the chase, go straight to the Playoffs. Practice up your swing in the Batting Practice mode, and then prove your skills in the Home Run Derby! When you're ready, take to the field with the greats of the sport in an All-Star Game. Choose between manual and automatic fielding. Need to hold off on your pennant race until another day? No problem! Save your team's progress using the handy password function.",Realtime Associates,Sports,6.0,Okay,GBC N64,35.99 USD,Acclaim Entertainment,E for Everyone,,"http://www.ign.com/games/720/gbc-10768,http://www.ign.com/games/mario-tennis-gbc/gbc-14380,http://www.ign.com/games/ready-2-rumble-boxing/gbc-12329,http://www.ign.com/games/pokemon-silver-version/gbc-16709,http://www.ign.com/games/pokemon-gold-version/gbc-12865,http://www.ign.com/games/pokemon-crystal-version/gbc-15402",May 1999,http://gameboy.ign.com/articles/162/162071p1.html,All-Star Baseball 2000,http://www.ign.com/games/all-star-baseball-2000/gbc-12071
7.9,Good,"Hit the ice in the coolest hockey simulation in console gaming history! NHL 2K continues the winning tradition of previous Sega Sports hits for the Sega Dreamcast arena, NFL 2K and NBA 2K. Fully licensed by the NHL and NHLPA, NHL 2K is the most realistic hockey game on the market today. You can almost feel the brutal contact from a dive on the ice or an all-out brawl. Can you pull off a hat trick? How about a quicksilver flip pass over an unsuspecting opponent? If you've got blades of steel and nerves to match, lace up your skates and win the Cup for your superstar team. Just don't get stuck in the penalty box.",Black Box,Action,8.6,Great,DC,23.99 USD,SEGA,E for Everyone,Animated Violence,"http://www.ign.com/games/shenmue/dc-14499,http://www.ign.com/games/shenmue-ii/dc-15624,http://www.ign.com/games/spider-man-2000/dc-15779,http://www.ign.com/games/baldurs-gate/dc-12490,http://www.ign.com/games/nba-2k1/dc-14602,http://www.ign.com/games/marvel-vs-capcom-clash-of-super-heroes/dc-9967","February 9, 2000",http://dreamcast.ign.com/articles/163/163401p1.html,NHL 2K [2000],http://www.ign.com/games/nhl-2k/dc-13401
9.1,Amazing,"The first Sakura Wars adventure/simulation game was released in late 1996 on the Saturn.  Sega and The Red Company then followed that game with a true adventure/simulation sequel in 1997, along with four fan disks, which feature mini games, artwork, and interviews with the series' developers and voice actors.  Hanagumi Columns was one of those fan disks, and its name comes from the fact that it's basically a version of Sega's classic Columns, placed in the Sakura Wars universe (Hanagumi means ""Flower Branch,"" which is the name of the group that you control in the Sakura Wars game).",Red Company,Puzzle,9.0,Amazing,DC,,SEGA,,,"http://www.ign.com/games/super-puzzle-fighter-ii-x-for-matching-service/dc-492483,http://www.ign.com/games/chu-chu-rocket/dc-14096,http://www.ign.com/games/bust-a-move-4/dc-14152,http://www.ign.com/games/baldurs-gate/dc-12490,http://www.ign.com/games/nba-2k1/dc-14602,http://www.ign.com/games/marvel-vs-capcom-clash-of-super-heroes/dc-9967",,http://dreamcast.ign.com/articles/163/163228p1.html,Sakura Wars: Hanagumi Taisen Columns 2,http://www.ign.com/games/sakura-wars-hanagumi-taisen-columns-2/dc-13228
7.0,Good,"You are out on the lake, and everything is quiet. Suddenly, a fish hits your lure. The fish pulls the line while you fight it, trying to reel it in. It dives deep and flies out of the water; you give the line some slack, and then reel it in. Eventually, the fish loses this fight. You can have this kind of excitement with ZEBCO FISHING! for the Game Boy Color. Hit one of two lakes with a choice of 11 different fishing lures. Try to catch the biggest bass possible in the Tournament mode, and for an extra challenge, try to catch exactly 21 pounds of bass in the Blackjack Bass mode. In both modes, catching fish other than bass has no effect on the outcome. Try to become a fishing champion with ZEBCO FISHING!",Vicarious Visions,Hunting,7.0,Good,GBC,29.99 USD,Vatical Entertainment,E for Everyone,,"http://www.ign.com/games/tnn-outdoor-fishing-championship/gbc-12927,http://www.ign.com/games/bass-lure-fishing/gbc-10772,http://www.ign.com/games/super-real-fishing/gbc-13109,http://www.ign.com/games/pokemon-silver-version/gbc-16709,http://www.ign.com/games/pokemon-gold-version/gbc-12865,http://www.ign.com/games/pokemon-crystal-version/gbc-15402",September 1999,http://gameboy.ign.com/articles/162/162919p1.html,Zebco Fishing,http://www.ign.com/games/zebco-fishing/gbc-12919
8.2,Great,"The best way to describe NASCAR RUMBLE is as an over-the top-racer. This game features power-ups, shortcuts, and the NASCAR license. The environments span town and country locales, and power-ups range from the standard turbo to the unique Freeze, which freezes an opponent temporarily, allowing you to blow past them. But remember, these power-ups can also be used against you, so keep your eyes peeled. If you're a fan of old-school NASCAR, you can unlock legends from NASCAR's storied past by winning various races and tournaments. NASCAR RUMBLE is a multiplayer extravaganza. Not only are two-player competitive championships available, but there are also two-player cooperative tournaments. If you're looking for an alternative to the oval racing of traditional NASCAR games, then NASCAR RUMBLE is worth checking out.",Electronic Arts,Racing,8.0,Great,PS,17.99 USD,Electronic Arts,E for Everyone,No Descriptors,"http://www.ign.com/games/gran-turismo-1998/ps-2226,http://www.ign.com/games/crash-team-racing/ps-11595,http://www.ign.com/games/gran-turismo-2/ps-11426,http://www.ign.com/games/final-fantasy-vii/ps-494,http://www.ign.com/games/final-fantasy-viii/ps-3847,http://www.ign.com/games/baldurs-gate/ps-13673","February 16, 2000",http://psx.ign.com/articles/162/162167p1.html,NASCAR Rumble,http://www.ign.com/games/nascar-rumble/ps-12167
8.6,Great,"Welcome to The Sims, a mirror world created from the fantasies of thousands -- a random alternate reality where you view and play, both.  Enter here and, you own a plot of land to create your own kingdom. Build a house, pizza joint, discotheque, library or anything you dream of. Take a walk through the locality around you and meet Sims just like you. Enhance your power, wealth, reputation and social standing by bonding with Sims everywhere. Here your destiny is in your hands, make it or break it.",Maxis,Simulation,9.5,Amazing,PC Xbox PS2 GCN Mac,39.99 USD,Electronic Arts,T for Teen,"Comic Mischief, Mature Sexual Themes, Mild Animated Violence","http://www.ign.com/games/civilization-beyond-earth/pc-20016115,http://www.ign.com/games/simcity/pc-128952,http://www.ign.com/games/civilization-beyond-earth-rising-tide/pc-20040683,http://www.ign.com/games/grand-theft-auto-online/pc-20019837,http://www.ign.com/games/mass-effect-andromeda/pc-20034220,http://www.ign.com/games/the-witcher-3-wild-hunt-blood-and-wine/pc-20035505","Feb 4, 2000",http://pc.ign.com/articles/161/161754p1.html,The Sims,http://www.ign.com/games/the-sims-1/pc-11754
6.4,Okay,"Conker's Nintendo 64 adventure may not be suitable for kids, but his POCKET TALES are definitely okay for all ages. Conker's birthday party has been somewhat spoiled, as his girlfriend Berri and all of his presents have been stolen by the Evil Acorn. You play as Conker, trying to get Berri and your gifts back in this single-player action or RPG reminiscent of the LEGEND OF ZELDA. Work your way through six areas, searching out your presents so you can move on to the next level. You'll have to defeat the Evil Acorn's forces using your trusty slingshot while solving puzzles in order to make your way through the game. Try your hand at an assortment of mini-games along the way. CONKER'S POCKET TALES packs over 20 hours of gameplay for action or RPG nuts, and the battery backup enables you to save up to two quests. CONKER'S POCKET TALES is compatible with both Game Boy and Game Boy Color.",Rare,Adventure,6.0,Okay,GBC,29.95 USD,Nintendo,E for Everyone,,"http://www.ign.com/games/star-wars-yoda-stories/gbc-12088,http://www.ign.com/games/hamtaro-ham-hams-unite/gbc-493740,http://www.ign.com/games/dino-crisis/gbc-13974,http://www.ign.com/games/pokemon-silver-version/gbc-16709,http://www.ign.com/games/pokemon-gold-version/gbc-12865,http://www.ign.com/games/pokemon-crystal-version/gbc-15402","June 08, 1999",http://gameboy.ign.com/articles/160/160774p1.html,Conker's Pocket Tales,http://www.ign.com/games/conkers-pocket-tales/gbc-10774
1.0,Unbearable,"The popular pursuit of hunting comes to the portable screen in DEER HUNTER for the Game Boy Color. You play as a hunter looking to catch a nice trophy in one of four different areas using three different weapons. Hunt deer with a shotgun, a rifle, or a bow, using slightly different tactics with each. If you want to be successful, you'll have to use real-world hunting strategies. Search for droppings or other signs of movement to find the best area to wait in. Once there, use one of an assortment of tools to help you catch your prey: mask your odor with a cover scent, use a tree stand to camouflage yourself, or lure the deer with a powerful musk, a deer call, or an antler rattle. It's up to you to decide how to catch the deer; some methods are more efficient than others, so you'll have to find the one that works best for you. Detailed graphics and digitized sound round out the experience for would-be hunters. DEER HUNTER is for Game Boy Color systems only.",Morning Star Multimedia,Simulation,2.0,Painful,GBC PC Mac G.com,33.99 USD,Vatical Entertainment,T for Teen,Mild Animated Violence,"http://www.ign.com/games/harvest-moon-gbc-3/gbc-17428,http://www.ign.com/games/catz/gbc-12930,http://www.ign.com/games/legend-of-the-river-king-gbc/gbc-12933,http://www.ign.com/games/pokemon-silver-version/gbc-16709,http://www.ign.com/games/pokemon-gold-version/gbc-12865,http://www.ign.com/games/pokemon-crystal-version/gbc-15402",December 1999,http://gameboy.ign.com/articles/162/162890p1.html,Deer Hunter: Interactive Hunting Experience,http://www.ign.com/games/deer-hunter/gbc-12890
7.6,Good,,Forty Five,Simulation,7.0,Good,DC Arcade,,Forty Five,,,"http://www.ign.com/games/toy-commander-140593/dc-11900,http://www.ign.com/games/railroad-tycoon-2-platinum-edition/dc-14768,http://www.ign.com/games/marionette-company/dc-13334,http://www.ign.com/games/baldurs-gate/dc-12490,http://www.ign.com/games/nba-2k1/dc-14602,http://www.ign.com/games/marvel-vs-capcom-clash-of-super-heroes/dc-9967",,http://dreamcast.ign.com/articles/163/163166p1.html,Tokyo Bus Guide,http://www.ign.com/games/tokyo-bus-guide/dc-13166
4.8,Bad,"Did you ever wonder what it would be like to work construction? More importantly, did you ever want to drive one of those really big Caterpillar trucks? Now you can live out your fantasies with Matchbox Caterpillar Construction Zone. You will get to drive 11 different Caterpillar trucks including Track Type Tractor, Integrated Toolcarrier, Articulated Truck, Challenger Agricultural Tractor, Lexicon Combine, Log Skidder, Wheel Loader, Paver and Backhoe Loader. In each level, you are given a construction task to complete, such as building a pool or repairing a road. Luckily, George, the construction foreman gives you guidance. If you listen to him, you should be able to build everything in Matchbox Caterpillar Construction Zone.",Realtime Associates,Action,5.0,Mediocre,GBC PC,22.99 USD,Mattel  Interactive,E for Everyone,,"http://www.ign.com/games/the-legend-of-zelda-oracle-of-seasons/gbc-16042,http://www.ign.com/games/the-legend-of-zelda-oracle-of-ages/gbc-16041,http://www.ign.com/games/batman-chaos-in-gotham/gbc-14474,http://www.ign.com/games/pokemon-silver-version/gbc-16709,http://www.ign.com/games/pokemon-gold-version/gbc-12865,http://www.ign.com/games/pokemon-crystal-version/gbc-15402",December 1999,http://gameboy.ign.com/articles/163/163352p1.html,Matchbox Caterpillar Construction Zone,http://www.ign.com/games/matchbox-caterpillar-construction-zone/gbc-13352
7.3,Good,"The maniacal motorbike mayhem returns, and this time it's about revenge. Your buddy Spaz has been jailed, and it's up to you is to break him out. In order to do that, you'll have to join a motorcycle gang and move up through the organization by succeeding at challenges and winning races. If you'd rather, you can play on the square side of thing as a copper in Five-O mode, a cops-and-robbers chase. The game includes five multiplayer modes, including an awesome Sidecar mode, in which one player does the driving while the other does the shooting. This installment of ROAD RASH features 45 attack combos and Super Moves, plus 11 awesome weapons including nunchakus, mace, crowbars, and a cattle prod. There are over 80 miles of interconnected road in this 3D epic, meaning you'll have to play for a long time to see everything there is to see. With more than 100 different races, the game is full of surprises around every corner. Enjoy the 15 new bikes, six types of sidecars, and the sweet new soundtrack of Road Rash: Jailbreak.",Electronic Arts,Racing,7.0,Good,PS GBA GCN,7.99 USD,Electronic Arts,T for Teen,"Animated Violence, Mild Language","http://www.ign.com/games/gran-turismo-1998/ps-2226,http://www.ign.com/games/crash-team-racing/ps-11595,http://www.ign.com/games/gran-turismo-2/ps-11426,http://www.ign.com/games/crash-team-racing/ps-11595,http://www.ign.com/games/hot-shots-golf-2/ps-13666,http://www.ign.com/games/one-piece-mansion/ps-488410,http://www.ign.com/games/final-fantasy-vii/ps-494,http://www.ign.com/games/final-fantasy-viii/ps-3847,http://www.ign.com/games/baldurs-gate/ps-13673","January 26, 2000",http://psx.ign.com/articles/161/161652p1.html,Road Rash: Jailbreak,http://www.ign.com/games/road-rash-jailbreak/ps-11652
8.3,Great,"From the award-winning creators of Jane's F-15, Jane's F/A-18 is a stunningly realistic PC simulator for the US Navy's newest front-line carrier strike fighter, the cutting-edge F-18E Super Hornet. The Super Hornet is a carrier-based multi-role attack fighter capable of striking almost anywhere in the world, thanks to the global range of the US Navy's carrier strike forces and the increased combat radius of the new Super Hornet.

Earlier versions of the F-18, launching from carriers in the Red Sea and Persian Gulf, decimated Iraqi positions in operation Desert Storm and were immortalized in countless Hollywood productions. Featuring a bigger weapons load, faster top speeds, a stealthier radar signiture and countless technological advancements over it's predicessors, the F/A-18 Super Hornet will lead US carrier-launched air assaults well into the new millinium.",Jane's Combat Simulations,Flight,8.5,Great,PC,19.99 USD,Electronic Arts,T for Teen,"Animated Violence, Mild Language","http://www.ign.com/games/squadron-42/pc-20046151,http://www.ign.com/games/star-citizen/pc-144978,http://www.ign.com/games/microsoft-flight/pc-83711,http://www.ign.com/games/mechwarrior-online/pc-18954,http://www.ign.com/games/stardew-valley/pc-20001247,http://www.ign.com/games/omerta-city-of-gangsters-134706/pc-129676,http://www.ign.com/games/grand-theft-auto-online/pc-20019837,http://www.ign.com/games/mass-effect-andromeda/pc-20034220,http://www.ign.com/games/the-witcher-3-wild-hunt-blood-and-wine/pc-20035505","Jan 18, 2000",http://pc.ign.com/articles/163/163961p1.html,Jane's F/A-18 Simulator,http://www.ign.com/games/janes-fa-18-simulator/pc-13961
8.2,Great,"Grab your helmet and drive on up to Top Gear Pocket 2, which features 36 courses and 15 authentic road rally cars. More than just an updated sequel, this racing game is packed with mechanic's gadgets and gizmos. For instance, now you can modify your car before a race--tweak the suspension, transmission, steering, or even change the engines. Pick the parts you'll need to leave everyone else in your rear-view mirror. Winning provides you with enough spending money to customize your ride at the garage or paint shop. With both single-player and versus modes, you can test your modified cars against your Game Boy Color or your best friend.",Kemco,Racing,8.0,Great,GBC,35.99 USD,"Vatical Entertainment, Kemco",E for Everyone,No Descriptors,"http://www.ign.com/games/hot-wheels-stunt-track-driver/gbc-13350,http://www.ign.com/games/test-drive-cycles/gbc-12230,http://www.ign.com/games/grand-theft-auto-ii/gbc-15416,http://www.ign.com/games/pokemon-silver-version/gbc-16709,http://www.ign.com/games/pokemon-gold-version/gbc-12865,http://www.ign.com/games/pokemon-crystal-version/gbc-15402",January 2000,http://gameboy.ign.com/articles/162/162213p1.html,Top Gear Pocket 2,http://www.ign.com/games/top-gear-pocket-2/gbc-12213
7.4,Good,"Saga Frontier 2 is a unique role playing adventure game that consists of three innovative battle modes: Duel, Team and Strategic. The player can control an individual character, a team, or several units to fight in battles bringing depth and precision to the combat sequences. One unique aspect of this game is the fluid nature of time, as the plot frequently makes jumps both forward and backward in order to flesh out the narrative.",Square,RPG,7.0,Good,PS,17.99 USD,"Square, Square Electronic Arts (US)",T for Teen,"Mild Animated Violence, Suggestive Themes","http://www.ign.com/games/final-fantasy-vii/ps-494,http://www.ign.com/games/final-fantasy-viii/ps-3847,http://www.ign.com/games/baldurs-gate/ps-13673,http://www.ign.com/games/final-fantasy-vii/ps-494,http://www.ign.com/games/final-fantasy-viii/ps-3847,http://www.ign.com/games/baldurs-gate/ps-13673","February 16, 2000",http://psx.ign.com/articles/161/161162p1.html,Saga Frontier 2,http://www.ign.com/games/saga-frontier-2/ps-11162
